,Issue_id_1,Issue_id_2,Resolution,Title_1,Title_2,same_comp,same_prio,same_tw
721,SPARK-1064,SPARK-1065,Fixed,Make it possible to use cluster's Hadoop jars when running against YARN,PySpark runs out of memory with large broadcast variables,0,1,1
722,SPARK-1065,SPARK-1066,Fixed,PySpark runs out of memory with large broadcast variables,Improve Developer Documentation,0,1,1
723,SPARK-1068,SPARK-1069,Fixed,Worker.scala should kill drivers in method postStop(),Provide binary compatibility in Spark 1.X releases,0,1,1
724,SPARK-1069,SPARK-1070,Fixed,Provide binary compatibility in Spark 1.X releases,Add check for JIRA ticket in the Github pull request title/summary with CI,0,0,1
725,SPARK-1070,SPARK-1071,Won't Fix,Add check for JIRA ticket in the Github pull request title/summary with CI,Tidy logging strategy and use of log4j,0,1,1
726,SPARK-1072,SPARK-1073,Fixed,Use binary search for RangePartitioner when there is more than 1000 partitions,GitHub PR squasher has bad titles,0,0,1
727,SPARK-1073,SPARK-1074,Fixed,GitHub PR squasher has bad titles,JavaPairRDD as Object File,0,0,1
728,SPARK-1074,SPARK-1075,Not A Problem,JavaPairRDD as Object File,Fix simple doc typo in Spark Streaming Custom Receiver,0,1,1
729,SPARK-1075,SPARK-1076,Fixed,Fix simple doc typo in Spark Streaming Custom Receiver,Adding zipWithIndex and zipWithUniqueId to RDD,0,0,1
730,SPARK-1076,SPARK-1077,Fixed,Adding zipWithIndex and zipWithUniqueId to RDD,Highlighted codes are not displayed properly in docs,0,0,1
731,SPARK-1077,SPARK-1078,Won't Fix,Highlighted codes are not displayed properly in docs,Replace lift-json with json4s-jackson,0,1,1
732,SPARK-1078,SPARK-1079,Fixed,Replace lift-json with json4s-jackson,EC2 scripts should allow mounting as XFS or EXT4,0,0,1
733,SPARK-1079,SPARK-1080,Won't Fix,EC2 scripts should allow mounting as XFS or EXT4,ZK PersistenceEngine does not respect zookeeper dir,0,1,1
734,SPARK-1080,SPARK-1081,Fixed,ZK PersistenceEngine does not respect zookeeper dir,Allow inferring number of cores with local[*],0,0,1
735,SPARK-1081,SPARK-1082,Fixed,Allow inferring number of cores with local[*],Use Curator for ZK interaction in standalone cluster,0,0,1
736,SPARK-1082,SPARK-1083,Won't Fix,Use Curator for ZK interaction in standalone cluster,Build fail,0,1,1
737,SPARK-1083,SPARK-1084,Cannot Reproduce,Build fail,Fix most build warnings,0,0,1
738,SPARK-1084,SPARK-1085,Fixed,Fix most build warnings,Fix Jenkins pull request builder for branch-0.9 (scalastyle command not found),0,0,1
739,SPARK-1085,SPARK-1086,Fixed,Fix Jenkins pull request builder for branch-0.9 (scalastyle command not found),Some corner case during HA master switching?,0,1,1
740,SPARK-1087,SPARK-1088,Fixed,Separate file for traceback and callsite related functions,Create a script for running tests,0,1,1
741,SPARK-1088,SPARK-1089,Fixed,Create a script for running tests,ADD_JARS regression in Spark 0.9.0,0,0,1
742,SPARK-1089,SPARK-1090,Fixed,ADD_JARS regression in Spark 0.9.0,spark-shell should print help information about parameters and should allow user to configure exe memory,0,0,1
743,SPARK-1090,SPARK-1091,Fixed,spark-shell should print help information about parameters and should allow user to configure exe memory,Cloudpickle does not work correctly for some methods that use a splat,0,1,1
744,SPARK-1092,SPARK-1093,Won't Fix,SparkContext should not read SPARK_MEM to set memory usage of executors,API Stability in Spark 1.X (Umbrella),1,0,1
745,SPARK-1093,SPARK-1094,Fixed,API Stability in Spark 1.X (Umbrella),Enforce Binary Compatibility in Spark Build,1,0,1
746,SPARK-1094,SPARK-1095,Fixed,Enforce Binary Compatibility in Spark Build,Ensure all public methods return explicit types,1,1,1
747,SPARK-1096,SPARK-1097,Fixed,Add Scalastyle Plug-in For Spaces after Comments,ConcurrentModificationException,0,1,1
748,SPARK-1098,SPARK-1099,Fixed,Cleanup and document ClassTag stuff in Java API,Add a new small files input for MLlib; which will return an RDD[(fileName; content)],0,0,1
749,SPARK-1099,SPARK-1100,Fixed,Add a new small files input for MLlib; which will return an RDD[(fileName; content)],saveAsTextFile shouldn't clobber by default,0,0,1
750,SPARK-1100,SPARK-1101,Fixed,saveAsTextFile shouldn't clobber by default,Umbrella for hardening Spark on YARN,0,1,1
751,SPARK-1101,SPARK-1102,Fixed,Umbrella for hardening Spark on YARN,Create a saveAsNewAPIHadoopDataset method,0,0,1
752,SPARK-1102,SPARK-1103,Fixed,Create a saveAsNewAPIHadoopDataset method,Garbage collect RDD information inside of Spark,0,0,1
753,SPARK-1103,SPARK-1104,Fixed,Garbage collect RDD information inside of Spark,Worker should not block while killing executors,0,0,1
754,SPARK-1104,SPARK-1105,Fixed,Worker should not block while killing executors,config.yml has an error version number,0,1,1
755,SPARK-1105,SPARK-1106,Fixed,config.yml has an error version number,check key name and identity file before launch a cluster,0,0,1
756,SPARK-1106,SPARK-1107,Fixed,check key name and identity file before launch a cluster,Add shutdown hook on executor stop to stop running tasks,0,0,1
757,SPARK-1107,SPARK-1108,Unresolved,Add shutdown hook on executor stop to stop running tasks,saveAsNewAPIHadoopFile throws NPE with TableOutputFormat,1,0,1
758,SPARK-1108,SPARK-1109,Fixed,saveAsNewAPIHadoopFile throws NPE with TableOutputFormat,wrong API docs for pyspark map function,0,0,1
759,SPARK-1109,SPARK-1110,Fixed,wrong API docs for pyspark map function,Clean up and clarify use of SPARK_HOME,0,1,1
760,SPARK-1110,SPARK-1111,Fixed,Clean up and clarify use of SPARK_HOME,URL Validation Throws Error for HDFS URL's,0,0,1
761,SPARK-1111,SPARK-1112,Fixed,URL Validation Throws Error for HDFS URL's,When spark.akka.frameSize > 10; task results bigger than 10MiB block execution,0,1,1
762,SPARK-1112,SPARK-1113,Fixed,When spark.akka.frameSize > 10; task results bigger than 10MiB block execution,External Spilling Bug - hash collision causes NoSuchElementException,0,1,1
763,SPARK-1114,SPARK-1115,Fixed,Patch to allow PySpark to use existing JVM and Gateway,Better error message when python worker process dies,1,0,1
764,SPARK-1115,SPARK-1116,Fixed,Better error message when python worker process dies,The spark-shell will fail to start when Spark is deployed using the tar.gz file built by ./make-distribution.,0,1,1
765,SPARK-1116,SPARK-1117,Cannot Reproduce,The spark-shell will fail to start when Spark is deployed using the tar.gz file built by ./make-distribution.,Update accumulator docs,1,0,1
766,SPARK-1117,SPARK-1118,Fixed,Update accumulator docs,Executor state shows as KILLED even the application is finished normally,0,0,1
767,SPARK-1119,SPARK-1120,Fixed,Make examples and assembly jar naming consistent between maven/sbt,Send all dependency logging through slf4j,0,1,1
768,SPARK-1121,SPARK-1122,Fixed,Only add avro if the build is for Hadoop 0.23.X and SPARK_YARN is set,Collect the RDD and send to each partition to form a new RDD,0,0,1
769,SPARK-1122,SPARK-1123,Won't Fix,Collect the RDD and send to each partition to form a new RDD,saveAsNewAPIHadoopFile throws java.lang.InstantiationException all the time,1,0,1
770,SPARK-1123,SPARK-1124,Cannot Reproduce,saveAsNewAPIHadoopFile throws java.lang.InstantiationException all the time,Infinite NullPointerException failures due to a null in map output locations,1,1,1
771,SPARK-1124,SPARK-1125,Fixed,Infinite NullPointerException failures due to a null in map output locations,The maven build error for Spark Examples,0,1,1
772,SPARK-1125,SPARK-1126,Fixed,The maven build error for Spark Examples,spark-submit script for running compiled binaries,0,0,1
773,SPARK-1126,SPARK-1127,Fixed,spark-submit script for running compiled binaries,Add saveAsHBase to PairRDDFunctions,1,0,1
774,SPARK-1128,SPARK-1129,Fixed,hadoop task properties not set while using InputFormat,use a predefined seed when seed is zero in XORShiftRandom,0,1,1
775,SPARK-1129,SPARK-1130,Fixed,use a predefined seed when seed is zero in XORShiftRandom,Clean up project documentation navigation menu,1,0,1
776,SPARK-1130,SPARK-1131,Fixed,Clean up project documentation navigation menu,Better document the --args option for yarn-standalone mode,0,0,1
777,SPARK-1131,SPARK-1132,Fixed,Better document the --args option for yarn-standalone mode,Persisting Web UI through refactoring the SparkListener interface,0,0,1
778,SPARK-1133,SPARK-1134,Fixed,Use Iterable[X] in co-group and group-by signatures,ipython won't run standalone python script,0,0,1
779,SPARK-1134,SPARK-1135,Fixed,ipython won't run standalone python script,Anchors broken in latest docs due to bad JavaScript code,0,0,1
780,SPARK-1135,SPARK-1136,Fixed,Anchors broken in latest docs due to bad JavaScript code,Fix FaultToleranceTest for Docker 0.8.1,0,1,1
781,SPARK-1136,SPARK-1137,Fixed,Fix FaultToleranceTest for Docker 0.8.1,ZK Persistence Engine crashes if stored data has wrong serialVersionUID,0,0,1
782,SPARK-1137,SPARK-1138,Fixed,ZK Persistence Engine crashes if stored data has wrong serialVersionUID,Spark 0.9.0 does not work with Hadoop / HDFS,0,1,1
783,SPARK-1138,SPARK-1139,Cannot Reproduce,Spark 0.9.0 does not work with Hadoop / HDFS,APIs like saveAsNewAPIHadoopFile are actually a mixture of old and new Hadoop API,0,1,1
784,SPARK-1139,SPARK-1140,Won't Fix,APIs like saveAsNewAPIHadoopFile are actually a mixture of old and new Hadoop API,Remove references to ClusterScheduler,0,0,1
785,SPARK-1140,SPARK-1141,Fixed,Remove references to ClusterScheduler,Parallelize Task Serialization,1,0,1
786,SPARK-1142,SPARK-1143,Not A Problem,Allow adding jars on app submission; outside of code,ClusterSchedulerSuite (soon to be TaskSchedulerImplSuite) does not actually test the ClusterScheduler/TaskSchedulerImpl,0,0,1
787,SPARK-1143,SPARK-1144,Fixed,ClusterSchedulerSuite (soon to be TaskSchedulerImplSuite) does not actually test the ClusterScheduler/TaskSchedulerImpl,Run Apache RAT In SBT Build to Catch License Errors,0,0,1
788,SPARK-1144,SPARK-1145,Fixed,Run Apache RAT In SBT Build to Catch License Errors,Memory mapping with many small blocks can cause JVM allocation failures,0,0,1
789,SPARK-1145,SPARK-1146,Fixed,Memory mapping with many small blocks can cause JVM allocation failures,Vagrant to setup Spark cluster locally,0,1,1
790,SPARK-1146,SPARK-1147,Won't Fix,Vagrant to setup Spark cluster locally,spark-project.org still goes to http://spark.incubator.apache.org/,0,1,1
791,SPARK-1147,SPARK-1148,Fixed,spark-project.org still goes to http://spark.incubator.apache.org/,Suggestions for exception handling (avoid potential bugs),0,1,1
792,SPARK-1149,SPARK-1150,Fixed,Bad partitioners can cause Spark to hang,repo location in create_release script out of date,0,1,1
793,SPARK-1150,SPARK-1151,Fixed,repo location in create_release script out of date,dev merge_spark_pr.py still references incubator-spark,0,0,1
794,SPARK-1151,SPARK-1152,Fixed,dev merge_spark_pr.py still references incubator-spark,ArrayStoreException on mapping RDD on cluster,0,0,1
795,SPARK-1155,SPARK-1156,Invalid,Clean up and document use of SparkEnv,Allow spark-ec2 to login to a cluster with 0 slaves,0,0,1
796,SPARK-1156,SPARK-1157,Fixed,Allow spark-ec2 to login to a cluster with 0 slaves,L-BFGS Optimizer,0,0,1
797,SPARK-1157,SPARK-1158,Fixed,L-BFGS Optimizer,Fix flaky RateLimitedOutputStreamSuite,1,1,1
798,SPARK-1158,SPARK-1159,Fixed,Fix flaky RateLimitedOutputStreamSuite,Add Shortest-path computations to graphx.lib,0,0,1
799,SPARK-1160,SPARK-1161,Fixed,Deprecate RDD.toArray,Add saveAsObjectFile and SparkContext.objectFile in Python,0,0,1
800,SPARK-1161,SPARK-1162,Fixed,Add saveAsObjectFile and SparkContext.objectFile in Python,Add top() and takeOrdered() to PySpark,1,0,1
801,SPARK-1162,SPARK-1163,Fixed,Add top() and takeOrdered() to PySpark,Miscellaneous missing PySpark methods,1,0,1
802,SPARK-1163,SPARK-1164,Fixed,Miscellaneous missing PySpark methods,Deprecate RDD.reduceByKeyToDriver,0,0,1
803,SPARK-1164,SPARK-1166,Fixed,Deprecate RDD.reduceByKeyToDriver,leftover vpc_id may block the creation of new ec2 cluster,0,0,1
804,SPARK-1166,SPARK-1167,Cannot Reproduce,leftover vpc_id may block the creation of new ec2 cluster,Remove metrics-ganglia from default build due to LGPL issue,0,0,1
805,SPARK-1167,SPARK-1168,Fixed,Remove metrics-ganglia from default build due to LGPL issue,Add foldByKey to PySpark,0,0,1
806,SPARK-1168,SPARK-1169,Fixed,Add foldByKey to PySpark,Add countApproxDistinctByKey to PySpark,1,1,1
807,SPARK-1169,SPARK-1170,Won't Fix,Add countApproxDistinctByKey to PySpark,Add histogram() to PySpark,1,1,1
808,SPARK-1171,SPARK-1172,Fixed,when executor is removed; we should reduce totalCores instead of just freeCores on that executor ,Improve naming of the BlockManager classes,0,0,1
809,SPARK-1172,SPARK-1173,Won't Fix,Improve naming of the BlockManager classes,Improve scala streaming docs,0,1,1
810,SPARK-1173,SPARK-1174,Fixed,Improve scala streaming docs,Adding port configuration for HttpFileServer,0,1,1
811,SPARK-1174,SPARK-1175,Duplicate,Adding port configuration for HttpFileServer,on shutting down a long running job; the cluster does not accept new jobs and gets hung,1,0,1
812,SPARK-1175,SPARK-1176,Fixed,on shutting down a long running job; the cluster does not accept new jobs and gets hung,Adding port configuration for HttpBroadcast,1,0,1
813,SPARK-1176,SPARK-1177,Fixed,Adding port configuration for HttpBroadcast,Allow SPARK_JAR to be set in system properties,1,1,1
814,SPARK-1177,SPARK-1178,Fixed,Allow SPARK_JAR to be set in system properties,missing document about spark.scheduler.revive.interval,0,0,1
815,SPARK-1178,SPARK-1179,Fixed,missing document about spark.scheduler.revive.interval,Allow SPARK_YARN_APP_JAR to be set in system properties,0,0,1
816,SPARK-1179,SPARK-1180,Won't Fix,Allow SPARK_YARN_APP_JAR to be set in system properties,Allow to provide a custom persistence engine,0,1,1
817,SPARK-1181,SPARK-1182,Won't Fix,'mvn test' fails out of the box since sbt assembly does not necessarily exist,Sort the configuration parameters in configuration.md,0,0,1
818,SPARK-1182,SPARK-1183,Fixed,Sort the configuration parameters in configuration.md,"Inconsistent meaning of ""worker"" in docs",1,0,1
819,SPARK-1183,SPARK-1184,Fixed,"Inconsistent meaning of ""worker"" in docs",Update the distribution tar.gz to include spark-assembly jar,0,1,1
820,SPARK-1184,SPARK-1185,Fixed,Update the distribution tar.gz to include spark-assembly jar,"In Spark Programming Guide; ""Master URLs"" should mention yarn-client",0,1,1
821,SPARK-1185,SPARK-1186,Fixed,"In Spark Programming Guide; ""Master URLs"" should mention yarn-client",Enrich the Spark Shell to support additional arguments.,0,1,1
822,SPARK-1186,SPARK-1187,Fixed,Enrich the Spark Shell to support additional arguments.,Missing Pyspark methods,0,1,1
823,SPARK-1187,SPARK-1188,Fixed,Missing Pyspark methods,GraphX triplets not working properly,0,1,1
824,SPARK-1189,SPARK-1190,Fixed,Support authentication between Spark components,Do not initialize log4j if slf4j log4j backend is not being used,1,0,1
825,SPARK-1191,SPARK-1192,Won't Fix,Convert configs to use SparkConf,Around 30 parameters in Spark are used but undocumented and some are having confusing name,0,1,1
826,SPARK-1192,SPARK-1193,Won't Fix,Around 30 parameters in Spark are used but undocumented and some are having confusing name,Inconsistent indendation between pom.xmls,0,1,1
827,SPARK-1193,SPARK-1194,Fixed,Inconsistent indendation between pom.xmls,The same-RDD rule for cache replacement is not properly implemented,0,1,1
828,SPARK-1194,SPARK-1195,Fixed,The same-RDD rule for cache replacement is not properly implemented,set map_input_file environment variable in PipedRDD,1,1,1
829,SPARK-1195,SPARK-1196,Fixed,set map_input_file environment variable in PipedRDD,val variables not available within RDD map on cluster app; are on shell or local,1,1,1
830,SPARK-1196,SPARK-1197,Cannot Reproduce,val variables not available within RDD map on cluster app; are on shell or local,Rename yarn-standalone and fix up docs for running on YARN,0,1,1
831,SPARK-1197,SPARK-1198,Fixed,Rename yarn-standalone and fix up docs for running on YARN,Allow pipes tasks to run in different sub-directories,0,1,1
832,SPARK-1198,SPARK-1199,Fixed,Allow pipes tasks to run in different sub-directories,Type mismatch in Spark shell when using case class defined in shell,1,0,1
833,SPARK-1200,SPARK-1201,Won't Fix,Make it possible to use unmanaged AM in yarn-client mode,Do not materialize partitions whenever possible in BlockManager,0,1,1
834,SPARK-1202,SPARK-1203,Fixed,"Add a ""cancel"" button in the UI for stages",spark-shell on yarn-client race in properly getting hdfs delegation tokens,0,0,1
835,SPARK-1203,SPARK-1204,Fixed,spark-shell on yarn-client race in properly getting hdfs delegation tokens,EC2 scripts upload private key,0,0,1
836,SPARK-1204,SPARK-1205,Fixed,EC2 scripts upload private key,Clean up callSite/origin/generator,0,0,1
837,SPARK-1205,SPARK-1206,Fixed,Clean up callSite/origin/generator,Add python support for  average and other summary satistics,0,0,1
838,SPARK-1206,SPARK-1207,Implemented,Add python support for  average and other summary satistics,Make python support for histograms,1,1,1
839,SPARK-1208,SPARK-1209,Fixed,after some hours of working the :4040 monitoring UI stops working.,SparkHadoop{MapRed;MapReduce}Util should not use package org.apache.hadoop,0,1,1
840,SPARK-1209,SPARK-1210,Fixed,SparkHadoop{MapRed;MapReduce}Util should not use package org.apache.hadoop,Prevent ContextClassLoader of Actor from becoming ClassLoader of Executor,1,0,1
841,SPARK-1211,SPARK-1212,Fixed,"In ApplicationMaster; set spark.master system property to ""yarn-cluster""",Support sparse data in MLlib,0,0,1
842,SPARK-1212,SPARK-1213,Fixed,Support sparse data in MLlib,loss function error of logistic loss,1,0,1
843,SPARK-1213,SPARK-1214,Fixed,loss function error of logistic loss,0-1 labels ,1,1,1
844,SPARK-1214,SPARK-1215,Fixed,0-1 labels ,Clustering: Index out of bounds error,1,1,1
845,SPARK-1217,SPARK-1218,Fixed,Add proximal gradient updater.,Minibatch SGD with random sampling,1,1,1
846,SPARK-1218,SPARK-1219,Fixed,Minibatch SGD with random sampling,Minibatch SGD with disjoint partitions,1,1,1
847,SPARK-1219,SPARK-1220,Fixed,Minibatch SGD with disjoint partitions,Principal Component Analysis,1,1,1
848,SPARK-1220,SPARK-1221,Fixed,Principal Component Analysis,SVMs (+ regularized variants),1,1,1
849,SPARK-1221,SPARK-1222,Fixed,SVMs (+ regularized variants),Logistic Regression (+ regularized variants),1,1,1
850,SPARK-1222,SPARK-1223,Fixed,Logistic Regression (+ regularized variants),Linear Regression (+ regularized variants),1,1,1
851,SPARK-1223,SPARK-1224,Fixed,Linear Regression (+ regularized variants),Improving Documentation for MLlib,1,1,1
852,SPARK-1224,SPARK-1225,Fixed,Improving Documentation for MLlib,ROC AUC and Average Precision for Binary classification models,1,0,1
853,SPARK-1225,SPARK-1226,Fixed,ROC AUC and Average Precision for Binary classification models,Import breeze to Spark mllib,1,0,1
854,SPARK-1226,SPARK-1227,Fixed,Import breeze to Spark mllib,Diagnostics for Classification&Regression,1,1,1
855,SPARK-1227,SPARK-1228,Won't Fix,Diagnostics for Classification&Regression,confusion matrix,1,1,1
856,SPARK-1228,SPARK-1229,Implemented,confusion matrix,train on array (in addition to RDD),1,1,1
857,SPARK-1229,SPARK-1230,Not A Problem,train on array (in addition to RDD),Enable SparkContext.addJars() to load classes not in CLASSPATH,0,1,1
858,SPARK-1230,SPARK-1231,Incomplete,Enable SparkContext.addJars() to load classes not in CLASSPATH,DEAD worker should recover automaticly,0,1,1
859,SPARK-1232,SPARK-1233,Fixed,maven hadoop 0.23 yarn-alpha build broken,spark on hadoop 0.23 yarn fails to run: java.lang.NoSuchFieldException: DEFAULT_MAPREDUCE_APPLICATION_CLASSPATH,0,1,1
860,SPARK-1233,SPARK-1234,Fixed,spark on hadoop 0.23 yarn fails to run: java.lang.NoSuchFieldException: DEFAULT_MAPREDUCE_APPLICATION_CLASSPATH,clean up typos and grammar issues in Spark on YARN page,0,0,1
861,SPARK-1234,SPARK-1235,Won't Fix,clean up typos and grammar issues in Spark on YARN page,DAGScheduler ignores exceptions thrown in handleTaskCompletion,0,0,1
862,SPARK-1235,SPARK-1236,Fixed,DAGScheduler ignores exceptions thrown in handleTaskCompletion,Update Jetty to 9,0,0,1
863,SPARK-1237,SPARK-1238,Fixed,Implicit ALS is not efficient in computing YtY,User should be able to set a random seed in ALS,1,1,1
864,SPARK-1238,SPARK-1239,Fixed,User should be able to set a random seed in ALS,Improve fetching of map output statuses,0,1,1
865,SPARK-1239,SPARK-1240,Fixed,Improve fetching of map output statuses,takeSample called on empty RDD never ends,0,1,1
866,SPARK-1240,SPARK-1241,Fixed,takeSample called on empty RDD never ends,Support sliding in RDD,0,1,1
867,SPARK-1241,SPARK-1242,Fixed,Support sliding in RDD,Add aggregate to python API,0,0,1
868,SPARK-1242,SPARK-1243,Fixed,Add aggregate to python API,spark compilation error,0,0,1
869,SPARK-1243,SPARK-1244,Fixed,spark compilation error,Log an exception if map output status message exceeds frame size,0,1,1
870,SPARK-1244,SPARK-1245,Fixed,Log an exception if map output status message exceeds frame size,Can't read EMR HBase cluster from properly built Cloudera Spark Cluster.,0,1,1
871,SPARK-1245,SPARK-1246,Not A Problem,Can't read EMR HBase cluster from properly built Cloudera Spark Cluster.,Add min max to the stat counter.,0,0,1
872,SPARK-1246,SPARK-1247,Fixed,Add min max to the stat counter.,Support some of the RDD double functions on float and int as well.,1,1,1
873,SPARK-1247,SPARK-1248,Not A Problem,Support some of the RDD double functions on float and int as well.,Spark build error with Apache Hadoop(Cloudera CDH4),0,0,1
874,SPARK-1248,SPARK-1249,Fixed,Spark build error with Apache Hadoop(Cloudera CDH4),Cannot create graphx.Graph with no edges,0,1,1
875,SPARK-1249,SPARK-1250,Won't Fix,Cannot create graphx.Graph with no edges,Misleading comments in Spark startup scripts,0,0,1
876,SPARK-1250,SPARK-1251,Fixed,Misleading comments in Spark startup scripts,Support for optimizing and executing structured queries,0,0,1
877,SPARK-1251,SPARK-1252,Fixed,Support for optimizing and executing structured queries,On YARN; use container-log4j.properties for executors,0,0,1
878,SPARK-1252,SPARK-1253,Fixed,On YARN; use container-log4j.properties for executors,Need to load mapred-site.xml for reading mapreduce.application.classpath,1,0,1
879,SPARK-1253,SPARK-1254,Cannot Reproduce,Need to load mapred-site.xml for reading mapreduce.application.classpath,Consolidate; order; and harmonize repository declarations in Maven/SBT builds,0,0,1
880,SPARK-1254,SPARK-1255,Fixed,Consolidate; order; and harmonize repository declarations in Maven/SBT builds,Allow user to pass Serializer object instead of class name for shuffle.,0,0,1
881,SPARK-1255,SPARK-1256,Fixed,Allow user to pass Serializer object instead of class name for shuffle.,Master web UI and Worker web UI returns a 404 error,1,1,1
882,SPARK-1257,SPARK-1258,Fixed,Endless running task when using pyspark with input file containing a long line,RDD.countByValue optimization,0,0,1
883,SPARK-1258,SPARK-1259,Won't Fix,RDD.countByValue optimization,Make RDD locally iterable,1,0,1
884,SPARK-1259,SPARK-1260,Fixed,Make RDD locally iterable,faster construction of features with intercept,0,0,1
885,SPARK-1260,SPARK-1261,Fixed,faster construction of features with intercept,Docs don't explain how to run Python examples,0,1,1
886,SPARK-1261,SPARK-1262,Fixed,Docs don't explain how to run Python examples,Numerical drift in computation of matrix inverse leads to invalid results in ALS,0,1,1
887,SPARK-1262,SPARK-1263,Cannot Reproduce,Numerical drift in computation of matrix inverse leads to invalid results in ALS,Implicit ALS unnecessarily recomputes factor matrices,1,1,1
888,SPARK-1264,SPARK-1265,Won't Fix,Documentation for setting heap sizes across all configurations,Fix 404 not found error in UI introduced in Jetty 9.0 upgrade,0,1,1
889,SPARK-1266,SPARK-1267,Fixed,Persist factors in implicit ALS,Add a pip installer for PySpark,0,0,1
890,SPARK-1267,SPARK-1268,Fixed,Add a pip installer for PySpark,Adding XOR and AND-NOT operations to spark.util.collection.BitSet,0,1,1
891,SPARK-1268,SPARK-1269,Fixed,Adding XOR and AND-NOT operations to spark.util.collection.BitSet,Add Ability to Make Distribution with Tachyon,0,0,1
892,SPARK-1269,SPARK-1270,Fixed,Add Ability to Make Distribution with Tachyon,An optimized gradient descent implementation,0,1,1
893,SPARK-1270,SPARK-1271,Won't Fix,An optimized gradient descent implementation,[STREAMING] Annotate developer and experimental API's,0,0,1
894,SPARK-1272,SPARK-1273,Unresolved,Don't fail job if some local directories are buggy,MLlib v0.9.1 release,0,1,1
895,SPARK-1273,SPARK-1274,Fixed,MLlib v0.9.1 release,Add dev scripts to merge PRs and create releases from master to branch-0.9,0,1,1
896,SPARK-1274,SPARK-1275,Fixed,Add dev scripts to merge PRs and create releases from master to branch-0.9,Made SPARK_HOME/dev/tests executable,1,1,1
897,SPARK-1275,SPARK-1276,Fixed,Made SPARK_HOME/dev/tests executable,Add a Simple History Server for the UI for Yarn / Mesos,0,0,1
898,SPARK-1276,SPARK-1277,Fixed,Add a Simple History Server for the UI for Yarn / Mesos,Automatically set the UI persistence directory based on cluster settings,1,1,1
899,SPARK-1277,SPARK-1278,Won't Fix,Automatically set the UI persistence directory based on cluster settings,Improper use of SimpleDateFormat,1,0,1
900,SPARK-1278,SPARK-1279,Fixed,Improper use of SimpleDateFormat,"Stage.name return  ""apply at Option.scala:120""",0,0,1
901,SPARK-1280,SPARK-1281,Fixed,"Stage.name return ""apply at Option.scala:120""",Partitioning in ALS,0,0,1
902,SPARK-1281,SPARK-1282,Fixed,Partitioning in ALS,Create spark-contrib repo for 1.0,0,0,1
903,SPARK-1284,SPARK-1285,Fixed,pyspark hangs after IOError on Executor,Back porting streaming doc updates to 0.9,0,0,1
904,SPARK-1285,SPARK-1286,Fixed,Back porting streaming doc updates to 0.9,Make usage of spark-env.sh idempotent,0,1,1
