,Issue_id_1,Issue_id_2,Resolution,Title_1,Title_2,same_comp,same_prio,same_tw
1248,SPARK-1694,SPARK-1695,Fixed,Simplify ColumnBuilder/Accessor class hierarchy,java8-tests compiler error: package com.google.common.collections does not exist,0,0,1
1249,SPARK-1695,SPARK-1696,Fixed,java8-tests compiler error: package com.google.common.collections does not exist,RowMatrix.dspr is not using parameter alpha for DenseVector,0,0,1
1250,SPARK-1696,SPARK-1697,Fixed,RowMatrix.dspr is not using parameter alpha for DenseVector,Driver error org.apache.spark.scheduler.TaskSetManager - Loss was due to java.io.FileNotFoundException,0,0,1
1251,SPARK-1698,SPARK-1699,Won't Fix,Improve spark integration,Python relative should be independence from the core; becomes subprojects,0,1,1
1252,SPARK-1699,SPARK-1700,Unresolved,Python relative should be independence from the core; becomes subprojects,PythonRDD leaks socket descriptors during cancellation,0,1,1
1253,SPARK-1700,SPARK-1701,Fixed,PythonRDD leaks socket descriptors during cancellation,"Inconsistent naming: ""slice"" or ""partition""",0,0,1
1254,SPARK-1701,SPARK-1702,Fixed,"Inconsistent naming: ""slice"" or ""partition""",Mesos executor won't start because of a ClassNotFoundException,0,0,1
1255,SPARK-1702,SPARK-1703,Cannot Reproduce,Mesos executor won't start because of a ClassNotFoundException,Warn users if Spark is run on JRE6 but compiled with JDK7,0,0,1
1256,SPARK-1703,SPARK-1704,Fixed,Warn users if Spark is run on JRE6 but compiled with JDK7,Support EXPLAIN in Spark SQL,0,0,1
1257,SPARK-1704,SPARK-1705,Fixed,Support EXPLAIN in Spark SQL,Allow multiple instances per node with SPARK-EC2,0,1,1
1258,SPARK-1705,SPARK-1706,Fixed,Allow multiple instances per node with SPARK-EC2,Allow multiple executors per worker in Standalone mode,0,1,1
1259,SPARK-1706,SPARK-1707,Fixed,Allow multiple executors per worker in Standalone mode,Remove 3 second sleep before starting app on YARN,0,1,1
1260,SPARK-1707,SPARK-1708,Fixed,Remove 3 second sleep before starting app on YARN,Add ClassTag parameter on accumulator and broadcast methods,0,0,1
1261,SPARK-1708,SPARK-1709,Fixed,Add ClassTag parameter on accumulator and broadcast methods,"spark-submit should use ""main class"" attribute of JAR if no --class is given",0,0,1
1262,SPARK-1709,SPARK-1710,Fixed,"spark-submit should use ""main class"" attribute of JAR if no --class is given","spark-submit should print better errors than ""InvocationTargetException""",1,1,1
1263,SPARK-1710,SPARK-1711,Fixed,"spark-submit should print better errors than ""InvocationTargetException""",We should not use two build tools at the same time; should remove one of them,0,0,1
1264,SPARK-1711,SPARK-1712,Duplicate,We should not use two build tools at the same time; should remove one of them,ParallelCollectionRDD operations hanging forever without any error messages ,0,1,1
1265,SPARK-1712,SPARK-1713,Fixed,ParallelCollectionRDD operations hanging forever without any error messages ,YarnAllocationHandler starts a thread for every executor it runs,0,1,1
1266,SPARK-1713,SPARK-1714,Fixed,YarnAllocationHandler starts a thread for every executor it runs,Take advantage of AMRMClient APIs to simplify logic in YarnAllocationHandler,1,1,1
1267,SPARK-1715,SPARK-1716,Won't Fix,Ensure actor is self-contained in DAGScheduler,EC2 script should exit with non-zero code on UsageError,0,1,1
1268,SPARK-1716,SPARK-1717,Fixed,EC2 script should exit with non-zero code on UsageError,spark-ec2.py sometimes doesn't wait long enough for EC2 to stand up,1,0,1
1269,SPARK-1717,SPARK-1718,Fixed,spark-ec2.py sometimes doesn't wait long enough for EC2 to stand up,pyspark doesn't work with assembly jar containing over 65536 files/dirs built on redhat ,0,0,1
1270,SPARK-1719,SPARK-1721,Fixed,spark.executor.extraLibraryPath isn't applied on yarn,Classloaders not used correctly in Mesos,0,0,1
1271,SPARK-1721,SPARK-1722,Fixed,Classloaders not used correctly in Mesos,Unable to create KafkaStream,0,0,1
1272,SPARK-1722,SPARK-1723,Invalid,Unable to create KafkaStream,Add saveAsLibSVMFile,0,1,1
1273,SPARK-1723,SPARK-1724,Fixed,Add saveAsLibSVMFile,Add appendBias,1,1,1
1274,SPARK-1724,SPARK-1725,Fixed,Add appendBias,Can't use broadcast variables in pyspark on Mesos because pyspark isn't added to PYTHONPATH,0,0,1
1275,SPARK-1725,SPARK-1726,Fixed,Can't use broadcast variables in pyspark on Mesos because pyspark isn't added to PYTHONPATH,Tasks that fail to serialize remain in active stages forever.,0,0,1
1276,SPARK-1726,SPARK-1727,Fixed,Tasks that fail to serialize remain in active stages forever.,Correct small compile errors; typos; and markdown issues in (primarly) MLlib docs,0,0,1
1277,SPARK-1727,SPARK-1728,Fixed,Correct small compile errors; typos; and markdown issues in (primarly) MLlib docs,JavaRDDLike.mapPartitionsWithIndex requires ClassTag,0,0,1
1278,SPARK-1728,SPARK-1729,Fixed,JavaRDDLike.mapPartitionsWithIndex requires ClassTag,Make Flume pull data from source; rather than the current push model,0,0,1
1279,SPARK-1729,SPARK-1730,Fixed,Make Flume pull data from source; rather than the current push model,Make receiver store data reliably to avoid data-loss on executor failures,1,1,1
1280,SPARK-1730,SPARK-1731,Fixed,Make receiver store data reliably to avoid data-loss on executor failures,PySpark broadcast values with custom classes won't depickle properly,0,1,1
1281,SPARK-1731,SPARK-1732,Fixed,PySpark broadcast values with custom classes won't depickle properly,Support for primitive nulls in SparkSQL,0,1,1
1282,SPARK-1732,SPARK-1733,Fixed,Support for primitive nulls in SparkSQL,Pluggable storage support for BlockManager,0,1,1
1283,SPARK-1733,SPARK-1734,Won't Fix,Pluggable storage support for BlockManager,"spark-submit throws an exception: Exception in thread ""main"" java.lang.ClassNotFoundException: org.apache.spark.broadcast.TorrentBroadcastFactory",0,0,1
1284,SPARK-1734,SPARK-1735,Fixed,"spark-submit throws an exception: Exception in thread ""main"" java.lang.ClassNotFoundException: org.apache.spark.broadcast.TorrentBroadcastFactory",Make distribution script has missing profiles for special hadoop versions,0,0,1
1285,SPARK-1735,SPARK-1736,Fixed,Make distribution script has missing profiles for special hadoop versions,spark-submit on Windows,0,0,1
1286,SPARK-1736,SPARK-1737,Fixed,spark-submit on Windows,Warn rather than fail when Java 7+ is used to create distributions,0,0,1
1287,SPARK-1737,SPARK-1738,Fixed,Warn rather than fail when Java 7+ is used to create distributions,Is spark-debugger still available?,0,0,1
1288,SPARK-1738,SPARK-1739,Fixed,Is spark-debugger still available?,Close PR's after period of inactivity,0,0,1
1289,SPARK-1739,SPARK-1740,Unresolved,Close PR's after period of inactivity,Pyspark cancellation kills unrelated pyspark workers,0,0,1
1290,SPARK-1740,SPARK-1741,Fixed,Pyspark cancellation kills unrelated pyspark workers,Add predict(JavaRDD) to predictive models,0,0,1
1291,SPARK-1741,SPARK-1742,Fixed,Add predict(JavaRDD) to predictive models,Profiler for Spark,0,1,1
1292,SPARK-1742,SPARK-1743,Not A Problem,Profiler for Spark,Add mllib.util.MLUtils.{loadLibSVMFile; saveAsLibSVMFile} to pyspark,0,1,1
1293,SPARK-1743,SPARK-1744,Fixed,Add mllib.util.MLUtils.{loadLibSVMFile; saveAsLibSVMFile} to pyspark,Document how to pass in preferredNodeLocationData,0,1,1
1294,SPARK-1744,SPARK-1745,Won't Fix,Document how to pass in preferredNodeLocationData,TaskContext.interrupted should probably not be a constructor argument,0,0,1
1295,SPARK-1745,SPARK-1746,Fixed,TaskContext.interrupted should probably not be a constructor argument,Support setting SPARK_JAVA_OPTS on executors for backwards compatibility,0,0,1
1296,SPARK-1746,SPARK-1747,Fixed,Support setting SPARK_JAVA_OPTS on executors for backwards compatibility,check for Spark on Yarn ApplicationMaster split brain,0,0,1
1297,SPARK-1747,SPARK-1748,Unresolved,check for Spark on Yarn ApplicationMaster split brain,I installed the spark_standalone;but I did not know how to use sbt to compile the programme of spark?,0,1,1
1298,SPARK-1748,SPARK-1749,Done,I installed the spark_standalone;but I did not know how to use sbt to compile the programme of spark?,DAGScheduler supervisor strategy broken with Mesos,0,0,1
1299,SPARK-1749,SPARK-1750,Fixed,DAGScheduler supervisor strategy broken with Mesos,EdgePartition is not serialized properly,0,0,1
1300,SPARK-1750,SPARK-1751,Fixed,EdgePartition is not serialized properly,spark ec2 scripts should check for SSh to be up,0,0,1
1301,SPARK-1751,SPARK-1752,Fixed,spark ec2 scripts should check for SSh to be up,Standardize input/output format for vectors and labeled points,0,0,1
1302,SPARK-1752,SPARK-1753,Fixed,Standardize input/output format for vectors and labeled points,PySpark on YARN does not work on assembly jar built on Red Hat based OS,0,0,1
1303,SPARK-1753,SPARK-1754,Fixed,PySpark on YARN does not work on assembly jar built on Red Hat based OS,Add missing arithmetic DSL operations.,0,1,1
1304,SPARK-1754,SPARK-1755,Fixed,Add missing arithmetic DSL operations.,Spark-submit --name does not resolve to application name on YARN,0,0,1
1305,SPARK-1757,SPARK-1758,Fixed,Support saving null primitives with .saveAsParquetFile(),failing test org.apache.spark.JavaAPISuite.wholeTextFiles,0,1,1
1306,SPARK-1758,SPARK-1759,Cannot Reproduce,failing test org.apache.spark.JavaAPISuite.wholeTextFiles,sbt/sbt package fail cause by directory,0,1,1
1307,SPARK-1759,SPARK-1760,Not A Problem,sbt/sbt package fail cause by directory, mvn  -Dsuites=*  test throw an ClassNotFoundException,0,1,1
1308,SPARK-1760,SPARK-1761,Fixed, mvn  -Dsuites=*  test throw an ClassNotFoundException,Add broadcast information on SparkUI storage tab,0,1,1
1309,SPARK-1762,SPARK-1763,Won't Fix,Add functionality to pin RDDs in cache,SparkSubmit arguments do not propagate to python files on YARN,0,0,1
1310,SPARK-1763,SPARK-1764,Cannot Reproduce,SparkSubmit arguments do not propagate to python files on YARN,EOF reached before Python server acknowledged,0,1,1
1311,SPARK-1764,SPARK-1765,Fixed,EOF reached before Python server acknowledged,Modify a typo in monitoring.md,0,0,1
1312,SPARK-1765,SPARK-1766,Fixed,Modify a typo in monitoring.md,Move reduceByKey definitions next to each other in PairRDDFunctions,0,0,1
1313,SPARK-1766,SPARK-1767,Fixed,Move reduceByKey definitions next to each other in PairRDDFunctions,Prefer HDFS-cached replicas when scheduling data-local tasks,1,0,1
1314,SPARK-1767,SPARK-1768,Fixed,Prefer HDFS-cached replicas when scheduling data-local tasks,History Server enhancements,1,1,1
1315,SPARK-1768,SPARK-1769,Fixed,History Server enhancements,Executor loss can cause race condition in Pool,1,1,1
1316,SPARK-1769,SPARK-1770,Fixed,Executor loss can cause race condition in Pool,repartition and coalesce(shuffle=true) put objects with the same key in the same bucket,0,0,1
1317,SPARK-1770,SPARK-1771,Fixed,repartition and coalesce(shuffle=true) put objects with the same key in the same bucket,CoarseGrainedSchedulerBackend is not resilient to Akka restarts,0,0,1
1318,SPARK-1771,SPARK-1772,Won't Fix,CoarseGrainedSchedulerBackend is not resilient to Akka restarts,Spark executors do not successfully die on OOM,1,1,1
1319,SPARK-1772,SPARK-1773,Fixed,Spark executors do not successfully die on OOM,Standalone cluster docs should be updated to reflect Spark Submit,0,0,1
1320,SPARK-1773,SPARK-1774,Fixed,Standalone cluster docs should be updated to reflect Spark Submit,SparkSubmit --jars not working for yarn-client,0,1,1
1321,SPARK-1774,SPARK-1775,Fixed,SparkSubmit --jars not working for yarn-client,Unneeded lock in ShuffleMapTask.deserializeInfo,0,0,1
1322,SPARK-1775,SPARK-1776,Fixed,Unneeded lock in ShuffleMapTask.deserializeInfo,Have Spark's SBT build read dependencies from Maven,0,0,1
1323,SPARK-1776,SPARK-1777,Fixed,Have Spark's SBT build read dependencies from Maven,"Pass ""cached"" blocks directly to disk if memory is not large enough",0,0,1
1324,SPARK-1778,SPARK-1779,Fixed,Add 'limit' transformation to SchemaRDD.,Warning when spark.storage.memoryFraction is not between 0 and 1,0,1,1
1325,SPARK-1779,SPARK-1780,Fixed,Warning when spark.storage.memoryFraction is not between 0 and 1,Non-existent SPARK_DAEMON_OPTS is referred to in a few places,0,1,1
1326,SPARK-1780,SPARK-1781,Fixed,Non-existent SPARK_DAEMON_OPTS is referred to in a few places,Generalized validity checking for configuration parameters,0,0,1
1327,SPARK-1781,SPARK-1782,Won't Fix,Generalized validity checking for configuration parameters,svd for sparse matrix using ARPACK,0,0,1
1328,SPARK-1782,SPARK-1783,Fixed,svd for sparse matrix using ARPACK,Title contains html code in MLlib guide,0,0,1
1329,SPARK-1783,SPARK-1784,Fixed,Title contains html code in MLlib guide,Add a partitioner which partitions an RDD with each partition having specified # of keys,0,1,1
1330,SPARK-1784,SPARK-1785,Invalid,Add a partitioner which partitions an RDD with each partition having specified # of keys,Streaming requires receivers to be serializable,0,0,1
1331,SPARK-1785,SPARK-1786,Fixed,Streaming requires receivers to be serializable,Kryo Serialization Error in GraphX,0,1,1
1332,SPARK-1786,SPARK-1787,Fixed,Kryo Serialization Error in GraphX,Build failure on JDK8 :: SBT fails to load build configuration file,0,0,1
1333,SPARK-1788,SPARK-1789,Fixed,Upgrade Parquet to 1.4.3,Multiple versions of Netty dependencies cause FlumeStreamSuite failure,0,1,1
1334,SPARK-1789,SPARK-1790,Fixed,Multiple versions of Netty dependencies cause FlumeStreamSuite failure,Update EC2 scripts to support r3 instance types,0,1,1
1335,SPARK-1790,SPARK-1791,Fixed,Update EC2 scripts to support r3 instance types,SVM implementation does not use threshold parameter,0,1,1
1336,SPARK-1791,SPARK-1792,Fixed,SVM implementation does not use threshold parameter,Missing Spark-Shell Configure Options,0,1,1
1337,SPARK-1792,SPARK-1793,Fixed,Missing Spark-Shell Configure Options,Heavily duplicated test setup code in SVMSuite,0,0,1
1338,SPARK-1793,SPARK-1794,Fixed,Heavily duplicated test setup code in SVMSuite,Generic ADMM implementation for SVM; lasso; and L1-regularized logistic regression,1,1,1
1339,SPARK-1797,SPARK-1798,Not A Problem,streaming on hdfs can detected all new file; but the sum of all the rdd.count() not equals which had detected,Tests should clean up temp files,0,0,1
1340,SPARK-1798,SPARK-1799,Fixed,Tests should clean up temp files,Add init script to the debian packaging,0,0,1
1341,SPARK-1799,SPARK-1800,Won't Fix,Add init script to the debian packaging,Add broadcast hash join operator,0,1,1
1342,SPARK-1801,SPARK-1802,Fixed,Open up some private APIs related to creating new RDDs for developers,Audit dependency graph when Spark is built with -Phive,0,0,1
1343,SPARK-1803,SPARK-1804,Fixed,Rename test resources to be compatible with Windows FS,Mark 0.9.1 as released in JIRA,0,1,1
1344,SPARK-1804,SPARK-1805,Fixed,Mark 0.9.1 as released in JIRA,Error launching cluster when master and slave machines are of different virtualization types,0,0,1
1345,SPARK-1807,SPARK-1808,Won't Fix,Modify SPARK_EXECUTOR_URI to allow for script execution in Mesos.,bin/pyspark does not load default configuration properties,0,1,1
1346,SPARK-1808,SPARK-1809,Fixed,bin/pyspark does not load default configuration properties,Mesos backend doesn't respect HADOOP_CONF_DIR,0,1,1
1347,SPARK-1809,SPARK-1810,Unresolved,Mesos backend doesn't respect HADOOP_CONF_DIR,The spark tar ball does not unzip into a separate folder when un-tarred.,0,0,1
1348,SPARK-1810,SPARK-1811,Cannot Reproduce,The spark tar ball does not unzip into a separate folder when un-tarred.,Support resizable output buffer for kryo serializer,0,1,1
1349,SPARK-1814,SPARK-1815,Fixed,Splash page should include correct syntax for launching examples,SparkContext shouldn't be marked DeveloperApi,0,1,1
1350,SPARK-1815,SPARK-1816,Fixed,SparkContext shouldn't be marked DeveloperApi,LiveListenerBus dies if a listener throws an exception,1,0,1
1351,SPARK-1816,SPARK-1817,Fixed,LiveListenerBus dies if a listener throws an exception,RDD zip erroneous when partitions do not divide RDD count,1,0,1
1352,SPARK-1817,SPARK-1818,Fixed,RDD zip erroneous when partitions do not divide RDD count,Freshen Mesos docs,0,1,1
1353,SPARK-1818,SPARK-1819,Fixed,Freshen Mesos docs,Fix GetField.nullable.,0,1,1
1354,SPARK-1819,SPARK-1820,Fixed,Fix GetField.nullable.,Make GenerateMimaIgnore @DeveloperApi annotation aware.,0,1,1
1355,SPARK-1820,SPARK-1821,Fixed,Make GenerateMimaIgnore @DeveloperApi annotation aware.,Document History Server,0,1,1
1356,SPARK-1821,SPARK-1822,Implemented,Document History Server,SchemaRDD.count() should use the optimizer.,0,1,1
1357,SPARK-1822,SPARK-1823,Fixed,SchemaRDD.count() should use the optimizer.,ExternalAppendOnlyMap can still OOM if one key is very large,0,1,1
1358,SPARK-1823,SPARK-1824,Unresolved,ExternalAppendOnlyMap can still OOM if one key is very large,Python examples still take in <master>,0,1,1
1359,SPARK-1824,SPARK-1825,Fixed,Python examples still take in <master>,Windows Spark fails to work with Linux YARN,0,1,1
1360,SPARK-1826,SPARK-1827,Fixed,Some bad head notations in sparksql ,LICENSE and NOTICE files need a refresh to contain transitive dependency info,0,0,1
1361,SPARK-1827,SPARK-1828,Fixed,LICENSE and NOTICE files need a refresh to contain transitive dependency info,Created forked version of hive-exec that doesn't bundle other dependencies,0,1,1
1362,SPARK-1829,SPARK-1830,Fixed,"Sub-second durations shouldn't round to ""0 s""",Deploy failover; Make Persistence engine and LeaderAgent Pluggable.,0,0,1
1363,SPARK-1831,SPARK-1832,Invalid,"add the security guide to the ""More"" drop down menu",Executor UI improvement suggestions,0,1,1
1364,SPARK-1833,SPARK-1834,Fixed,Have an empty SparkContext constructor instead of relying on new SparkContext(new SparkConf()),NoSuchMethodError when invoking JavaPairRDD.reduce() in Java,1,1,1
1365,SPARK-1835,SPARK-1836,Won't Fix,sbt gen-idea includes both mesos and mesos with shaded-protobuf into dependencies,REPL $outer type mismatch causes lookup() and equals() problems,0,0,1
1366,SPARK-1837,SPARK-1838,Fixed,NumericRange should be partitioned in the same way as other sequences,On a YARN cluster; Spark doesn't run on local mode,0,1,1
1367,SPARK-1838,SPARK-1839,Not A Problem,On a YARN cluster; Spark doesn't run on local mode,PySpark take() does not launch a Spark job when it has to,0,1,1
1368,SPARK-1839,SPARK-1840,Fixed,PySpark take() does not launch a Spark job when it has to,SparkListenerBus prints out scary error message when terminating normally,0,1,1
1369,SPARK-1840,SPARK-1841,Fixed,SparkListenerBus prints out scary error message when terminating normally,update scalatest to version 2.1.5,0,1,1
1370,SPARK-1841,SPARK-1842,Fixed,update scalatest to version 2.1.5,update scala-logging-slf4j to version 2.1.2,1,1,1
1371,SPARK-1842,SPARK-1843,Won't Fix,update scala-logging-slf4j to version 2.1.2,Provide a simpler alternative to assemble-deps,0,1,1
1372,SPARK-1843,SPARK-1844,Fixed,Provide a simpler alternative to assemble-deps,Support maven-style dependency resolution in sbt build,1,1,1
1373,SPARK-1845,SPARK-1846,Fixed,Use AllScalaRegistrar for SparkSqlSerializer to register serializers of Scala collections.,RAT checks should exclude logs/ directory,0,1,1
1374,SPARK-1846,SPARK-1847,Fixed,RAT checks should exclude logs/ directory,Pushdown filters on non-required parquet columns,0,1,1
1375,SPARK-1847,SPARK-1848,Fixed,Pushdown filters on non-required parquet columns,Executors are mysteriously dying when using Spark on Mesos,0,1,1
1376,SPARK-1848,SPARK-1849,Cannot Reproduce,Executors are mysteriously dying when using Spark on Mesos,sc.textFile does not support non UTF-8 encodings,0,1,1
1377,SPARK-1850,SPARK-1851,Fixed,Bad exception if multiple jars exist when running PySpark,Upgrade Avro dependency to 1.7.6 so Spark can read Avro files,0,0,1
1378,SPARK-1851,SPARK-1852,Fixed,Upgrade Avro dependency to 1.7.6 so Spark can read Avro files,SparkSQL Queries with Sorts run before the user asks them to,0,0,1
1379,SPARK-1852,SPARK-1853,Fixed,SparkSQL Queries with Sorts run before the user asks them to,Show Streaming application code context (file; line number) in Spark Stages UI,0,1,1
1380,SPARK-1853,SPARK-1854,Fixed,Show Streaming application code context (file; line number) in Spark Stages UI,Add a version of StreamingContext.fileStream that take hadoop conf object,1,1,1
1381,SPARK-1854,SPARK-1855,Won't Fix,Add a version of StreamingContext.fileStream that take hadoop conf object,Provide memory-and-local-disk RDD checkpointing,0,1,1
1382,SPARK-1856,SPARK-1857,Fixed,Standardize MLlib interfaces,map() with lookup() causes exception,0,0,1
1383,SPARK-1857,SPARK-1858,Not A Problem,map() with lookup() causes exception,"Update ""third-party Hadoop distros"" doc to list more distros",0,1,1
1384,SPARK-1858,SPARK-1859,Fixed,"Update ""third-party Hadoop distros"" doc to list more distros",Linear; Ridge and Lasso Regressions with SGD yield unexpected results,0,1,1
1385,SPARK-1859,SPARK-1860,Not A Problem,Linear; Ridge and Lasso Regressions with SGD yield unexpected results,Standalone Worker cleanup should not clean up running executors,0,0,1
1386,SPARK-1861,SPARK-1862,Implemented,ArrayIndexOutOfBoundsException when reading bzip2 files,Add build support for MapR,0,1,1
1387,SPARK-1862,SPARK-1863,Fixed,Add build support for MapR,Allowing user jars to take precedence over Spark jars does not work as expected,0,0,1
1388,SPARK-1864,SPARK-1865,Fixed,Classpath not correctly sent to executors.,Improve behavior of cleanup of disk state,0,0,1
1389,SPARK-1865,SPARK-1866,Won't Fix,Improve behavior of cleanup of disk state,Closure cleaner does not null shadowed fields when outer scope is referenced,0,0,1
1390,SPARK-1866,SPARK-1867,Unresolved,Closure cleaner does not null shadowed fields when outer scope is referenced,Spark Documentation Error causes java.lang.IllegalStateException: unread block data,1,0,1
1391,SPARK-1867,SPARK-1868,Not A Problem,Spark Documentation Error causes java.lang.IllegalStateException: unread block data,Users should be allowed to cogroup at least 4 RDDs,0,1,1
1392,SPARK-1868,SPARK-1869,Fixed,Users should be allowed to cogroup at least 4 RDDs,`spark-shell --help` fails if called from outside spark home,0,0,1
1393,SPARK-1869,SPARK-1870,Fixed,`spark-shell --help` fails if called from outside spark home,Jars specified via --jars in spark-submit are not added to executor classpath for YARN,0,1,1
1394,SPARK-1870,SPARK-1871,Fixed,Jars specified via --jars in spark-submit are not added to executor classpath for YARN,Improve MLlib guide for v1.0,0,0,1
1395,SPARK-1871,SPARK-1872,Done,Improve MLlib guide for v1.0,Update api links for unidoc,1,1,1
1396,SPARK-1872,SPARK-1873,Fixed,Update api links for unidoc,Add README.md file when making distributions,0,0,1
1397,SPARK-1873,SPARK-1874,Fixed,Add README.md file when making distributions,Clean up MLlib sample data,0,0,1
1398,SPARK-1874,SPARK-1875,Fixed,Clean up MLlib sample data,NoClassDefFoundError: StringUtils when building against Hadoop 1,0,0,1
1399,SPARK-1875,SPARK-1876,Fixed,NoClassDefFoundError: StringUtils when building against Hadoop 1,Update Windows scripts to deal with latest distribution layout changes,0,1,1
1400,SPARK-1876,SPARK-1877,Fixed,Update Windows scripts to deal with latest distribution layout changes,ClassNotFoundException when loading RDD with serialized objects,0,0,1
1401,SPARK-1877,SPARK-1878,Fixed,ClassNotFoundException when loading RDD with serialized objects,Incorrect initialization order in JavaStreamingContext,0,1,1
1402,SPARK-1878,SPARK-1879,Fixed,Incorrect initialization order in JavaStreamingContext,Default PermGen size too small when using Hadoop2 and Hive,0,0,1
1403,SPARK-1879,SPARK-1880,Fixed,Default PermGen size too small when using Hadoop2 and Hive,Eliminate unnecessary job executions.,0,0,1
1404,SPARK-1880,SPARK-1881,Won't Fix,Eliminate unnecessary job executions.,Executor caching,0,0,1
1405,SPARK-1881,SPARK-1882,Not A Problem,Executor caching,Support dynamic memory sharing in Mesos,1,0,1
1406,SPARK-1882,SPARK-1883,Won't Fix,Support dynamic memory sharing in Mesos,spark graph.triplets does not return correct values,0,1,1
1407,SPARK-1884,SPARK-1885,Won't Fix,Shark failed to start,GraphX reduce function not working properly -- returns only 1 element,1,0,1
1408,SPARK-1885,SPARK-1886,Not A Problem,GraphX reduce function not working properly -- returns only 1 element,workers keep dying for uncaught exception of executor id not found ,0,1,1
1409,SPARK-1886,SPARK-1887,Fixed,workers keep dying for uncaught exception of executor id not found ,"Update ""Contributors Guide"" with useful data from past threads",0,0,1
1410,SPARK-1887,SPARK-1888,Unresolved,"Update ""Contributors Guide"" with useful data from past threads",enhance MEMORY_AND_DISK mode by dropping blocks in parallel,0,0,1
1411,SPARK-1889,SPARK-1890,Fixed,Apply splitConjunctivePredicates to join condition while finding join keys.,"add modify acls to the web UI for the ""kill"" button",0,0,1
1412,SPARK-1890,SPARK-1891,Fixed,"add modify acls to the web UI for the ""kill"" button",Add admin acls to the Web UI,1,0,1
1413,SPARK-1891,SPARK-1892,Fixed,Add admin acls to the Web UI,Add an OWL-QN optimizer for L1 regularized optimizations.,0,1,1
1414,SPARK-1892,SPARK-1893,Duplicate,Add an OWL-QN optimizer for L1 regularized optimizations.,Explain why running Spark Hive locally freezes,0,1,1
1415,SPARK-1893,SPARK-1894,Cannot Reproduce,Explain why running Spark Hive locally freezes,The default ec2 set-up ignores --driver-class-path,0,1,1
1416,SPARK-1894,SPARK-1895,Fixed,The default ec2 set-up ignores --driver-class-path,Run tests on windows,0,0,1
1417,SPARK-1895,SPARK-1896,Cannot Reproduce,Run tests on windows,MASTER masks spark.master in spark-shell,0,0,1
1418,SPARK-1896,SPARK-1897,Fixed,MASTER masks spark.master in spark-shell,Spark shell --jars (or spark.jars) doesn't work,1,1,1
