,Issue_id_1,Issue_id_2,Resolution,Title_1,Title_2,same_comp,same_prio,same_tw
342,SPARK-4025,SPARK-4141,Fixed,Don't show accumulator values in the task table on the stage detail page when there are no accumulators,Hide Accumulators column on stage page when no accumulators exist,1,1,1
343,SPARK-4037,SPARK-4103,Fixed,NPE in JDBC server when calling SET,Clean up SessionState in HiveContext,1,0,1
344,SPARK-4039,SPARK-12861,Won't Fix,KMeans support sparse cluster centers,Changes to support KMeans with large feature space,0,1,1
345,SPARK-4046,SPARK-7096,Fixed,Incorrect Java example on site,Java example for Streaming on site uses map instead of mapToPair,1,1,1
346,SPARK-4049,SPARK-16218,Unresolved,"Storage web UI ""fraction cached"" shows as > 100%","spark 1.4.1 ""Storage Fraction Cached""  was greater than 120%.And I recache the talbe in memory and find querying faster than before;May be its a bug.",0,1,1
347,SPARK-4078,SPARK-4132,Fixed,New FsPermission instance w/o FsPermission.createImmutable in eventlog,Spark uses incompatible HDFS API,1,0,1
348,SPARK-4092,SPARK-4157,Fixed,Input metrics don't work for coalesce()'d RDD's,Task input statistics incomplete when a task reads from multiple locations,1,0,1
349,SPARK-4105,SPARK-12418,Fixed,FAILED_TO_UNCOMPRESS(5) errors when fetching shuffle data with sort-based shuffle,spark shuffle FAILED_TO_UNCOMPRESS,0,0,1
350,SPARK-4123,SPARK-10359,Duplicate,Show dependency changes in pull requests,Enumerate Spark's dependencies in a file and diff against it for new pull requests ,0,0,1
351,SPARK-4131,SPARK-16255,Fixed,"Support ""Writing data into the filesystem from queries""","Spark2.0 doesn't support the following SQL statement:""insert into directory ""/u_qa_user/hive_testdata/test1/t1"" select * from d_test_tpc_2g_txt.auction"" while Hive supports",1,0,1
352,SPARK-4133,SPARK-4641,Fixed,PARSING_ERROR(2) when upgrading issues from 1.0.2 to 1.1.0,A FileNotFoundException happened in Hash Shuffle Manager,0,1,1
353,SPARK-4134,SPARK-11789,Fixed,Dynamic allocation: tone down scary executor lost messages when killing on purpose,Spark prints misleading error messages about losing executors,0,0,1
354,SPARK-4140,SPARK-4839,Fixed,Document the dynamic allocation feature,Adding documentations about dynamic resource allocation,0,1,1
355,SPARK-4151,SPARK-8159,Duplicate,Add string operation function trim; ltrim; rtrim; length to support SparkSql (HiveQL) ,Improve expression function coverage (Spark 1.5),1,0,1
356,SPARK-4160,SPARK-17978,Unresolved,Standalone cluster mode does not upload all needed jars to driver node,#NAME?,0,1,1
357,SPARK-4160,SPARK-16364,Unresolved,Standalone cluster mode does not upload all needed jars to driver node,Allow spark-submit to upload jars to nodes in cluster mode,0,0,1
358,SPARK-4169,SPARK-4271,Fixed,"[SQL] use beeline execute ""create table as""  thriftserver is not use ""hive""  user ;but the new hdfs dir's owner is ""hive""  ",jetty Server can't tryport+1,1,1,1
359,SPARK-4169,SPARK-4316,Fixed,"[SQL] use beeline execute ""create table as""  thriftserver is not use ""hive""  user ;but the new hdfs dir's owner is ""hive""  ",Utils.isBindCollision misjudges at Non-English environment,1,0,1
360,SPARK-4173,SPARK-4249,Fixed,EdgePartitionBuilder uses wrong value for first clustered index,A problem of EdgePartitionBuilder in Graphx,1,0,1
361,SPARK-4176,SPARK-4657,Fixed,Support decimals with precision > 18 in Parquet,Suport storing decimals in Parquet that don't fit in a LONG,1,1,1
362,SPARK-4181,SPARK-4694,Duplicate,Create separate options to control the client-mode AM resource allocation request,,0,0,1
363,SPARK-4184,SPARK-5960,Duplicate,Improve Spark Streaming documentation to address commonly-asked questions ,Allow AWS credentials to be passed to KinesisUtils.createStream(),1,1,1
364,SPARK-4188,SPARK-4238,Fixed,Shuffle fetches should be retried at a lower level,Perform network-level retry of shuffle file fetches,1,0,1
365,SPARK-4188,SPARK-4195,Fixed,Shuffle fetches should be retried at a lower level,retry to fetch blocks's result when fetchfailed's reason is connection timeout,1,1,1
366,SPARK-4193,SPARK-4543,Fixed,Disable doclint in Java 8 to prevent from build error.,Javadoc failure for network-common causes publish-local to fail,0,0,1
367,SPARK-4208,SPARK-5009,Duplicate,stack over flow error while using sqlContext.sql,allCaseVersions function in  SqlLexical  leads to StackOverflow Exception,0,1,1
368,SPARK-4217,SPARK-4252,Invalid,Result of SparkSQL is incorrect after a table join and group by operation,SparkSQL behaves differently from Hive when encountering illegal record,1,0,1
369,SPARK-4226,SPARK-13831,Fixed,SparkSQL - Add support for subqueries in predicates,TPC-DS Query 35 fails with the following compile error,1,1,1
370,SPARK-4226,SPARK-12543,Fixed,SparkSQL - Add support for subqueries in predicates,Support subquery in select/where/having,1,1,1
371,SPARK-4226,SPARK-12545,Fixed,SparkSQL - Add support for subqueries in predicates,Support exists condition,1,1,1
372,SPARK-4226,SPARK-10600,Fixed,SparkSQL - Add support for subqueries in predicates,SparkSQL - Support for Not Exists in a Correlated Subquery,1,1,1
373,SPARK-4273,SPARK-10690,Fixed,Providing ExternalSet to avoid OOM when count(distinct),SQL select count(distinct ) won't work for a normal load,0,0,1
374,SPARK-4280,SPARK-7955,Duplicate,In dynamic allocation; add option to never kill executors with cached blocks,Dynamic allocation: longer timeout for executors with cached blocks,1,1,1
375,SPARK-4286,SPARK-5197,Fixed,Support External Shuffle Service with Mesos integration,Support external shuffle service in fine-grained mode on mesos cluster,0,1,1
376,SPARK-4288,SPARK-10408,Duplicate,Add Sparse Autoencoder algorithm to MLlib ,Autoencoder,0,1,1
377,SPARK-4296,SPARK-4322,Fixed,"Throw ""Expression not in GROUP BY"" when using same expression in group by clause and  select clause",Struct fields can't be used as sub-expression of grouping fields,1,1,1
378,SPARK-4324,SPARK-4328,Fixed,Support numpy/scipy in all Python API of MLlib,Python serialization updates make Python ML API more brittle to types,1,0,1
379,SPARK-4333,SPARK-4401,Fixed,Correctly log number of iterations in RuleExecutor,RuleExecutor correctly logs trace iteration num,1,0,1
380,SPARK-4336,SPARK-5706,Won't Fix,auto detect type from json string,Support inference schema from a single json string,1,0,1
381,SPARK-4342,SPARK-4393,Duplicate,connection ack timeout improvement; replace Timer with ScheudledExecutor...,Memory leak in connection manager timeout thread,1,0,1
382,SPARK-4349,SPARK-4737,Duplicate,Spark driver hangs on sc.parallelize() if exception is thrown during serialization,Prevent serialization errors from ever crashing the DAG scheduler,1,0,1
383,SPARK-4366,SPARK-6424,Unresolved,Aggregation Improvement,Support user-defined aggregators in AggregateFunction,1,0,1
384,SPARK-4376,SPARK-4628,Duplicate,Put external modules behind build profiles,Put external projects and examples behind a build flag,0,0,1
385,SPARK-4388,SPARK-5768,Duplicate,Add tooltips to explain maxMemory / usedMemory columns in executor UI,Spark UI Shows incorrect memory under Yarn,0,0,1
386,SPARK-4392,SPARK-5467,Won't Fix,Event proration based on event timestamps,DStreams should provide windowing based on timestamps from the data (as opposed to wall clock time),1,1,1
387,SPARK-4416,SPARK-6284,Duplicate,Support Mesos framework authentication,Support framework authentication and role in Mesos framework,1,1,1
388,SPARK-4452,SPARK-14560,Fixed,Shuffle data structures can starve others on the same thread for memory ,Cooperative Memory Management for Spillables,1,1,1
389,SPARK-4467,SPARK-4515,Fixed,Number of elements read is never reset in ExternalSorter,OOM/GC errors with sort-based shuffle,0,1,1
390,SPARK-4476,SPARK-5936,Unresolved,Use MapType for dict in json which has unique keys in each row.,Automatically convert a StructType to a MapType when the number of fields exceed a threshold.,1,0,1
391,SPARK-4502,SPARK-5446,Unresolved,Spark SQL reads unneccesary nested fields from Parquet,Parquet column pruning should work for Map and Struct,1,0,1
392,SPARK-4541,SPARK-5732,Duplicate,Add --version to spark-submit,Add an option to print the spark version in spark script,1,1,1
393,SPARK-4544,SPARK-5847,Duplicate,Spark JVM Metrics doesn't have context.,Allow for configuring MetricsSystem's use of app ID to namespace all metrics,1,0,1
394,SPARK-4552,SPARK-4702,Fixed,query for empty parquet table in spark sql hive get IllegalArgumentException,Querying  non-existent partition produces exception in v1.2.0-rc1,1,0,1
395,SPARK-4558,SPARK-5522,Duplicate,History Server waits ~10s before starting up,Accelerate the History Server start,0,0,1
396,SPARK-4563,SPARK-6680,Fixed,Allow spark driver to bind to different ip then advertise ip,Be able to specifie IP for spark-shell(spark driver) blocker for Docker integration,1,1,1
397,SPARK-4563,SPARK-21668,Fixed,Allow spark driver to bind to different ip then advertise ip,Ability to run driver programs within a container,0,1,1
398,SPARK-4579,SPARK-6543,Fixed,Scheduling Delay appears negative,Scheduler Delay column in tasks table on Stage detail page showing negative numbers,1,0,1
399,SPARK-4579,SPARK-5877,Fixed,Scheduling Delay appears negative,Scheduler delay is incorrect for running tasks,1,0,1
400,SPARK-4587,SPARK-5359,Fixed,Model export/import,ML model import/export,0,0,1
401,SPARK-4598,SPARK-5899,Fixed,Paginate stage page to avoid OOM with > 100;000 tasks,Viewing specific stage information which contains thousands of tasks will freak out the driver and CPU cores from where it runs,1,0,1
402,SPARK-4598,SPARK-9037,Fixed,Paginate stage page to avoid OOM with > 100;000 tasks,Task table pagination for the Stage page,1,1,1
403,SPARK-4607,SPARK-13952,Duplicate,Add random seed to GBTClassifier; GBTRegressor,spark.ml GBT algs need to use random seed,1,1,1
404,SPARK-4609,SPARK-6183,Duplicate,Job can not finish if there is one bad slave in clusters,Skip bad workers when re-launching executors,0,1,1
405,SPARK-4616,SPARK-5382,Duplicate,SPARK_CONF_DIR is not effective in spark-submit,Scripts do not use SPARK_CONF_DIR where they should,0,0,1
406,SPARK-4622,SPARK-4623,Duplicate,Add the some error infomation if using spark-sql in yarn-cluster mode,Add the some error infomation if using spark-sql in yarn-cluster mode,1,1,1
407,SPARK-4630,SPARK-9850,Duplicate,Dynamically determine optimal number of partitions,Adaptive execution in Spark,0,1,1
408,SPARK-4632,SPARK-4637,Fixed,Upgrade MQTT dependency to use mqtt-client 1.0.1,spark-1.1.0 does not compile any more,0,1,1
409,SPARK-4648,SPARK-5244,Duplicate,Support COALESCE function in Spark SQL and HiveQL,add parser for COALESCE(),1,1,1
410,SPARK-4654,SPARK-5374,Unresolved,Clean up DAGScheduler's getMissingParentStages() and stageDependsOn() methods,abstract RDD's DAG graph iteration in DAGScheduler,1,1,1
411,SPARK-4660,SPARK-4830,Fixed,JavaSerializer uses wrong classloader,Spark Streaming Java Application : java.lang.ClassNotFoundException,0,0,1
412,SPARK-4681,SPARK-8425,Duplicate,Turn on executor level blacklisting by default,Add blacklist mechanism for task scheduling,0,0,1
413,SPARK-4681,SPARK-17675,Duplicate,Turn on executor level blacklisting by default,Add Blacklisting of Executors & Nodes within one TaskSet,1,1,1
414,SPARK-4705,SPARK-6751,Fixed,Driver retries in cluster mode always fail if event logging is enabled,Spark History Server support multiple application attempts,1,1,1
415,SPARK-4709,SPARK-4987,Duplicate,Spark SQL support error reading Parquet with timestamp type field,Parquet support for timestamp type,0,0,1
416,SPARK-4709,SPARK-4768,Duplicate,Spark SQL support error reading Parquet with timestamp type field,Add Support For Impala Encoded Timestamp (INT96),1,0,1
417,SPARK-4718,SPARK-4731,Duplicate,spark-ec2 script creates empty spark folder,Spark 1.1.1 launches broken EC2 clusters,1,1,1
418,SPARK-4751,SPARK-5349,Fixed,Support dynamic allocation for standalone mode,Spark standalone should support dynamic resource scaling,1,0,1
419,SPARK-4766,SPARK-4875,Won't Fix,ML Estimator Params should be distinct from Transformer Params,Separate Transformer; Estimator params,1,0,1
420,SPARK-4768,SPARK-4987,Duplicate,Add Support For Impala Encoded Timestamp (INT96),Parquet support for timestamp type,0,0,1
421,SPARK-4783,SPARK-15685,Fixed,System.exit() calls in SparkContext disrupt applications embedding Spark,StackOverflowError (VirtualMachineError) or NoClassDefFoundError (LinkageError) should not System.exit() in local mode,1,0,1
422,SPARK-4783,SPARK-6804,Fixed,System.exit() calls in SparkContext disrupt applications embedding Spark,System.exit(1) on error,0,0,1
423,SPARK-4783,SPARK-9687,Fixed,System.exit() calls in SparkContext disrupt applications embedding Spark,System.exit() still disrupt applications embedding Spark,0,1,1
424,SPARK-4796,SPARK-5836,Duplicate,Spark does not remove temp files,Highlight in Spark documentation that by default Spark does not delete its temporary files,0,0,1
425,SPARK-4799,SPARK-5078,Duplicate,Spark should not rely on local host being resolvable on every node,Allow setting Akka host name from env vars,1,0,1
426,SPARK-4801,SPARK-6199,Duplicate,Add CTE capability to HiveContext,Support CTE,1,1,1
427,SPARK-4804,SPARK-5040,Duplicate,StringContext method to allow using Strings for column names in catalyst DSL,"Support expressing unresolved attributes using $""attribute name"" notation in SQL DSL",1,0,1
428,SPARK-4811,SPARK-6708,Duplicate,Custom UDTFs not working in Spark SQL,Using Hive UDTF may throw ClassNotFoundException,1,0,1
429,SPARK-4818,SPARK-4824,Fixed,Join operation should use iterator/lazy evaluation,Join should use `Iterator` rather than `Iterable`,1,1,1
430,SPARK-4819,SPARK-12548,Fixed,"Remove Guava's ""Optional"" from public API",Add more exceptions to Guava relocation,0,1,1
431,SPARK-4820,SPARK-8825,Fixed,"Spark build encounters ""File name too long"" on some encrypted filesystems",Spark build fails,0,0,1
432,SPARK-4820,SPARK-21531,Fixed,"Spark build encounters ""File name too long"" on some encrypted filesystems","CLONE - Spark build encounters ""File name too long"" on some encrypted filesystems",1,0,1
433,SPARK-4835,SPARK-5545,Fixed,Streaming saveAs*HadoopFiles() methods may throw FileAlreadyExistsException during checkpoint recovery,[Spark SQL] show poor performance when multiple table do join operation,0,1,1
434,SPARK-4836,SPARK-5023,Unresolved,Web UI should display separate information for all stage attempts,In Web UI job history; the total job duration is incorrect (much smaller than the sum of its stages),1,1,1
435,SPARK-4846,SPARK-5261,Fixed,"When the vocabulary size is large; Word2Vec may yield ""OutOfMemoryError: Requested array size exceeds VM limit""",In some cases ;The value of word's vector representation is too big,1,0,1
436,SPARK-4849,SPARK-5354,Fixed,Pass partitioning information (distribute by) to In-memory caching,Set InMemoryColumnarTableScan's outputPartitioning and outputOrdering,1,0,1
437,SPARK-4854,SPARK-6708,Duplicate,Custom UDTF with Lateral View throws ClassNotFound exception in Spark SQL CLI,Using Hive UDTF may throw ClassNotFoundException,1,1,1
438,SPARK-4870,SPARK-4954,Fixed,Add version information to driver log,Add spark version information in log for standalone mode,1,1,1
439,SPARK-4877,SPARK-5358,Fixed,userClassPathFirst doesn't handle user classes inheriting from parent,spark.files.userClassPathFirst doesn't work correctly,1,1,1
440,SPARK-4882,SPARK-5779,Fixed,PySpark broadcast breaks when using KryoSerializer,Python broadcast does not work with Kryo serializer,1,0,1
441,SPARK-4913,SPARK-4933,Fixed,Fix incorrect event log path,eventLog file not found after merging into a single file,0,1,1
442,SPARK-4922,SPARK-6287,Duplicate,Support dynamic allocation for coarse-grained Mesos,Add support for dynamic allocation in the Mesos coarse-grained scheduler,1,0,1
443,SPARK-4937,SPARK-4938,Fixed,Adding optimization to simplify the filter condition,Adding optimization to simplify the filter condition,1,1,1
444,SPARK-4939,SPARK-6232,Fixed,Python updateStateByKey example hang in local mode,Spark Streaming: simple application stalls processing,0,0,1
445,SPARK-4944,SPARK-5720,Auto Closed,"Table Not Found exception in ""Create Table Like registered RDD table""",`Create Table Like` in HiveContext need support `like registered temporary table`,1,1,1
446,SPARK-4956,SPARK-6150,Won't Fix,Vector Initialization error when initialize a Sparse Vector by calling Vectors.sparse(size; indices; values),Validate indices before constructing a SparseVector,1,1,1
447,SPARK-4983,SPARK-7900,Fixed,Add sleep() before tagging EC2 instances to allow instance metadata to propagate,Reduce number of tagging calls in spark-ec2,1,1,1
448,SPARK-5004,SPARK-5820,Unresolved,PySpark does not handle SOCKS proxy,Example does not work when using SOCKS proxy,0,0,1
449,SPARK-5014,SPARK-7206,Not A Problem,GaussianMixture (GMM) improvements,Gaussian Mixture Model (GMM) improvements,0,1,1
450,SPARK-5030,SPARK-9741,Duplicate,Approximated cardinality with HyperLogLog UDAF,approx count distinct function,1,0,1
451,SPARK-5033,SPARK-5754,Duplicate,Spark 1.1.0/1.1.1/1.2.0 can't run well in HDP on Windows,Spark AM not launching on Windows,1,1,1
452,SPARK-5048,SPARK-8378,Duplicate,Add Flume to the Python Streaming API,Add Spark Flume Python API,0,1,1
453,SPARK-5058,SPARK-5394,Fixed,Typos and broken URL,kafka link in streaming docs goes to nowhere,0,0,1
454,SPARK-5058,SPARK-5409,Fixed,Typos and broken URL,Broken link in documentation,0,1,1
455,SPARK-5063,SPARK-15787,Fixed,Display more helpful error messages for several invalid operations,Display more helpful error messages for several invalid operations,0,1,1
456,SPARK-5069,SPARK-5070,Fixed,Race condition in TaskSchedulerImpl.dagScheduler,Race condition in TaskSchedulerImpl.dagScheduler,1,1,1
457,SPARK-5069,SPARK-5072,Fixed,Race condition in TaskSchedulerImpl.dagScheduler,Race condition in TaskSchedulerImpl.dagScheduler,1,1,1
458,SPARK-5081,SPARK-6905,Cannot Reproduce,Shuffle write increases,Upgrade Snappy Java to 1.1.1.7 to fix bug that resulted in worse compression,0,0,1
459,SPARK-5081,SPARK-5715,Cannot Reproduce,Shuffle write increases,Shuffle size increase; performance loss from Spark 1.1.0 to Spark 1.2.0 (and 1.2.1),0,0,1
460,SPARK-5105,SPARK-5107,Duplicate,A better log info for the start of receiver,A trick log info for the start of Receiver,0,0,1
461,SPARK-5113,SPARK-6420,Won't Fix,Audit and document use of hostnames and IP addresses in Spark,"Driver's Block Manager does not use ""spark.driver.host"" in Yarn-Client mode",0,0,1
462,SPARK-5113,SPARK-5368,Won't Fix,Audit and document use of hostnames and IP addresses in Spark,Spark should  support NAT (via akka improvements),1,0,1
463,SPARK-5131,SPARK-5485,Fixed,A typo in configuration doc,typo in spark streaming configuration parameter,0,0,1
464,SPARK-5140,SPARK-6003,Won't Fix,Two RDDs which are scheduled concurrently should be able to wait on parent in all cases,"Spark should offer a ""sync"" method that guarantees that RDDs are eagerly evaluated and persisted",1,0,1
465,SPARK-5144,SPARK-5289,Duplicate,spark-yarn module should be published,Backport publishing of repl; yarn into branch-1.2,0,0,1
466,SPARK-5151,SPARK-17636,Duplicate,Parquet Predicate Pushdown Does Not Work with Nested Structures.,Parquet filter push down doesn't handle struct fields,0,0,1
467,SPARK-5162,SPARK-5173,Fixed,Python yarn-cluster mode,support python application running on yarn cluster mode,0,1,1
468,SPARK-5165,SPARK-6356,Duplicate,Add support for rollup and cube in sqlcontext,Support the ROLLUP/CUBE/GROUPING SETS/grouping() in SQLContext,1,1,1
469,SPARK-5178,SPARK-7021,Duplicate,Integrate Python unit tests into Jenkins,JUnit output for Python tests,1,1,1
470,SPARK-5182,SPARK-6561,Fixed,Partitioning support for tables created by the data source API,Add partition support in saveAsParquet,1,0,1
471,SPARK-5185,SPARK-6047,Fixed,pyspark --jars does not add classes to driver class path,pyspark - class loading on driver failing with --jars and --packages,0,1,1
472,SPARK-5185,SPARK-5975,Fixed,pyspark --jars does not add classes to driver class path,SparkSubmit --jars not present on driver in python,0,0,1
473,SPARK-5185,SPARK-6027,Fixed,pyspark --jars does not add classes to driver class path,Make KafkaUtils work in Python with kafka-assembly provided as --jar or maven package provided as --packages,0,0,1
474,SPARK-5185,SPARK-6301,Fixed,pyspark --jars does not add classes to driver class path,Unable to load external jars while submitting Spark Job,0,1,1
475,SPARK-5192,SPARK-6607,Duplicate,Parquet fails to parse schema contains '\r',Aggregation attribute name including special chars '(' and ')' should be replaced before generating Parquet schema,1,0,1
476,SPARK-5199,SPARK-5347,Fixed,Input metrics should show up for InputFormats that return CombineFileSplits,InputMetrics bug when inputSplit is not instanceOf FileSplit,1,1,1
477,SPARK-5206,SPARK-12407,Unresolved,Accumulators are not re-registered during recovering from checkpoint,ClassCast Exception when restarting spark streaming from checkpoint,1,1,1
478,SPARK-5212,SPARK-5364,Fixed,Add support of schema-less; custom field delimiter and SerDe for HiveQL transform,HiveQL transform doesn't support the non output clause,0,0,1
479,SPARK-5213,SPARK-6200,Fixed,Pluggable SQL Parser Support,Support dialect in SQL,1,1,1
480,SPARK-5215,SPARK-8240,Duplicate,concat support in sqlcontext,string function: concat,1,1,1
481,SPARK-5229,SPARK-5251,Duplicate,Use tableIdentifier as the reference of a table ,Using `tableIdentifier` in hive metastore ,1,1,1
482,SPARK-5237,SPARK-5383,Duplicate,UDTF don't work with multi-alias of multi-columns as output on SparK SQL,support alias for udfs with multi output columns,1,1,1
483,SPARK-5239,SPARK-5481,Fixed,"JdbcRDD throws ""java.lang.AbstractMethodError: oracle.jdbc.driver.xxxxxx.isClosed()Z""",JdbcRDD requires JDBC 4 APIs; limiting compatible JDBC Drivers,0,0,1
484,SPARK-5242,SPARK-6588,Fixed,ec2/spark_ec2.py lauch does not work with VPC if no public DNS or IP is available,Private VPC's and subnets currently don't work with the Spark ec2 script,1,0,1
485,SPARK-5245,SPARK-5248,Fixed,Move Decimal from types.decimal to types package,moving Decimal from types.decimal to types package,0,0,1
486,SPARK-5265,SPARK-5497,Duplicate,Submitting applications on Standalone cluster controlled by Zookeeper forces to know active master,start-all script not working properly on Standalone HA cluster (with Zookeeper),1,1,1
487,SPARK-5265,SPARK-6443,Duplicate,Submitting applications on Standalone cluster controlled by Zookeeper forces to know active master,Support HA in standalone cluster mode,0,1,1
488,SPARK-5275,SPARK-5276,Fixed,pyspark.streaming is not included in assembly jar,pyspark.streaming is not included in assembly jar,1,1,1
489,SPARK-5278,SPARK-6273,Fixed,check ambiguous reference to fields in Spark SQL is incompleted,Got error when one table's alias name is the same with other table's column name,1,1,1
490,SPARK-5281,SPARK-5290,Fixed,Registering table on RDD is giving MissingRequirementError,Executing functions in sparkSQL registered in sqlcontext gives scala.reflect.internal.MissingRequirementError: class org.apache.spark.sql.catalyst.ScalaReflection,1,0,1
491,SPARK-5292,SPARK-12394,Duplicate,optimize join for table that are already sharded/support for hive bucket,Support writing out pre-hash-partitioned data and exploit that in join optimizations to avoid shuffle (i.e. bucketing in Hive),1,1,1
492,SPARK-5311,SPARK-18988,Won't Fix,EventLoggingListener throws exception if log directory does not exist,"Spark ""spark.eventLog.dir"" dir should create the directory if it is different from ""spark.history.fs.logDirectory""",0,0,1
493,SPARK-5311,SPARK-22174,Won't Fix,EventLoggingListener throws exception if log directory does not exist,Support to automatically create the directory where the event logs go (`spark.eventLog.dir`) ,1,0,1
494,SPARK-5311,SPARK-6078,Won't Fix,EventLoggingListener throws exception if log directory does not exist,create event log directory automatically if not exists,1,0,1
495,SPARK-5311,SPARK-17478,Won't Fix,EventLoggingListener throws exception if log directory does not exist,Create spark.eventLog.dir if it does not exist,0,0,1
496,SPARK-5311,SPARK-16547,Won't Fix,EventLoggingListener throws exception if log directory does not exist,EventLoggingListener to auto create log base dir if it does not exist,0,0,1
497,SPARK-5348,SPARK-7481,Not A Problem,s3a:// protocol and hadoop-aws dependency,Add spark-hadoop-cloud module to pull in object store support,0,0,1
498,SPARK-5369,SPARK-5370,Duplicate,remove allocatedHostToContainersMap.synchronized in YarnAllocator,Remove some unnecessary synchronization in YarnAllocator,0,0,1
499,SPARK-5374,SPARK-15927,Duplicate,abstract RDD's DAG graph iteration in DAGScheduler,Eliminate redundant code in DAGScheduler's getParentStages and getAncestorShuffleDependencies methods.,1,0,1
500,SPARK-5389,SPARK-6084,Cannot Reproduce,spark-shell.cmd does not run from DOS Windows 7,spark-shell broken on Windows,0,1,1
501,SPARK-5389,SPARK-7195,Cannot Reproduce,spark-shell.cmd does not run from DOS Windows 7,Can't start spark shell or pyspark in Windows 7,0,1,1
502,SPARK-5399,SPARK-6113,Duplicate,tree Losses strings should match loss names,Stabilize DecisionTree and ensembles APIs,0,0,1
503,SPARK-5427,SPARK-6829,Duplicate,Add support for floor function in Spark SQL,Support math functions in DataFrames,1,0,1
504,SPARK-5469,SPARK-5589,Fixed,Break sql.py into multiple files,Split pyspark/sql.py into multiple files,0,1,1
505,SPARK-5479,SPARK-7725,Fixed,PySpark on yarn mode need to support non-local python files,--py-files doesn't seem to work in YARN cluster mode,0,1,1
506,SPARK-5479,SPARK-8017,Fixed,PySpark on yarn mode need to support non-local python files,YARN cluster python --py-files does not work,1,1,1
