,Issue_id_1,Issue_id_2,Resolution,Title_1,Title_2,same_comp,same_prio,same_tw
1308,SPARK-16215,SPARK-17490,Duplicate,Reduce runtime overhead of a program that writes an primitive array in Dataframe/Dataset,Optimize SerializeFromObject for primitive array,1,1,1
1309,SPARK-16216,SPARK-16597,Fixed,CSV data source does not write date and timestamp correctly,DataFrame DateType is written as an int(Days since epoch) by csv writer,1,0,1
1310,SPARK-16216,SPARK-17066,Fixed,CSV data source does not write date and timestamp correctly,dateFormat should be used when writing dataframes as csv files,0,0,1
1311,SPARK-16216,SPARK-17923,Fixed,CSV data source does not write date and timestamp correctly,dateFormat unexpected kwarg to df.write.csv,0,0,1
1312,SPARK-16234,SPARK-17664,Not A Problem,Speculative Task may not be able to overwrite file,Failed to saveAsHadoop when speculate is enabled,0,1,1
1313,SPARK-16243,SPARK-16245,Duplicate,model loading backward compatibility for ml.feature.PCA,model loading backward compatibility for ml.feature.PCA,0,1,1
1314,SPARK-16250,SPARK-16259,Duplicate,Can't use escapeQuotes option in DataFrameWriter.csv(),Cleanup options for DataFrame reader API in Python,1,0,1
1315,SPARK-16252,SPARK-17594,Duplicate,Full Outer join with literal column results in incorrect result,Bug in left-outer join,1,1,1
1316,SPARK-16299,SPARK-16300,Fixed,Capture errors from R workers in daemon.R to avoid deletion of R session temporary directory,Capture errors from R workers in daemon.R to avoid deletion of R session temporary directory,1,1,1
1317,SPARK-16304,SPARK-16305,Fixed,LinkageError should not crash Spark executor,LinkageError should not crash Spark executor,1,1,1
1318,SPARK-16306,SPARK-16307,Duplicate,Improve testing for DecisionTree variances,Improve testing for DecisionTree variances,1,1,1
1319,SPARK-16308,SPARK-16310,Duplicate,SparkR csv source should have the same default na.string as R,SparkR csv source should have the same default na.string as R,1,1,1
1320,SPARK-16312,SPARK-16917,Fixed,Docs for Kafka 0.10 consumer integration,Spark streaming kafka version compatibility. ,0,0,1
1321,SPARK-16312,SPARK-16705,Fixed,Docs for Kafka 0.10 consumer integration,Kafka Direct Stream is not experimental anymore,0,0,1
1322,SPARK-16332,SPARK-16333,Duplicate,the history server of spark2.0-preview (may-24 build) consumes more than 1000% cpu,Excessive Spark history event/json data size (5GB each),1,1,1
1323,SPARK-16333,SPARK-20084,Duplicate,Excessive Spark history event/json data size (5GB each),Remove internal.metrics.updatedBlockStatuses accumulator from history files,0,1,1
1324,SPARK-16333,SPARK-19316,Duplicate,Excessive Spark history event/json data size (5GB each),Spark event logs are huge compared to 1.5.2,0,1,1
1325,SPARK-16347,SPARK-21191,Not A Problem,DataFrame allows duplicate column-names,DataFrame Row StructType check duplicate name,1,1,1
1326,SPARK-16384,SPARK-16806,Not A Problem,FROM_UNIXTIME reports incorrect days,from_unixtime function gives wrong answer,0,1,1
1327,SPARK-16410,SPARK-16463,Duplicate,DataFrameWriter's jdbc method drops table in overwrite mode, Support `truncate` option in Overwrite mode for JDBC DataFrameWriter,1,0,1
1328,SPARK-16419,SPARK-17271,Duplicate,EnsureRequirements adds extra Sort to already sorted cached table,Planner adds un-necessary Sort even if child ordering is semantically same as required ordering,1,0,1
1329,SPARK-16450,SPARK-16637,Duplicate,Build failes for Mesos 0.28.x,Support Mesos Unified Containerizer,1,1,1
1330,SPARK-16456,SPARK-16958,Duplicate,Reuse the uncorrelated scalar subqueries with the same logical plan in a query,Reuse subqueries within single query,1,1,1
1331,SPARK-16462,SPARK-16903,Fixed,Spark 2.0 CSV does not cast null values to certain data types properly,nullValue in first field is not respected by CSV source when read,1,1,1
1332,SPARK-16462,SPARK-17039,Fixed,Spark 2.0 CSV does not cast null values to certain data types properly,cannot read null dates from csv file,0,1,1
1333,SPARK-16462,SPARK-17290,Fixed,Spark 2.0 CSV does not cast null values to certain data types properly,Spark CSVInferSchema does not always respect nullValue settings,1,1,1
1334,SPARK-16472,SPARK-18270,Unresolved,Inconsistent nullability in schema after being read,Users schema with non-nullable properties is overidden with true,1,0,1
1335,SPARK-16512,SPARK-18699,Duplicate,No way to load CSV data without dropping whole rows when some of data is not matched with given schema,Spark CSV parsing types other than String throws exception when malformed,1,0,1
1336,SPARK-16533,SPARK-16702,Fixed,Spark application not handling preemption messages,Driver hangs after executors are lost,0,1,1
1337,SPARK-16544,SPARK-17477,Unresolved,Support for conversion from compatible schema for Parquet data source when data types are not matched,SparkSQL cannot handle schema evolution from Int -> Long when parquet files have Int as its type while hive metastore has Long as its type,1,1,1
1338,SPARK-16548,SPARK-20314,Fixed,java.io.CharConversionException: Invalid UTF-32 character  prevents me from querying my data,Inconsistent error handling in JSON parsing SQL functions,1,0,1
1339,SPARK-16580,SPARK-16861,Duplicate,"spark-class crash with ""[: too many arguments"" instead of displaying the correct error message",Refactor PySpark accumulator API to be on top of AccumulatorV2 API,0,1,1
1340,SPARK-16581,SPARK-16608,Fixed,Making JVM backend calling functions public,Expose JVM SparkR API functions ,1,1,1
1341,SPARK-16595,SPARK-17111,Unresolved,Spark History server Rest Api gives Application not found error for yarn-cluster mode,"Spark2 History server got ""Failed to load application attempt""",1,1,1
1342,SPARK-16609,SPARK-18424,Fixed,Single function for parsing timestamps/dates,Single Function for Parsing Dates and Times with Formats,0,0,1
1343,SPARK-16617,SPARK-19697,Unresolved,Upgrade to Avro 1.8.x,NoSuchMethodError: org.apache.avro.Schema.getLogicalType(),1,1,1
1344,SPARK-16648,SPARK-18358,Fixed,LAST_VALUE(FALSE) OVER () throws IndexOutOfBoundsException,Multiple Aggregation Using 'countDistinct' and 'first' result in error ,0,1,1
1345,SPARK-16664,SPARK-17061,Fixed,Spark 1.6.2 - Persist call on Data frames with more than 200 columns is wiping out the data.,Incorrect results returned following a join of two datasets and a map step where total number of columns >100,1,0,1
1346,SPARK-16664,SPARK-17043,Fixed,Spark 1.6.2 - Persist call on Data frames with more than 200 columns is wiping out the data.,Cannot call zipWithIndex on RDD with more than 200 columns (get wrong result),1,0,1
1347,SPARK-16664,SPARK-17218,Fixed,Spark 1.6.2 - Persist call on Data frames with more than 200 columns is wiping out the data.,Caching a DataFrame with >200 columns ~nulls the contents,0,0,1
1348,SPARK-16664,SPARK-17294,Fixed,Spark 1.6.2 - Persist call on Data frames with more than 200 columns is wiping out the data.,Caching invalidates data on mildly wide dataframes,0,0,1
1349,SPARK-16664,SPARK-21851,Fixed,Spark 1.6.2 - Persist call on Data frames with more than 200 columns is wiping out the data.,Spark 2.0 data corruption with cache and 200 columns,0,0,1
1350,SPARK-16664,SPARK-16716,Fixed,Spark 1.6.2 - Persist call on Data frames with more than 200 columns is wiping out the data.,calling cache on joined dataframe can lead to data being blanked,0,0,1
1351,SPARK-16665,SPARK-17737,Cannot Reproduce,python import pyspark fails in context.py ,cannot import name accumulators error,1,0,1
1352,SPARK-16685,SPARK-16712,Fixed,Remove defunct audit-release dir,converter and access code out of sync: createDataFrame on RDD[Option[C]] fails with MatchError,0,1,1
1353,SPARK-16697,SPARK-18548,Fixed,redundant RDD computation in LDAOptimizer,OnlineLDAOptimizer reads the same broadcast data after deletion,0,0,1
1354,SPARK-16698,SPARK-17232,Fixed,"json parsing regression - ""."" in keys",Expecting same behavior after loading a dataframe with dots in column name,0,1,1
1355,SPARK-16698,SPARK-17341,Fixed,"json parsing regression - ""."" in keys","Can't read Parquet data with fields containing periods "".""",1,1,1
1356,SPARK-16761,SPARK-17202,Fixed,Fix doc link in docs/ml-guide.md,Pipeline guide link is broken in MLlib Guide main page,0,1,1
1357,SPARK-16781,SPARK-17220,Fixed,java launched by PySpark as gateway may not be the same java used in the spark environment,Upgrade Py4J to 0.10.3,1,0,1
1358,SPARK-16789,SPARK-16803,Duplicate,Can't run saveAsTable with database name,SaveAsTable does not work when source DataFrame is built on a Hive Table,1,1,1
1359,SPARK-16792,SPARK-22296,Fixed,Dataset containing a Case Class with a List type causes a CompileException (converting sequence to list),CodeGenerator - failed to compile when constructor has scala.collection.mutable.Seq vs. scala.collection.Seq,0,0,1
1360,SPARK-16843,SPARK-17017,Duplicate,Select features according to a percentile of the highest scores of ChiSqSelector,Add a chiSquare Selector based on False Positive Rate (FPR) test,0,1,1
1361,SPARK-16845,SPARK-18492,Fixed,"org.apache.spark.sql.catalyst.expressions.GeneratedClass$SpecificOrdering"" grows beyond 64 KB",GeneratedIterator grows beyond 64 KB,1,1,1
1362,SPARK-16845,SPARK-17092,Fixed,"org.apache.spark.sql.catalyst.expressions.GeneratedClass$SpecificOrdering"" grows beyond 64 KB",DataFrame with large number of columns causing code generation error,1,1,1
1363,SPARK-16845,SPARK-17131,Fixed,"org.apache.spark.sql.catalyst.expressions.GeneratedClass$SpecificOrdering"" grows beyond 64 KB",Code generation fails when running SQL expressions against a wide dataset (thousands of columns),1,1,1
1364,SPARK-16845,SPARK-17223,Fixed,"org.apache.spark.sql.catalyst.expressions.GeneratedClass$SpecificOrdering"" grows beyond 64 KB",grows beyond 64 KB with data frame with many columns,0,1,1
1365,SPARK-16851,SPARK-16863,Fixed,Incorrect threshould length in 'setThresholds()' evoke Exception ,ProbabilisticClassifier.fit check threshoulds' length,1,0,1
1366,SPARK-16873,SPARK-18289,Fixed,force spill NPE,spark.util.collection.ExternalSorter leak memory when task force spilling in-memory map to disk ,0,1,1
1367,SPARK-16901,SPARK-17000,Fixed,Hive settings in hive-site.xml may be overridden by Hive's default values,Spark cannot connect to secure metastore when using custom metastore jars,1,1,1
1368,SPARK-16938,SPARK-17037,Unresolved,Cannot resolve column name after a join,distinct() operator fails on Dataframe with column names containing periods,0,0,1
1369,SPARK-16950,SPARK-17411,Fixed,fromOffsets parameter in Kafka's Direct Streams does not work in python3,Cannot set fromOffsets in createDirectStream function,0,1,1
1370,SPARK-16965,SPARK-17130,Fixed,Fix bound checking for SparseVector,SparseVectors.apply and SparseVectors.toArray have different returns when creating with a illegal indices,0,1,1
1371,SPARK-16966,SPARK-17105,Fixed,"App Name is a randomUUID even when ""spark.app.name"" exists",Create spark context with random uuid app name if app name is not set in configuration,1,0,1
1372,SPARK-16980,SPARK-17179,Fixed,Load only catalog table partition metadata required to answer a query,Consider improving partition pruning in HiveMetastoreCatalog,1,1,1
1373,SPARK-16986,SPARK-18298,Fixed,"Started time; ""Completed"" time and ""Last Updated"" time in history server UI are not user local time",HistoryServer use GMT time all time,1,0,1
1374,SPARK-16986,SPARK-19099,Fixed,"Started time; ""Completed"" time and ""Last Updated"" time in history server UI are not user local time",Wrong time display on Spark History Server web UI,0,0,1
1375,SPARK-16987,SPARK-17874,Duplicate,Add spark-default.conf property to define https port for spark history server,Additional SSL port on HistoryServer should be configurable,0,0,1
1376,SPARK-16991,SPARK-17099,Fixed,Full outer join followed by inner join produces wrong results,Incorrect result when HAVING clause is added to group by query,1,0,1
1377,SPARK-16991,SPARK-17120,Fixed,Full outer join followed by inner join produces wrong results,Analyzer incorrectly optimizes plan to empty LocalRelation,1,0,1
1378,SPARK-16991,SPARK-17060,Fixed,Full outer join followed by inner join produces wrong results,Call inner join after outer join will miss rows with null values,1,0,1
1379,SPARK-17039,SPARK-17040,Duplicate,cannot read null dates from csv file,cannot read null dates from csv file,1,1,1
1380,SPARK-17071,SPARK-17537,Won't Fix,Fetch Parquet schema within driver-side when there is single file to touch without another Spark job,Improve performance for reading parquet schema,1,0,1
1381,SPARK-17091,SPARK-21218,Unresolved,Convert IN predicate to equivalent Parquet filter,Convert IN predicate to equivalent Parquet filter,0,1,1
1382,SPARK-17101,SPARK-18760,Duplicate,Provide consistent format identifiers for TextFileFormat and ParquetFileFormat,Provide consistent format output for all file formats,1,0,1
1383,SPARK-17112,SPARK-17818,Fixed,select if(true; null; null) via JDBC triggers IllegalArgumentException in Thriftserver,Cannot SELECT NULL,1,0,1
1384,SPARK-17147,SPARK-19361,Unresolved,Spark Streaming Kafka 0.10 Consumer Can't Handle Non-consecutive Offsets (i.e. Log Compaction),kafka.maxRatePerPartition for compacted topic cause exception,1,1,1
1385,SPARK-17174,SPARK-22478,Unresolved,Provide support for Timestamp type Column in add_months function to return HH:mm:ss,Spark  - Truncate date by Day / Hour,0,0,1
1386,SPARK-17222,SPARK-19610,Duplicate,Support multline csv records,multi line support for CSV,1,1,1
1387,SPARK-17224,SPARK-19610,Duplicate,Support skipping multiple header rows in csv,multi line support for CSV,1,0,1
1388,SPARK-17225,SPARK-17878,Duplicate,Support multiple null values in csv files,Support for multiple null values when reading CSV data,1,0,1
1389,SPARK-17227,SPARK-21289,Duplicate,Allow configuring record delimiter in csv,Text and CSV formats do not support custom end-of-line delimiters,1,1,1
1390,SPARK-17248,SPARK-21670,Unresolved,Add native Scala enum support to Dataset Encoders,Encoders.bean() throws UnsupportedOperationException if Java Bean Class contains an enum,1,1,1
1391,SPARK-17253,SPARK-17296,Duplicate,Left join where ON clause does not reference the right table produces analysis error,Spark SQL: cross join + two joins = BUG,1,0,1
1392,SPARK-17259,SPARK-17558,Duplicate,Hadoop 2.7 profile to depend on Hadoop 2.7.3,Bump Hadoop 2.7 version from 2.7.2 to 2.7.3,1,0,1
1393,SPARK-17278,SPARK-17297,Duplicate,better error message for NPE during ScalaUDF execution,Clarify window/slide duration as absolute time; not relative to a calendar,0,0,1
1394,SPARK-17287,SPARK-17585,Duplicate,PySpark sc.AddFile method does not support the recursive keyword argument,PySpark SparkContext.addFile supports adding files recursively,0,1,1
1395,SPARK-17296,SPARK-17384,Fixed,Spark SQL: cross join + two joins = BUG,SQL - Running query with outer join from 1.6 fails,1,1,1
1396,SPARK-17296,SPARK-17384,Fixed,Spark SQL: cross join + two joins = BUG,SQL - Running query with outer join from 1.6 fails,1,1,1
1397,SPARK-17312,SPARK-17313,Duplicate,Support spark-shell on cluster mode,Support spark-shell on cluster mode,1,1,1
1398,SPARK-17312,SPARK-17313,Duplicate,Support spark-shell on cluster mode,Support spark-shell on cluster mode,1,1,1
1399,SPARK-17321,SPARK-21660,Fixed,YARN shuffle service should use good disk from yarn.nodemanager.local-dirs,Yarn ShuffleService failed to start when the chosen directory become read-only,0,1,1
1400,SPARK-17362,SPARK-17363,Duplicate,fix MultivariantOnlineSummerizer.numNonZeros,fix MultivariateOnlineSummerizer.numNonZeros,1,0,1
1401,SPARK-17367,SPARK-17368,Duplicate,Cannot define value classes in REPL,Scala value classes create encoder problems and break at runtime,0,1,1
1402,SPARK-17375,SPARK-17626,Duplicate,Star Join Optimization,TPC-DS performance improvements using star-schema heuristics,1,0,1
1403,SPARK-17396,SPARK-17842,Fixed,Threads number keep increasing when query on external CSV partitioned table,Thread and memory leak in WindowDstream (UnionRDD ) when parallelPartition computation gets enabled. ,0,0,1
1404,SPARK-17406,SPARK-19328,Fixed,Event Timeline will be very slow when there are too many executor events,using spark thrift server gets memory leak problem in `ExecutorsListener`,0,0,1
1405,SPARK-17414,SPARK-21204,Fixed,Set type is not supported for creating data frames,RuntimeException with Set and Case Class in Spark 2.1.1,0,0,1
1406,SPARK-17452,SPARK-17612,Duplicate,"Spark 2.0.0 is not supporting the ""partition"" keyword on a ""describe"" statement when using Hive Support",Support `DESCRIBE table PARTITION` SQL syntax,1,1,1
1407,SPARK-17458,SPARK-18393,Fixed,Alias specified for aggregates in a pivot are not honored,DataFrame pivot output column names should respect aliases,1,0,1
1408,SPARK-17512,SPARK-17566,Fixed,Specifying remote files for Python based Spark jobs in Yarn cluster mode not working,"--master yarn --deploy-mode cluster gives ""Launching Python applications through spark-submit is currently only supported for local files""",0,1,1
1409,SPARK-17542,SPARK-17586,Duplicate,Compiler warning in UnsafeInMemorySorter class,Use Static member not via instance reference,0,1,1
1410,SPARK-17565,SPARK-17948,Unresolved,Janino exception when calculating metrics for large generated class, WARN CodeGenerator: Error calculating stats of compiled class,0,0,1
1411,SPARK-17568,SPARK-19630,Fixed,Add spark-submit option for user to override ivy settings used to resolve packages/artifacts,spark.jars.ivy explanation is incorrect and missleading.,0,1,1
1412,SPARK-17578,SPARK-17580,Duplicate,Modify default value of spark.app.name in configuration for spark session,Assign random App name while creating spark context,0,0,1
1413,SPARK-17599,SPARK-19187,Fixed,Folder deletion after globbing may fail StructuredStreaming jobs,querying from parquet partitioned table throws FileNotFoundException when some partitions' hdfs locations do not exist,0,1,1
1414,SPARK-17615,SPARK-17616,Duplicate,"Getting ""java.lang.RuntimeException: Distinct columns cannot exist in Aggregate ""","Getting ""java.lang.RuntimeException: Distinct columns cannot exist in Aggregate """,1,1,1
1415,SPARK-17636,SPARK-19638,Unresolved,Parquet filter push down doesn't handle struct fields,Filter pushdown not working for struct fields,0,0,1
1416,SPARK-17707,SPARK-18343,Fixed,Web UI prevents spark-submit application to be finished,FileSystem$Statistics$StatisticsDataReferenceCleaner hangs on s3 write,0,1,1
1417,SPARK-17728,SPARK-18748,Not A Problem,UDFs are run too many times,UDF multiple evaluations causes very poor performance,0,0,1
1418,SPARK-17728,SPARK-18747,Not A Problem,UDFs are run too many times,UDF multiple evaluations causes very poor performance,0,0,1
1419,SPARK-17732,SPARK-18515,Duplicate,ALTER TABLE DROP PARTITION should support comparators,AlterTableDropPartitions fails for non-string columns,1,1,1
1420,SPARK-17747,SPARK-17797,Fixed,WeightCol support non-double datatypes,getNumClasses support non-double datatypes,1,0,1
1421,SPARK-17766,SPARK-18617,Duplicate,Write ahead log exception on a toy project,"Close ""kryo auto pick"" feature for Spark Streaming",0,0,1
1422,SPARK-17767,SPARK-19632,Later,Spark SQL ExternalCatalog API custom implementation support,Allow configuring non-hive and non-local SessionState and ExternalCatalog,1,1,1
1423,SPARK-17806,SPARK-17962,Fixed,Incorrect result when work with data from parquet,DataFrame/Dataset join not producing correct results in Spark 2.0/Yarn,0,0,1
1424,SPARK-17806,SPARK-17891,Fixed,Incorrect result when work with data from parquet,SQL-based three column join loses first column,0,0,1
1425,SPARK-17810,SPARK-17918,Fixed,Default spark.sql.warehouse.dir is relative to local FS but can resolve as HDFS path,Default Warehouse location apparently in HDFS ,0,1,1
1426,SPARK-17816,SPARK-17901,Fixed,Json serialzation of accumulators are failing with ConcurrentModificationException,NettyRpcEndpointRef: Error sending message and Caused by: java.util.ConcurrentModificationException,0,1,1
1427,SPARK-17819,SPARK-19000,Fixed,Specified database in JDBC URL is ignored when connecting to thriftserver,Spark beeline: table was created  at default database  even though specifing a database name,1,1,1
1428,SPARK-17865,SPARK-20684,Not A Problem,R API for global temp view,expose createOrReplaceGlobalTempView/createGlobalTempView and dropGlobalTempView in SparkR,0,1,1
1429,SPARK-17880,SPARK-18435,Fixed,The url linking to `AccumulatorV2` in the document is incorrect.,The requested URL /docs/latest/api/scala/org/apache/spark/AccumulatorV2.html was not found on this server.,1,1,1
1430,SPARK-17881,SPARK-18000,Duplicate,Aggregation function for generating string histograms,Aggregation function for computing bins (distinct value; count) pairs for equi-width histograms,1,1,1
1431,SPARK-17890,SPARK-18055,Cannot Reproduce,scala.ScalaReflectionException,Dataset.flatMap can't work with types from customized jar,0,0,1
1432,SPARK-17913,SPARK-19415,Fixed,Filter/join expressions can return incorrect results when comparing strings to longs,Improve the implicit type conversion between numeric type and string to avoid precesion loss,1,1,1
1433,SPARK-17913,SPARK-19971,Fixed,Filter/join expressions can return incorrect results when comparing strings to longs,Wired SELECT equal behaviour. ,1,0,1
1434,SPARK-17913,SPARK-18489,Fixed,Filter/join expressions can return incorrect results when comparing strings to longs,Implicit type conversion during comparision between Integer type column and String type column,1,1,1
1435,SPARK-17916,SPARK-21768,Unresolved,CSV data source treats empty string as null no matter what nullValue option is,spark.csv.read Empty String Parsed as NULL when nullValue is Set,0,1,1
1436,SPARK-17940,SPARK-17963,Duplicate,Typo in LAST function error message,Add examples (extend) in each function and improve documentation,1,0,1
1437,SPARK-17969,SPARK-18352,Duplicate,I think it's user unfriendly to process standard json file with DataFrame ,Parse normal; multi-line JSON files (not just JSON Lines),1,0,1
1438,SPARK-18027,SPARK-18968,Fixed,.sparkStaging not clean on RM ApplicationNotFoundException,.sparkStaging quickly fill up HDFS,0,0,1
1439,SPARK-18055,SPARK-18139,Fixed,Dataset.flatMap can't work with types from customized jar,INSERT [INTO|OVERWRITE] TABLE ... PARTITION for Datasource tables cannot handle partitions with custom locations,0,1,1
1440,SPARK-18061,SPARK-21407,Fixed,Spark Thriftserver needs to create SPNego principal,Support spnego for ThriftServer thrift/http auth,1,0,1
1441,SPARK-18075,SPARK-20525,Not A Problem,UDF doesn't work on non-local spark,ClassCast exception when interpreting UDFs from a String in spark-shell,0,1,1
1442,SPARK-18075,SPARK-18802,Not A Problem,UDF doesn't work on non-local spark,java.lang.ClassCastException in a simple spark application,0,1,1
1443,SPARK-18081,SPARK-18286,Fixed,Locality Sensitive Hashing (LSH) User Guide,Add Scala/Java/Python examples for MinHash and RandomProjection,0,0,1
1444,SPARK-18085,SPARK-21348,Unresolved,SPIP: Better History Server scalability for many / large applications,Spark history Server load too slow when eventlog is large,0,0,1
1445,SPARK-18085,SPARK-20582,Unresolved,SPIP: Better History Server scalability for many / large applications,Speed up the restart of HistoryServer using ApplicationAttemptInfo checkpointing,0,0,1
1446,SPARK-18111,SPARK-18221,Fixed,Wrong ApproximatePercentile answer when multiple records have the minimum value,Wrong ApproximatePercentile answer when multiple records have the minimum value(for branch 2.0),1,1,1
1447,SPARK-18123,SPARK-19308,Resolved,org.apache.spark.sql.execution.datasources.jdbc.JdbcUtils.saveTable  the case senstivity issue,Unable to write to Hive table where column names contains period (.),1,1,1
1448,SPARK-18127,SPARK-18799,Fixed,Add hooks and extension points to Spark,Spark SQL expose interface for plug-gable parser extension ,1,1,1
1449,SPARK-18167,SPARK-18168,Unresolved,Flaky test when hive partition pruning is enabled,Revert the change of SPARK-18167,1,0,1
1450,SPARK-18215,SPARK-18216,Duplicate,Make Column.expr public,Make Column.expr public,1,1,1
1451,SPARK-18223,SPARK-18224,Duplicate,Optimise PartitionedAppendOnlyMap implementation,Optimise PartitionedPairBuffer implementation,1,1,1
1452,SPARK-18240,SPARK-18282,Duplicate,Add Summary of BiKMeans and GMM in pyspark,Add model summaries for Python GMM and BisectingKMeans,1,0,1
1453,SPARK-18266,SPARK-18332,Duplicate,Update R vignettes and programming guide for 2.1.0 release,SparkR 2.1 QA: Programming guide; migration guide; vignettes updates,0,0,1
1454,SPARK-18284,SPARK-20866,Fixed,Scheme of DataFrame generated from RDD is different between master and 2.0,Dataset map does not respect nullable field ,1,1,1
1455,SPARK-18285,SPARK-19619,Fixed,approxQuantile in R support multi-column,SparkR approxQuantile supports input multiple columns,1,0,1
1456,SPARK-18291,SPARK-18618,Duplicate,"SparkR glm predict should output original label when family = ""binomial""",SparkR GLM model predict should support type as a argument,1,1,1
1457,SPARK-18300,SPARK-19954,Fixed,ClassCastException during count distinct,Joining to a unioned DataFrame does not produce expected result.,1,0,1
1458,SPARK-18330,SPARK-18332,Duplicate,SparkR 2.1 QA: Update user guide for new features & APIs,SparkR 2.1 QA: Programming guide; migration guide; vignettes updates,1,1,1
1459,SPARK-18355,SPARK-21686,Fixed,Spark SQL fails to read data from a ORC hive table that has a new column added to it,spark.sql.hive.convertMetastoreOrc is causing NullPointerException while reading ORC tables,0,1,1
1460,SPARK-18359,SPARK-20743,Unresolved,Let user specify locale in CSV parsing,Spark ignores JVM Locale parsing CSV data,0,0,1
1461,SPARK-18375,SPARK-18756,Fixed,Upgrade netty to 4.0.42.Final ,Memory leak in Spark streaming,0,0,1
1462,SPARK-18386,SPARK-18682,Duplicate,Batch mode SQL source for Kafka,Batch Source for Kafka,0,1,1
