,Issue_id_1,Issue_id_2,Resolution,Title_1,Title_2,same_comp,same_prio,same_tw
497,HDFS-580,HDFS-581,Won't Fix,Name node will exit safe mode w/0 blocks even if data nodes are broken,Introduce an iterator over blocks in the block report array.,0,1,1
498,HDFS-581,HDFS-582,Fixed,Introduce an iterator over blocks in the block report array.,Create a fsckraid tool to verify the consistency of erasure codes for HDFS-503,0,1,1
499,HDFS-582,HDFS-583,Won't Fix,Create a fsckraid tool to verify the consistency of erasure codes for HDFS-503,HDFS should enforce a max block size,0,1,1
500,HDFS-583,HDFS-584,Won't Fix,HDFS should enforce a max block size,Fail the fault-inject build if any advices are mis-bound,0,1,1
501,HDFS-584,HDFS-585,Fixed,Fail the fault-inject build if any advices are mis-bound,Datanode should serve up to visible length of a replica for read requests,0,1,1
502,HDFS-585,HDFS-586,Fixed,Datanode should serve up to visible length of a replica for read requests,TestBlocksWithNotEnoughRacks fails,0,1,1
503,HDFS-586,HDFS-587,Fixed,TestBlocksWithNotEnoughRacks fails,Test programs support only default queue.,1,1,1
504,HDFS-587,HDFS-588,Fixed,Test programs support only default queue.,Fix TestFiDataTransferProtocol and TestAppend2 failures in append branch.,0,1,1
505,HDFS-588,HDFS-589,Fixed,Fix TestFiDataTransferProtocol and TestAppend2 failures in append branch.,Change block write protocol to support pipeline recovery,0,1,1
506,HDFS-589,HDFS-590,Fixed,Change block write protocol to support pipeline recovery,When trying to rename a non-existent path; LocalFileSystem throws an FileNotFoundException; while HDFS returns false,0,1,1
507,HDFS-592,HDFS-593,Fixed,Allow client to get a new generation stamp from NameNode,Support for getting user home dir from server side,0,1,1
508,HDFS-594,HDFS-595,Won't Fix,Add support for byte-ranges to hsftp,FsPermission tests need to be updated for new octal configuration parameter from HADOOP-6234,1,1,1
509,HDFS-595,HDFS-596,Fixed,FsPermission tests need to be updated for new octal configuration parameter from HADOOP-6234,Memory leak in libhdfs: hdfsFreeFileInfo() in libhdfs does not free memory for mOwner and mGroup,0,0,1
510,HDFS-596,HDFS-597,Fixed,Memory leak in libhdfs: hdfsFreeFileInfo() in libhdfs does not free memory for mOwner and mGroup,Mofication introduced by HDFS-537 breakes an advice binding in FSDatasetAspects,0,0,1
511,HDFS-597,HDFS-598,Fixed,Mofication introduced by HDFS-537 breakes an advice binding in FSDatasetAspects,Eclipse launch task for HDFS,0,0,1
512,HDFS-598,HDFS-599,Fixed,Eclipse launch task for HDFS,Improve Namenode robustness by prioritizing datanode heartbeats over client requests,0,0,1
513,HDFS-599,HDFS-600,Fixed,Improve Namenode robustness by prioritizing datanode heartbeats over client requests,Support for pluggable erasure coding policy for HDFS,0,1,1
514,HDFS-600,HDFS-601,Won't Fix,Support for pluggable erasure coding policy for HDFS,TestBlockReport should obtain data directories from MiniHDFSCluster,0,1,1
515,HDFS-601,HDFS-602,Fixed,TestBlockReport should obtain data directories from MiniHDFSCluster,Atempt to make a directory under an existing file on DistributedFileSystem should throw an FileAlreadyExistsException instead of FileNotFoundException,0,1,1
516,HDFS-602,HDFS-603,Fixed,Atempt to make a directory under an existing file on DistributedFileSystem should throw an FileAlreadyExistsException instead of FileNotFoundException,Most replica related classes cannot be accessed,0,1,1
517,HDFS-603,HDFS-604,Fixed,Most replica related classes cannot be accessed,Block report processing for append,0,1,1
518,HDFS-604,HDFS-605,Fixed,Block report processing for append,There's not need to run fault-inject tests by 'run-test-hdfs-with-mr' target,0,1,1
519,HDFS-605,HDFS-606,Fixed,There's not need to run fault-inject tests by 'run-test-hdfs-with-mr' target,ConcurrentModificationException in invalidateCorruptReplicas(),0,1,1
520,HDFS-606,HDFS-607,Fixed,ConcurrentModificationException in invalidateCorruptReplicas(),HDFS should support SNMP,0,1,1
521,HDFS-607,HDFS-608,Won't Fix,HDFS should support SNMP,BlockReceiver:receivePacket(): packet's header parsing logic is complicated. Refactoring will help w/ testing efforts,1,1,1
522,HDFS-609,HDFS-610,Fixed,Create a file with the append flag does not work in HDFS,Add support for FileContext,0,0,1
523,HDFS-610,HDFS-611,Fixed,Add support for FileContext,Heartbeats times from Datanodes increase when there are plenty of blocks to delete,0,1,1
524,HDFS-611,HDFS-612,Fixed,Heartbeats times from Datanodes increase when there are plenty of blocks to delete,FSDataset should not use org.mortbay.log.Log,1,1,1
525,HDFS-612,HDFS-613,Fixed,FSDataset should not use org.mortbay.log.Log,TestBalancer and TestBlockTokenWithDFS fail Balancer assert,0,1,1
526,HDFS-613,HDFS-614,Fixed,TestBalancer and TestBlockTokenWithDFS fail Balancer assert,TestDatanodeBlockScanner obtain should data-node directories directly from MiniDFSCluster,1,1,1
527,HDFS-614,HDFS-615,Fixed,TestDatanodeBlockScanner obtain should data-node directories directly from MiniDFSCluster,TestLargeDirectoryDelete fails with NullPointerException,0,0,1
528,HDFS-615,HDFS-616,Fixed,TestLargeDirectoryDelete fails with NullPointerException,Create functional tests for new design of the block report,0,0,1
529,HDFS-616,HDFS-617,Fixed,Create functional tests for new design of the block report,Support for non-recursive create() in HDFS,0,1,1
530,HDFS-617,HDFS-618,Fixed,Support for non-recursive create() in HDFS,Support for non-recursive mkdir in HDFS,1,1,1
531,HDFS-618,HDFS-619,Fixed,Support for non-recursive mkdir in HDFS,Support replica recovery initialization in datanode,0,1,1
532,HDFS-619,HDFS-620,Fixed,Support replica recovery initialization in datanode,HDFS code is extensively using system property 'test.build.data' which is likely to fail under Eclipse environment,0,1,1
533,HDFS-620,HDFS-622,Unresolved,HDFS code is extensively using system property 'test.build.data' which is likely to fail under Eclipse environment,checkMinReplication should count only live node.,0,1,1
534,MAPREDUCE-987,HDFS-622,Fixed,Exposing MiniDFS and MiniMR clusters as a single process command-line,checkMinReplication should count only live node.,0,0,1
535,HDFS-622,HDFS-623,Fixed,checkMinReplication should count only live node.,hdfs jar-test ant target fails with the latest commons jar's from the common trunk,0,1,1
536,HDFS-623,HDFS-624,Not A Problem,hdfs jar-test ant target fails with the latest commons jar's from the common trunk,Client support pipeline recovery,1,1,1
537,HDFS-624,HDFS-625,Fixed,Client support pipeline recovery,ListPathsServlet throws NullPointerException,0,1,1
538,HDFS-625,HDFS-626,Fixed,ListPathsServlet throws NullPointerException,NameNode.complete(..) may throw NullPointerException,1,1,1
539,HDFS-626,HDFS-627,Not A Problem,NameNode.complete(..) may throw NullPointerException,Support replica update in datanode,0,1,1
540,HDFS-627,HDFS-628,Fixed,Support replica update in datanode,Simplify the codes in the replica related classes,1,1,1
541,HDFS-628,HDFS-629,Won't Fix,Simplify the codes in the replica related classes,Remove ReplicationTargetChooser.java along with fixing import warnings.,0,1,1
542,HDFS-629,HDFS-630,Fixed,Remove ReplicationTargetChooser.java along with fixing import warnings.,In DFSOutputStream.nextBlockOutputStream(); the client can exclude specific datanodes when locating the next block.,0,1,1
543,HDFS-630,HDFS-631,Fixed,In DFSOutputStream.nextBlockOutputStream(); the client can exclude specific datanodes when locating the next block.,Changes in HDFS to rename the config keys as detailed in HDFS-531.,0,1,1
544,HDFS-631,HDFS-633,Fixed,Changes in HDFS to rename the config keys as detailed in HDFS-531.,DFSClient#primitiveMkdir should have createParent parameter and not assume true.,0,1,1
545,HDFS-633,HDFS-635,Unresolved,DFSClient#primitiveMkdir should have createParent parameter and not assume true.,HDFS Project page does not show 0.20.1 documentation/release information.,0,1,1
546,MAPREDUCE-1163,HDFS-635,Fixed,hdfsJniHelper.h: Yahoo! specific paths are encoded,HDFS Project page does not show 0.20.1 documentation/release information.,0,0,1
547,HDFS-635,HDFS-636,Fixed,HDFS Project page does not show 0.20.1 documentation/release information.,SafeMode should count only complete blocks.,0,1,1
548,HDFS-636,HDFS-637,Fixed,SafeMode should count only complete blocks.,DataNode sends a Success ack when block write fails,0,0,1
549,HDFS-637,HDFS-638,Fixed,DataNode sends a Success ack when block write fails,The build.xml refences jars that don't exist,0,0,1
550,HDFS-638,HDFS-639,Fixed,The build.xml refences jars that don't exist,dfs does not support -rmdir,0,0,1
551,HDFS-639,HDFS-640,Invalid,dfs does not support -rmdir,TestHDFSFileContextMainOperations uses old FileContext.mkdirs(..),0,0,1
552,HDFS-640,HDFS-641,Fixed,TestHDFSFileContextMainOperations uses old FileContext.mkdirs(..),Move all of the benchmarks and tests that depend on mapreduce to mapreduce,1,0,1
553,HDFS-641,HDFS-642,Fixed,Move all of the benchmarks and tests that depend on mapreduce to mapreduce,Support pipeline close and close recovery,0,0,1
554,HDFS-642,HDFS-643,Fixed,Support pipeline close and close recovery,Strange behavior with bin/hadoop dfs -mv,1,1,1
555,HDFS-643,HDFS-644,Invalid,Strange behavior with bin/hadoop dfs -mv,Lease recovery; concurrency support.,0,1,1
556,HDFS-644,HDFS-645,Fixed,Lease recovery; concurrency support.,Namenode does not leave safe mode even if all blocks are available,0,1,1
557,HDFS-645,HDFS-646,Fixed,Namenode does not leave safe mode even if all blocks are available,missing test-contrib ant target would break hudson patch test process,0,0,1
558,HDFS-646,HDFS-647,Fixed,missing test-contrib ant target would break hudson patch test process,Internal server errors,0,0,1
559,HDFS-648,HDFS-649,Fixed,Public access is required for some of methods in AppendTestUtil,When non pipeline related tests are executed some advices causing NPE,0,1,1
560,HDFS-649,HDFS-650,Fixed,When non pipeline related tests are executed some advices causing NPE,Namenode in infinite loop for removing/recovering lease.,0,0,1
561,HDFS-650,HDFS-651,Not A Problem,Namenode in infinite loop for removing/recovering lease.,HDFS Docs - fix listing of docs in the doc menu,0,1,1
562,HDFS-651,HDFS-652,Fixed,HDFS Docs - fix listing of docs in the doc menu,Replace BlockInfo.isUnderConstruction() with isComplete() ,0,0,1
563,HDFS-652,HDFS-653,Fixed,Replace BlockInfo.isUnderConstruction() with isComplete() ,Multiple unit tests fail in branch-0.21,0,0,1
564,HDFS-654,HDFS-655,Fixed,HDFS needs to support new rename introduced for FileContext,test.py under particular directory Found checksum error ,0,1,1
565,HDFS-655,HDFS-656,Unresolved,test.py under particular directory Found checksum error ,Clarify error handling and retry semantics for DFS read path,1,0,1
566,HDFS-656,HDFS-657,Unresolved,Clarify error handling and retry semantics for DFS read path,Remove unused legacy protocol methods.,0,0,1
567,HDFS-657,HDFS-658,Fixed,Remove unused legacy protocol methods.,Block recovery for primary data-node,0,1,1
568,HDFS-658,HDFS-659,Fixed,Block recovery for primary data-node,DFSClient cannot read all the available bytes,0,1,1
569,HDFS-659,HDFS-660,Fixed,DFSClient cannot read all the available bytes,Remove deprecated methods from InterDatanodeProtocol.,0,1,1
570,HDFS-660,HDFS-661,Fixed,Remove deprecated methods from InterDatanodeProtocol.,Data-node upgrade problem,1,0,1
571,HDFS-661,HDFS-662,Fixed,Data-node upgrade problem,Unnecessary info message from DFSClient,0,0,1
572,HDFS-662,HDFS-663,Fixed,Unnecessary info message from DFSClient,DFSIO for append,0,1,1
573,HDFS-663,HDFS-664,Fixed,DFSIO for append,Add a way to efficiently replace a disk in a live datanode,0,1,1
574,HDFS-665,HDFS-666,Fixed,TestFileAppend2 sometimes hangs,Unit test for FsShell -text,0,0,1
575,HDFS-666,HDFS-667,Fixed,Unit test for FsShell -text,test-contrib target fails on hdfsproxy tests,0,0,1
576,HDFS-667,HDFS-668,Won't Fix,test-contrib target fails on hdfsproxy tests,TestFileAppend3#TC7 sometimes hangs,0,1,1
577,HDFS-668,HDFS-669,Fixed,TestFileAppend3#TC7 sometimes hangs,Add unit tests framework (Mockito),0,1,1
578,HDFS-669,HDFS-670,Fixed,Add unit tests framework (Mockito),Config changes for hdfs-with-mr in 21.,0,1,1
579,HDFS-670,HDFS-671,Unresolved,Config changes for hdfs-with-mr in 21.,Documentation change for updated configuration keys.,1,0,1
580,HDFS-671,HDFS-672,Fixed,Documentation change for updated configuration keys.,String literals for configuration keys should be changed to use constants.,1,0,1
581,HDFS-672,HDFS-673,Unresolved,String literals for configuration keys should be changed to use constants.,BlockReceiver#PacketResponder should not remove a packet from the ack queue before its ack is sent,0,0,1
582,HDFS-673,HDFS-674,Fixed,BlockReceiver#PacketResponder should not remove a packet from the ack queue before its ack is sent,Native compression configure script needs otool support for Mac OS X,0,0,1
583,HDFS-674,HDFS-675,Duplicate,Native compression configure script needs otool support for Mac OS X,File not being replicated; even when #of DNs >0,0,1,1
584,HDFS-675,HDFS-676,Cannot Reproduce,File not being replicated; even when #of DNs >0,NPE in FSDataset.updateReplicaUnderRecovery(..),0,1,1
585,HDFS-676,HDFS-677,Fixed,NPE in FSDataset.updateReplicaUnderRecovery(..),Rename failure due to quota results in deletion of src directory,0,0,1
586,HDFS-677,HDFS-678,Fixed,Rename failure due to quota results in deletion of src directory,add test for different URI.schemas in  TestGlobPaths.java to support changes in HADOOP-6286 ,0,0,1
587,HDFS-678,HDFS-679,Unresolved,add test for different URI.schemas in  TestGlobPaths.java to support changes in HADOOP-6286 ,Appending to a partial chunk incorrectly assumes the first packet fills up the partial chunk,0,1,1
588,HDFS-679,HDFS-680,Fixed,Appending to a partial chunk incorrectly assumes the first packet fills up the partial chunk,Add new access method to a copy of a block's replica,1,1,1
589,HDFS-680,HDFS-681,Fixed,Add new access method to a copy of a block's replica,A client should not send buffered data to datanodes on close of a file if the data have already been flushed,1,1,1
590,HDFS-681,HDFS-682,Unresolved,A client should not send buffered data to datanodes on close of a file if the data have already been flushed,TestBlockUnderConstruction fails,0,1,1
591,HDFS-682,HDFS-683,Fixed,TestBlockUnderConstruction fails,TestOfflineImageViewer fails,0,1,1
592,HDFS-683,HDFS-684,Invalid,TestOfflineImageViewer fails,Use HAR filesystem to merge parity files ,0,1,1
593,HDFS-685,HDFS-686,Fixed,Use the user-to-groups mapping service in the NameNode,NullPointerException is thrown while merging edit log and image,1,0,1
594,HDFS-686,HDFS-687,Fixed,NullPointerException is thrown while merging edit log and image,FS setSpaceQuota should warn  when user attempts to set quota of very large amount.,0,0,1
595,HDFS-687,HDFS-688,Unresolved,FS setSpaceQuota should warn  when user attempts to set quota of very large amount.,Add configuration resources to DFSAdmin,0,1,1
596,HDFS-688,HDFS-689,Fixed,Add configuration resources to DFSAdmin,Destination ending with \ should be treated as a dir,0,1,1
597,HDFS-689,HDFS-690,Unresolved,Destination ending with \ should be treated as a dir,"TestAppend2#testComplexAppend failed on ""Too many open files""",0,0,1
598,HDFS-690,HDFS-691,Fixed,"TestAppend2#testComplexAppend failed on ""Too many open files""",Limitation on java.io.InputStream.available(),0,0,1
599,HDFS-691,HDFS-693,Fixed,Limitation on java.io.InputStream.available(),java.net.SocketTimeoutException: 480000 millis timeout while waiting for channel to be ready for write exceptions were cast when trying to read file via StreamFile.,0,1,1
600,HDFS-693,HDFS-694,Not A Problem,java.net.SocketTimeoutException: 480000 millis timeout while waiting for channel to be ready for write exceptions were cast when trying to read file via StreamFile.,Add a test to make sure that node decomission does not get blocked by underreplicated blocks in an unclosed file,0,1,1
601,HDFS-694,HDFS-695,Unresolved,Add a test to make sure that node decomission does not get blocked by underreplicated blocks in an unclosed file,RaidNode should read in configuration from hdfs-site.xml,0,1,1
602,HDFS-695,HDFS-696,Fixed,RaidNode should read in configuration from hdfs-site.xml,Java assertion failures triggered by tests,0,1,1
603,HDFS-696,HDFS-697,Fixed,Java assertion failures triggered by tests,Enable asserts for tests by default,0,1,1
604,HDFS-697,HDFS-698,Fixed,Enable asserts for tests by default,BlockSender should compare on disk file length with replica length instead of replica visible length.,0,1,1
605,HDFS-698,HDFS-699,Unresolved,BlockSender should compare on disk file length with replica length instead of replica visible length.,Primary datanode should compare replicas' on disk lengths,1,1,1
606,HDFS-699,HDFS-700,Fixed,Primary datanode should compare replicas' on disk lengths,BlockReceiver is ignoring java.io.InterruptedIOException.,1,1,1
607,HDFS-701,HDFS-702,Unresolved,DataNode's volumeMap should be private.,Add Hdfs Impl for the new file system interface,0,1,1
608,HDFS-702,HDFS-703,Fixed,Add Hdfs Impl for the new file system interface,Replace current fault injection implementation with one from Common,0,1,1
609,HDFS-703,HDFS-704,Fixed,Replace current fault injection implementation with one from Common,Unify build property names to facilitate cross-projects modifications,1,1,1
610,HDFS-704,HDFS-705,Fixed,Unify build property names to facilitate cross-projects modifications,Create an adapter to access some of package-private methods of DataNode from tests,0,1,1
611,HDFS-705,HDFS-706,Fixed,Create an adapter to access some of package-private methods of DataNode from tests,Intermittent failures in TestFiHFlush,1,1,1
612,HDFS-706,HDFS-707,Fixed,Intermittent failures in TestFiHFlush,Remove unused method INodeFile.toINodeFileUnderConstruction(),0,1,1
613,HDFS-709,HDFS-710,Fixed,TestDFSShell failure,Add actions with constraints to the pipeline fault injection tests,0,1,1
614,HDFS-710,HDFS-711,Fixed,Add actions with constraints to the pipeline fault injection tests,hdfsUtime does not handle atime = 0 or mtime = 0 correctly,0,1,1
615,HDFS-711,HDFS-712,Fixed,hdfsUtime does not handle atime = 0 or mtime = 0 correctly,Move libhdfs from mr to hdfs ,0,1,1
616,HDFS-712,HDFS-713,Fixed,Move libhdfs from mr to hdfs ,Need to properly check the type of the test class from an aspect,0,1,1
617,HDFS-713,HDFS-714,Fixed,Need to properly check the type of the test class from an aspect,Create fault injection test for the new pipeline close,0,1,1
618,HDFS-714,HDFS-715,Fixed,Create fault injection test for the new pipeline close,Hadoop HDFS - Site Logo,0,0,1
619,HDFS-715,HDFS-716,Fixed,Hadoop HDFS - Site Logo,Define a pointcut for pipeline close,0,0,1
620,HDFS-716,HDFS-718,Fixed,Define a pointcut for pipeline close,configuration parameter to prevent accidental formatting of HDFS filesystem,0,0,1
621,HDFS-718,HDFS-719,Fixed,configuration parameter to prevent accidental formatting of HDFS filesystem,Add more fault injection tests for pipeline close,0,0,1
622,HDFS-719,HDFS-720,Fixed,Add more fault injection tests for pipeline close,NPE in BlockReceiver$PacketResponder.run(BlockReceiver.java:923),0,1,1
623,HDFS-720,HDFS-721,Fixed,NPE in BlockReceiver$PacketResponder.run(BlockReceiver.java:923),ERROR Block blk_XXX_1030 already exists in state RBW and thus cannot be created,0,1,1
624,HDFS-722,HDFS-723,Fixed,The pointcut callCreateBlockWriteStream in FSDatasetAspects is broken,Deadlock in DFSClient#DFSOutputStream,0,0,1
625,HDFS-723,HDFS-724,Fixed,Deadlock in DFSClient#DFSOutputStream,Pipeline close hangs if one of the datanode is not responsive.,0,1,1
626,HDFS-724,HDFS-725,Fixed,Pipeline close hangs if one of the datanode is not responsive.,Support the build error fix for HADOOP-6327,0,0,1
627,HDFS-725,HDFS-726,Fixed,Support the build error fix for HADOOP-6327,Eclipse .classpath template has outdated jar files and is missing some new ones.,0,1,1
628,HDFS-726,HDFS-727,Fixed,Eclipse .classpath template has outdated jar files and is missing some new ones.,bug setting block size hdfsOpenFile ,0,0,1
629,HDFS-727,HDFS-728,Fixed,bug setting block size hdfsOpenFile ,Create a comprehensive functional test for append,0,0,1
630,HDFS-728,HDFS-729,Fixed,Create a comprehensive functional test for append,fsck option to list only corrupted files,0,1,1
631,HDFS-729,HDFS-730,Fixed,fsck option to list only corrupted files,Add fault injection tests for pipleline close ack,0,1,1
632,HDFS-730,HDFS-731,Fixed,Add fault injection tests for pipleline close ack,Support new Syncable interface in HDFS,0,1,1
633,HDFS-731,HDFS-732,Fixed,Support new Syncable interface in HDFS,HDFS files are ending up truncated,0,0,1
634,HDFS-732,HDFS-733,Fixed,HDFS files are ending up truncated,TestBlockReport fails intermittently,0,0,1
635,HDFS-735,HDFS-736,Fixed,TestReadWhileWriting has wrong line termination symbols,commitBlockSynchronization() should directly update block GS and length.,0,1,1
636,HDFS-736,HDFS-737,Fixed,commitBlockSynchronization() should directly update block GS and length.,Improvement in metasave output,1,1,1
637,HDFS-737,HDFS-738,Fixed,Improvement in metasave output,Improve the disk utilization of HDFS,0,1,1
638,HDFS-738,HDFS-739,Unresolved,Improve the disk utilization of HDFS,Go to parent directory link broken running on windows,1,1,1
639,HDFS-739,HDFS-741,Fixed,Go to parent directory link broken running on windows,TestHFlush test doesn't seek() past previously written part of the file,0,1,1
640,HADOOP-6344,HDFS-741,Fixed,rm and rmr fail to correctly move the user's files to the trash prior to deleting when they are over quota.  ,TestHFlush test doesn't seek() past previously written part of the file,0,1,1
641,HDFS-741,HDFS-742,Fixed,TestHFlush test doesn't seek() past previously written part of the file,A down DataNode makes Balancer to hang on repeatingly asking NameNode its partial block list,0,0,1
642,HDFS-742,HDFS-743,Fixed,A down DataNode makes Balancer to hang on repeatingly asking NameNode its partial block list,file size is fluctuating although file is closed,0,0,1
643,HDFS-743,HDFS-744,Won't Fix,file size is fluctuating although file is closed,Support hsync in HDFS,0,0,1
644,HDFS-744,HDFS-745,Fixed,Support hsync in HDFS,TestFsck timeout on 0.20.,0,1,1
645,HDFS-745,HDFS-746,Fixed,TestFsck timeout on 0.20.,Documenting HDFS metrics,1,1,1
646,HDFS-746,HDFS-747,Unresolved,Documenting HDFS metrics,Add JSure annotations to HDFS code,1,1,1
647,HDFS-747,HDFS-748,Unresolved,Add JSure annotations to HDFS code,TestReadWhileWriting test case can't be extended for a multiple writes,1,1,1
648,HDFS-748,HDFS-749,Unresolved,TestReadWhileWriting test case can't be extended for a multiple writes,HDFS build is broken: hadoop-core snapshot can't be resolved.,1,0,1
649,HDFS-749,HDFS-750,Cannot Reproduce,HDFS build is broken: hadoop-core snapshot can't be resolved.,TestRename build failure,0,1,1
650,HDFS-750,HDFS-751,Fixed,TestRename build failure,TestCrcCorruption succeeds but is not testing anything of value,0,0,1
651,HDFS-751,HDFS-752,Fixed,TestCrcCorruption succeeds but is not testing anything of value,Add interface classification stable & scope to HDFS,1,1,1
652,HDFS-752,HDFS-753,Fixed,Add interface classification stable & scope to HDFS,HDFS allows delete of read only files and directories,1,1,1
653,HDFS-753,HDFS-754,Unresolved,HDFS allows delete of read only files and directories,Reduce ivy console output to observable level,1,1,1
654,HDFS-754,HDFS-755,Fixed,Reduce ivy console output to observable level,Read multiple checksum chunks at once in DFSInputStream,0,1,1
655,HDFS-755,HDFS-756,Fixed,Read multiple checksum chunks at once in DFSInputStream,libhdfs unit tests do not run ,0,0,1
656,HDFS-757,HDFS-758,Fixed,Unit tests failure for RAID,Improve reporting of progress of decommissioning,0,1,1
657,HDFS-758,HDFS-759,Fixed,Improve reporting of progress of decommissioning,Extend DataNodeCluster to allow block injection for  real (non simulated) DNs,1,1,1
658,HDFS-759,HDFS-760,Unresolved,Extend DataNodeCluster to allow block injection for  real (non simulated) DNs,fs -put fails if dfs.umask is set to 63,1,1,1
659,HDFS-760,HDFS-761,Fixed,fs -put fails if dfs.umask is set to 63,Failure to process rename operation from edits log due to quota verification,0,1,1
660,HDFS-761,HDFS-762,Fixed,Failure to process rename operation from edits log due to quota verification,Trying to start the balancer throws a NPE,0,1,1
661,HDFS-762,HDFS-763,Fixed,Trying to start the balancer throws a NPE,DataBlockScanner reporting of bad blocks is slightly misleading,0,1,1
662,HDFS-763,HDFS-764,Fixed,DataBlockScanner reporting of bad blocks is slightly misleading,Moving Access Token implementation from Common to HDFS,0,1,1
663,HDFS-764,HDFS-766,Fixed,Moving Access Token implementation from Common to HDFS,Error message not clear for set space quota out of boundary  values. ,1,0,1
664,HADOOP-6446,HDFS-766,Won't Fix,Deprecate FileSystem,Error message not clear for set space quota out of boundary  values. ,0,0,1
665,HDFS-766,HDFS-767,Fixed,Error message not clear for set space quota out of boundary  values. ,Job failure due to BlockMissingException,1,0,1
666,HDFS-767,HDFS-768,Fixed,Job failure due to BlockMissingException,HDFS Contrib project ivy dependencies are not included in binary target,0,0,1
667,HDFS-768,HDFS-769,Won't Fix,HDFS Contrib project ivy dependencies are not included in binary target,test-c++-libhdfs constantly fails,0,0,1
668,HDFS-770,HDFS-772,Unresolved,SocketTimeoutException: timeout while waiting for channel to be ready for read,DFSClient.getFileChecksum(..) computes file md5 with extra padding,0,1,1
