,Issue_id_1,Issue_id_2,Resolution,Title_1,Title_2,same_comp,same_prio,same_tw
326,HDFS-390,HDFS-391,Fixed,Hadoop daemons should support generic command-line options by implementing the Tool interface,Block Report Optimization: Replace class instance,1,0,1
327,HDFS-391,HDFS-392,Fixed,Block Report Optimization: Replace class instance,Add a Random backoff for the initial block report sent to the Name node,1,1,1
328,HDFS-392,HDFS-393,Fixed,Add a Random backoff for the initial block report sent to the Name node,Block Report Optimization: Queue block reports,1,1,1
329,HDFS-393,HDFS-394,Won't Fix,Block Report Optimization: Queue block reports,NameNode shoud give the DataNodes a parameter that specifies the backoff time for initial block reports,1,1,1
330,HDFS-394,HDFS-395,Unresolved,NameNode shoud give the DataNodes a parameter that specifies the backoff time for initial block reports,DFS Scalability: Incremental block reports,0,1,1
331,HDFS-395,HDFS-396,Fixed,DFS Scalability: Incremental block reports,Process dfs.name.edits.dirs as URI ,0,1,1
332,HDFS-396,HDFS-397,Fixed,Process dfs.name.edits.dirs as URI ,Incorporate storage directories into EditLogFileInput/Output streams,1,1,1
333,HDFS-397,HDFS-398,Won't Fix,Incorporate storage directories into EditLogFileInput/Output streams,Cleanup HDFS FSConstants,1,1,1
334,HDFS-398,HDFS-399,Fixed,Cleanup HDFS FSConstants,Remove DFSFileInfo - FileStatus is sufficient,1,1,1
335,HDFS-399,HDFS-400,Fixed,Remove DFSFileInfo - FileStatus is sufficient,Make the Data transfer streaming protocol concrete,1,1,1
336,HDFS-400,HDFS-401,Fixed,Make the Data transfer streaming protocol concrete,Declare HDFS exceptions in the HDFS interface and also in class FileSystem and rethrow the encapsulated exception,1,1,1
337,HDFS-401,HDFS-402,Fixed,Declare HDFS exceptions in the HDFS interface and also in class FileSystem and rethrow the encapsulated exception,Display the server version in dfsadmin -report,1,0,1
338,HDFS-402,HDFS-403,Unresolved,Display the server version in dfsadmin -report,Horizontally partitioning,1,0,1
339,HDFS-403,HDFS-404,Unresolved,Horizontally partitioning,Why open method in class DFSClient would compare old LocatedBlocks and new LocatedBlocks?,1,1,1
340,HDFS-404,HDFS-405,Invalid,Why open method in class DFSClient would compare old LocatedBlocks and new LocatedBlocks?,Several unit tests failing on Windows frequently,1,0,1
341,HDFS-405,HDFS-406,Fixed,Several unit tests failing on Windows frequently,Automate test for Hadoop-4597,1,0,1
342,HDFS-406,HDFS-407,Won't Fix,Automate test for Hadoop-4597,data node startup problem,1,1,1
343,HDFS-407,HDFS-408,Cannot Reproduce,data node startup problem,Synthetic Load Generator for NameNode testing -- Next Generation,1,1,1
344,HDFS-408,HDFS-409,Won't Fix,Synthetic Load Generator for NameNode testing -- Next Generation,Add more access token tests,0,1,1
345,HDFS-409,HDFS-410,Fixed,Add more access token tests,fsck: Check for files-under-contruction without leases,0,1,1
346,HDFS-410,HDFS-411,Unresolved,fsck: Check for files-under-contruction without leases,parameter dfs.replication is not reflected when put file into hadoop with fuse-dfs,1,1,1
347,HDFS-412,HDFS-413,Fixed,Hadoop JMX usage makes Nagios monitoring impossible,fuse-dfs fix writeTest and add writeAppendtest,0,0,1
348,HDFS-413,HDFS-414,Unresolved,fuse-dfs fix writeTest and add writeAppendtest,add fuse-dfs to src/contrib/build.xml test target,0,1,1
349,HDFS-414,HDFS-415,Won't Fix,add fuse-dfs to src/contrib/build.xml test target,Unchecked exception thrown inside of BlockReceiver cause some threads hang,1,0,1
350,HDFS-415,HDFS-416,Fixed,Unchecked exception thrown inside of BlockReceiver cause some threads hang,thriftfs creates jar file named $\{version\}-thriftfs.jar,1,0,1
351,HDFS-416,HDFS-417,Won't Fix,thriftfs creates jar file named $\{version\}-thriftfs.jar,Improvements to Hadoop Thrift bindings,1,0,1
352,HDFS-417,HDFS-418,Won't Fix,Improvements to Hadoop Thrift bindings,Move new per-daemon Thrift contrib into a new contrib project/package layout,1,0,1
353,HDFS-418,HDFS-419,Won't Fix,Move new per-daemon Thrift contrib into a new contrib project/package layout,Add Thrift interface to JobTracker/TaskTracker,1,1,1
354,HDFS-419,HDFS-420,Won't Fix,Add Thrift interface to JobTracker/TaskTracker,Fuse-dfs should cache fs handles,0,1,1
355,HDFS-421,HDFS-422,Unresolved,fuse-dfs - df -kh on hdfs mount shows much less %used than the dfs UI,fuse-dfs leaks FileSystem handles as it never disconnects them because the FileSystem.Cache does not do reference counting,1,0,1
356,HDFS-423,HDFS-424,Fixed,Unbreak FUSE build and fuse_dfs_wrapper.sh,FUSE module chokes on directories with lots (10;000+ or so) files,1,1,1
357,HDFS-424,HDFS-425,Unresolved,FUSE module chokes on directories with lots (10;000+ or so) files,fuse has major performance drop on slower machines,1,0,1
358,HDFS-425,HDFS-426,Unresolved,fuse has major performance drop on slower machines,fuse-dfs documentation,1,1,1
359,HDFS-426,HDFS-427,Unresolved,fuse-dfs documentation,fuse-dfs should support symlinks,1,0,1
360,HDFS-427,HDFS-428,Unresolved,fuse-dfs should support symlinks,fuse-dfs implement posix access method,1,0,1
361,HDFS-428,HDFS-429,Unresolved,fuse-dfs implement posix access method,fuse-dfs implement posix truncate functionality,1,0,1
362,HDFS-429,HDFS-430,Fixed,fuse-dfs implement posix truncate functionality,create posix-like (as far as we can) layer for Linux on top of libhdfs,1,0,1
363,HDFS-430,HDFS-431,Later,create posix-like (as far as we can) layer for Linux on top of libhdfs,port fuse-dfs existing autoconf to hadoop project's autoconf infrastructure,1,1,1
364,HDFS-431,HDFS-432,Invalid,port fuse-dfs existing autoconf to hadoop project's autoconf infrastructure,fuse-dfs: call fsshell trash instead of c re-implementation,1,1,1
365,HDFS-432,HDFS-433,Unresolved,fuse-dfs: call fsshell trash instead of c re-implementation,Move fuse_dfs_wrapper.sh and fuse_dfs into the hadoop/contrib/fuse_dfs deploy directory and use hadoop-env.sh to get env info,1,0,1
366,HDFS-433,HDFS-434,Incomplete,Move fuse_dfs_wrapper.sh and fuse_dfs into the hadoop/contrib/fuse_dfs deploy directory and use hadoop-env.sh to get env info,add fuse-dfs test for non sequential writes to ensure an error is returned,1,0,1
367,HDFS-434,HDFS-435,Unresolved,add fuse-dfs test for non sequential writes to ensure an error is returned,Add orthogonal fault injection mechanism/framework,0,0,1
368,HDFS-435,HDFS-436,Fixed,Add orthogonal fault injection mechanism/framework,AspectJ framework for HDFS code and tests,1,1,1
369,HDFS-436,HDFS-438,Fixed,AspectJ framework for HDFS code and tests,Improve help message for quotas,0,0,1
370,HDFS-438,HDFS-439,Fixed,Improve help message for quotas,HADOOP-5961 is incorrectly committed.,1,0,1
371,HDFS-439,HDFS-440,Fixed,HADOOP-5961 is incorrectly committed.,javadoc warnings: broken links,0,0,1
372,HDFS-441,HDFS-442,Fixed,TestFTPFileSystem fails,dfsthroughput in test.jar throws NPE,1,0,1
373,HDFS-442,HDFS-443,Fixed,dfsthroughput in test.jar throws NPE,New metrics in namenode to capture lost heartbeats.,0,0,1
374,HDFS-443,HDFS-444,Fixed,New metrics in namenode to capture lost heartbeats.,Current fault injection framework implementation doesn't allow to change probability levels dynamically,0,0,1
375,HDFS-444,HDFS-445,Fixed,Current fault injection framework implementation doesn't allow to change probability levels dynamically,pread() fails when cached block locations are no longer valid,0,0,1
376,HDFS-445,HDFS-446,Fixed,pread() fails when cached block locations are no longer valid,Offline Image Viewer Ls visitor incorrectly says 'output file' instead of 'input file',0,0,1
377,HDFS-446,HDFS-447,Fixed,Offline Image Viewer Ls visitor incorrectly says 'output file' instead of 'input file',proxy to call LDAP for IP lookup and get user ID and directories; validate requested URL,0,0,1
378,HDFS-447,HDFS-448,Fixed,proxy to call LDAP for IP lookup and get user ID and directories; validate requested URL,An IOException thrown in the BlockReceiver file causes some tests to hang,0,0,1
379,HDFS-448,HDFS-449,Fixed,An IOException thrown in the BlockReceiver file causes some tests to hang,javadoc warnings ,0,1,1
380,HDFS-450,HDFS-451,Fixed,eclipse-files target does not create HDFS_Ant_Builder,Test DataTransferProtocol with fault injection,0,0,1
381,HDFS-451,HDFS-452,Fixed,Test DataTransferProtocol with fault injection,Fs -count throws Access Control Exception when restricted acess directories are present in the user's directory  . ,0,0,1
382,HDFS-452,HDFS-453,Unresolved,Fs -count throws Access Control Exception when restricted acess directories are present in the user's directory  . ,XML-based metrics as JSP servlet for NameNode,0,1,1
383,HDFS-453,HDFS-454,Won't Fix,XML-based metrics as JSP servlet for NameNode,HDFS workflow in JIRA does not match MAPREDUCE; HADOOP,0,1,1
384,HDFS-454,HDFS-455,Fixed,HDFS workflow in JIRA does not match MAPREDUCE; HADOOP,Make NN and DN handle in a intuitive way comma-separated configuration strings,0,0,1
385,HDFS-455,HDFS-456,Fixed,Make NN and DN handle in a intuitive way comma-separated configuration strings,Problems with dfs.name.edits.dirs as URI,0,0,1
386,HDFS-456,HDFS-457,Fixed,Problems with dfs.name.edits.dirs as URI,better handling of volume failure in Data Node storage,0,0,1
387,HDFS-457,HDFS-458,Fixed,better handling of volume failure in Data Node storage,Create target for 10 minute patch test build for hdfs,0,1,1
388,HDFS-458,HDFS-459,Fixed,Create target for 10 minute patch test build for hdfs,Job History Log Analyzer,0,1,1
389,HDFS-459,HDFS-460,Fixed,Job History Log Analyzer,Expose NN and DN hooks to service plugins,0,1,1
390,HDFS-460,HDFS-461,Won't Fix,Expose NN and DN hooks to service plugins,Analyzing file size distribution.,0,1,1
391,HDFS-461,HDFS-462,Fixed,Analyzing file size distribution.,Unit tests not working under Windows,0,1,1
392,HDFS-462,HDFS-463,Fixed,Unit tests not working under Windows,CreateEditsLog utility broken due to FSImage URL scheme check,0,1,1
393,HDFS-463,HDFS-464,Fixed,CreateEditsLog utility broken due to FSImage URL scheme check,Memory leaks in libhdfs,0,0,1
394,HDFS-464,HDFS-465,Fixed,Memory leaks in libhdfs,in branch-1; libhdfs makes jni lib calls after setting errno in some places,0,0,1
395,HDFS-465,HDFS-466,Won't Fix,in branch-1; libhdfs makes jni lib calls after setting errno in some places,hdfs_write infinite loop when dfs fails and cannot write files > 2 GB,1,1,1
396,HDFS-466,HDFS-467,Fixed,hdfs_write infinite loop when dfs fails and cannot write files > 2 GB,Fix a compiling error for libhdfs on Mac OSX,1,1,1
397,HDFS-468,HDFS-469,Unresolved,libhdfs should expose symlink dfs API,libhdfs should expose the acess permissions for the connected user from hdfs,1,1,1
398,HDFS-469,HDFS-470,Unresolved,libhdfs should expose the acess permissions for the connected user from hdfs,libhdfs should handle 0-length reads from FSInputStream correctly,1,0,1
399,HDFS-470,HDFS-471,Fixed,libhdfs should handle 0-length reads from FSInputStream correctly,hdfsproxy tests fails test patch builds. ,0,0,1
400,HDFS-471,HDFS-472,Cannot Reproduce,hdfsproxy tests fails test patch builds. ,Document hdfsproxy design and set-up guide,1,1,1
401,HDFS-472,HDFS-473,Fixed,Document hdfsproxy design and set-up guide,TestHdfsProxy fails in Linux,1,1,1
402,HDFS-474,HDFS-475,Won't Fix,Add simple HTTP GET support for single cluster case and for both Jetty and Tomcat based proxy ,Create a separate targets for fault injection related test and jar files creation files,0,1,1
403,HDFS-475,HDFS-476,Fixed,Create a separate targets for fault injection related test and jar files creation files,Create a fi test target.,1,1,1
404,HDFS-477,HDFS-480,Fixed,New Hadoop HDFS Site,Typo in jar name in build.xml,0,1,1
405,HADOOP-6139,HDFS-480,Fixed,Incomplete help message is displayed for rm and rmr options.,Typo in jar name in build.xml,0,0,1
406,HADOOP-6145,HDFS-480,Fixed,No error message for deleting non-existant file or directory.,Typo in jar name in build.xml,0,1,1
407,HDFS-480,HDFS-481,Fixed,Typo in jar name in build.xml,Bug Fixes + HdfsProxy to use proxy user to impresonate the real user,0,1,1
408,HDFS-482,HDFS-483,Fixed,change HsftpFileSystem's ssl.client.do.not.authenticate.server configuration setting to ssl-client.xml  ,Data transfer (aka pipeline) implementation cannot tolerate exceptions,0,1,1
409,HDFS-483,HDFS-484,Fixed,Data transfer (aka pipeline) implementation cannot tolerate exceptions,bin-package and package doesnt seem to package any jar file,0,1,1
410,HDFS-484,HDFS-485,Fixed,bin-package and package doesnt seem to package any jar file,error : too many fetch failures,0,1,1
411,HDFS-485,HDFS-486,Invalid,error : too many fetch failures,error : too many fetch failures,0,1,1
412,HDFS-486,HDFS-487,Invalid,error : too many fetch failures,HDFS should expose a fileid to uniquely identify a file,1,1,1
413,HADOOP-12459,HDFS-489,Unresolved,Implement moveToLocal  HDFS command,Updated TestHDFSCLI for changes from HADOOP-6139,0,0,1
414,HDFS-489,HDFS-490,Fixed,Updated TestHDFSCLI for changes from HADOOP-6139,eliminate the usage of FileSystem.create( ) depracated by Hadoop-5438 ,1,0,1
415,HDFS-491,HDFS-492,Fixed,Broken link in Safemode documentation,Expose corrupt replica/block information,0,1,1
416,HDFS-492,HDFS-493,Fixed,Expose corrupt replica/block information,Only fault-injected tests have to be executed by run-test-*-faul-inject targets; none of fault-injected tests need to be ran normal testing process,0,1,1
417,HDFS-493,HDFS-494,Fixed,Only fault-injected tests have to be executed by run-test-*-faul-inject targets; none of fault-injected tests need to be ran normal testing process,TestHDFSCLI tests FsShell; which is in common; causing a cross-project dependency,0,1,1
418,HDFS-494,HDFS-495,Unresolved,TestHDFSCLI tests FsShell; which is in common; causing a cross-project dependency,Hadoop FSNamesystem startFileInternal() getLease() has bug,0,0,1
419,HDFS-496,HDFS-497,Fixed,Use PureJavaCrc32 in HDFS,One of the DFSClient::create functions ignores parameter,0,1,1
420,HDFS-497,HDFS-498,Cannot Reproduce,One of the DFSClient::create functions ignores parameter,Add development guide and framework documentation,0,0,1
421,HDFS-498,HDFS-499,Fixed,Add development guide and framework documentation,Fix deprecation warnings introduced by HADOOP-5438,0,1,1
422,HDFS-500,HDFS-501,Fixed,Fix lingering and new javac warnings,Use enum to define the constants in DataTransferProtocol,0,0,1
423,HDFS-501,HDFS-502,Fixed,Use enum to define the constants in DataTransferProtocol,hudson ignored a test failure while generating the junit test report.,0,1,1
424,HDFS-502,HDFS-503,Cannot Reproduce,hudson ignored a test failure while generating the junit test report.,Implement erasure coding as a layer on HDFS,0,1,1
425,HDFS-503,HDFS-504,Fixed,Implement erasure coding as a layer on HDFS,HDFS updates the modification time of a file when the file is closed.,0,0,1
426,HDFS-504,HDFS-505,Fixed,HDFS updates the modification time of a file when the file is closed.,Convert the file including 10 minutes run's tests into the test harness test suite,0,0,1
427,HDFS-505,HDFS-507,Won't Fix,Convert the file including 10 minutes run's tests into the test harness test suite,Upgrade build to use findbugs-1.3.8,0,1,1
428,HADOOP-6272,HDFS-507,Fixed,"Incorrect UserName at Solaris because it has no ""whoami"" command by default",Upgrade build to use findbugs-1.3.8,0,1,1
429,HDFS-507,HDFS-508,Invalid,Upgrade build to use findbugs-1.3.8,Factor out BlockInfo from BlocksMap,0,1,1
430,HDFS-508,HDFS-509,Fixed,Factor out BlockInfo from BlocksMap,Redesign DataNode volumeMap to include all types of Replicas,0,1,1
431,HDFS-509,HDFS-510,Fixed,Redesign DataNode volumeMap to include all types of Replicas,Rename DatanodeBlockInfo to be ReplicaInfo,1,1,1
432,HDFS-510,HDFS-511,Fixed,Rename DatanodeBlockInfo to be ReplicaInfo,Redundant block searches in BlockManager.,0,1,1
433,HDFS-511,HDFS-512,Fixed,Redundant block searches in BlockManager.,Set block id as the key to Block,0,1,1
434,HDFS-512,HDFS-513,Fixed,Set block id as the key to Block,NameNode.getBlockLocations throws NPE when offset > filesize and file is not empty,0,1,1
435,HDFS-513,HDFS-514,Invalid,NameNode.getBlockLocations throws NPE when offset > filesize and file is not empty,DFSClient.namenode is a public field. Should be private.,0,1,1
436,HDFS-514,HDFS-515,Fixed,DFSClient.namenode is a public field. Should be private.,test-patch doesn't work on git checkouts,0,1,1
437,HDFS-515,HDFS-516,Fixed,test-patch doesn't work on git checkouts,Low Latency distributed reads,0,0,1
438,HDFS-516,HDFS-517,Won't Fix,Low Latency distributed reads,Introduce BlockInfoUnderConstruction to reflect block replica states while writing.,0,0,1
439,HDFS-517,HDFS-518,Fixed,Introduce BlockInfoUnderConstruction to reflect block replica states while writing.,Create new tests for Append's hflush,0,1,1
440,HDFS-518,HDFS-519,Fixed,Create new tests for Append's hflush,Create new tests for lease recovery,1,1,1
441,HDFS-519,HDFS-520,Fixed,Create new tests for lease recovery,Create new tests for block recovery,1,1,1
442,HDFS-520,HDFS-521,Fixed,Create new tests for block recovery,Create new tests for pipeline,1,1,1
443,HDFS-521,HDFS-522,Fixed,Create new tests for pipeline,Create stress tests for append feature,1,1,1
444,HDFS-523,HDFS-524,Later,Create performance/scalability tests for append feature,Further DataTransferProtocol code refactoring.,0,1,1
445,HDFS-524,HDFS-525,Fixed,Further DataTransferProtocol code refactoring.,ListPathsServlet.java uses static SimpleDateFormat that has threading issues,0,1,1
446,HDFS-525,HDFS-526,Fixed,ListPathsServlet.java uses static SimpleDateFormat that has threading issues,TestBackupNode is currently flaky and shouldn't be in commit test,0,1,1
447,HDFS-526,HDFS-527,Fixed,TestBackupNode is currently flaky and shouldn't be in commit test,Refactor DFSClient constructors,0,1,1
448,HDFS-527,HDFS-528,Fixed,Refactor DFSClient constructors,Add ability for safemode to wait for a minimum number of live datanodes,0,1,1
449,HDFS-528,HDFS-529,Fixed,Add ability for safemode to wait for a minimum number of live datanodes,More redundant block searches in BlockManager.,0,1,1
450,HDFS-529,HDFS-530,Fixed,More redundant block searches in BlockManager.,Refactor TestFileAppend* to remove code duplications,0,1,1
451,HDFS-530,HDFS-531,Fixed,Refactor TestFileAppend* to remove code duplications,Renaming of configuration keys,0,1,1
452,HDFS-531,HDFS-532,Fixed,Renaming of configuration keys,Allow applications to know that a read request failed because block is missing,0,1,1
453,HDFS-532,HDFS-533,Fixed,Allow applications to know that a read request failed because block is missing,Fix Eclipse template,0,0,1
454,HDFS-533,HDFS-534,Not A Problem,Fix Eclipse template,Required avro classes are missing,1,0,1
455,HDFS-534,HDFS-535,Fixed,Required avro classes are missing,TestFileCreation occasionally fails because of an exception in DataStreamer.,0,1,1
456,HDFS-535,HDFS-536,Not A Problem,TestFileCreation occasionally fails because of an exception in DataStreamer.,Support hflush at DFSClient,0,1,1
457,HDFS-536,HDFS-537,Fixed,Support hflush at DFSClient,DataNode uses ReplicaBeingWritten to support dfs writes/hflush,0,1,1
458,HDFS-537,HDFS-538,Fixed,DataNode uses ReplicaBeingWritten to support dfs writes/hflush,DistributedFileSystem::listStatus incorrectly returns null for empty result sets,0,1,1
459,HDFS-538,HDFS-539,Fixed,DistributedFileSystem::listStatus incorrectly returns null for empty result sets,Fault injeciton utlis for pipeline testing needs to be refactored for future reuse by other tests,0,0,1
460,HDFS-539,HDFS-540,Fixed,Fault injeciton utlis for pipeline testing needs to be refactored for future reuse by other tests,TestNameNodeMetrics fails intermittently,0,0,1
461,HDFS-540,HDFS-541,Cannot Reproduce,TestNameNodeMetrics fails intermittently,What will we encounter if we add a lot of nodes into the current cluster?,1,1,1
462,HDFS-541,HDFS-542,Invalid,What will we encounter if we add a lot of nodes into the current cluster?,Support fault injection tests in Hudson,0,1,1
463,HDFS-542,HDFS-543,Fixed,Support fault injection tests in Hudson,Break FSDatasetInterface#writeToBlock() into writeToTemporary; writeToRBW; and append,0,1,1
464,HDFS-543,HDFS-544,Fixed,Break FSDatasetInterface#writeToBlock() into writeToTemporary; writeToRBW; and append,"Add a ""rbw"" sub directory to DataNode data directory",1,1,1
465,HDFS-544,HDFS-545,Fixed,"Add a ""rbw"" sub directory to DataNode data directory",Add service lifecycle to the HDFS classes: NameNode; Datanode; etc,0,1,1
466,HDFS-545,HDFS-546,Won't Fix,Add service lifecycle to the HDFS classes: NameNode; Datanode; etc,DatanodeDescriptor block iterator should be BlockInfo based rather than Block.,0,1,1
467,HDFS-546,HDFS-547,Fixed,DatanodeDescriptor block iterator should be BlockInfo based rather than Block.,TestHDFSFileSystemContract#testOutputStreamClosedTwice sometimes fails with ClosedByInterruptException,0,1,1
468,HDFS-547,HDFS-548,Fixed,TestHDFSFileSystemContract#testOutputStreamClosedTwice sometimes fails with ClosedByInterruptException,TestFsck takes nearly 10 minutes to run - a quarter of the entire hdfs-test time,0,1,1
469,HDFS-548,HDFS-549,Fixed,TestFsck takes nearly 10 minutes to run - a quarter of the entire hdfs-test time,Allow non fault-inject specific tests execution with an explicit -Dtestcase=... setting,0,1,1
470,HDFS-549,HDFS-550,Fixed,Allow non fault-inject specific tests execution with an explicit -Dtestcase=... setting,DataNode restarts may introduce corrupt/duplicated/lost replicas when handling detached replicas,0,0,1
471,HDFS-550,HDFS-551,Fixed,DataNode restarts may introduce corrupt/duplicated/lost replicas when handling detached replicas,Create new functional test for a block report.,0,0,1
472,HDFS-551,HDFS-552,Fixed,Create new functional test for a block report.,Change TestFiDataTransferProtocol to junit 4 and add a few new tests,1,0,1
473,HDFS-552,HDFS-553,Fixed,Change TestFiDataTransferProtocol to junit 4 and add a few new tests,BlockSender reports wrong failed position in ChecksumException,0,0,1
474,HDFS-553,HDFS-554,Fixed,BlockSender reports wrong failed position in ChecksumException,BlockInfo.ensureCapacity may get a speedup from System.arraycopy(),0,0,1
475,HDFS-554,HDFS-555,Fixed,BlockInfo.ensureCapacity may get a speedup from System.arraycopy(),A few improvements to DataNodeCluster - HADOOP-5556 ,0,0,1
476,HDFS-555,HDFS-556,Unresolved,A few improvements to DataNodeCluster - HADOOP-5556 ,Provide info on failed volumes in the web ui,0,1,1
477,HDFS-556,HDFS-557,Fixed,Provide info on failed volumes in the web ui,documentation for dfsadmin; datanode; etc is using bin/hadoop instead of bin/hdfs,0,1,1
478,HDFS-559,HDFS-560,Won't Fix,Work out the memory consumption of NN artifacts on a compressed pointer JVM,Proposed enhancements/tuning to hadoop-hdfs/build.xml,0,1,1
479,HDFS-560,HDFS-561,Fixed,Proposed enhancements/tuning to hadoop-hdfs/build.xml,Fix write pipeline READ_TIMEOUT,0,0,1
480,HDFS-561,HDFS-562,Fixed,Fix write pipeline READ_TIMEOUT,Add a test for NameNode.getBlockLocations(..) to check read from un-closed file.,0,0,1
481,HDFS-562,HDFS-563,Fixed,Add a test for NameNode.getBlockLocations(..) to check read from un-closed file.,Simplify the codes in FSNamesystem.getBlockLocations(..),0,1,1
482,HDFS-563,HDFS-564,Fixed,Simplify the codes in FSNamesystem.getBlockLocations(..),Adding pipeline test 17-35,0,0,1
483,HDFS-564,HDFS-565,Fixed,Adding pipeline test 17-35,Introduce block committing logic during new block allocation and file close.,0,0,1
484,HDFS-565,HDFS-566,Fixed,Introduce block committing logic during new block allocation and file close.,INode.permissions should be marked as volatile to avoid synchronization problems,0,0,1
485,HDFS-566,HDFS-567,Fixed,INode.permissions should be marked as volatile to avoid synchronization problems,Two contrib tools to facilitate searching for block history information ,0,0,1
486,HDFS-567,HDFS-568,Fixed,Two contrib tools to facilitate searching for block history information ,TestServiceLevelAuthorization fails on latest build in Hudson,0,0,1
487,HDFS-568,HDFS-570,Fixed,TestServiceLevelAuthorization fails on latest build in Hudson,When opening a file for read; make the file length avaliable to client.,0,0,1
488,HADOOP-6209,HDFS-570,Won't Fix,chmod fails on Windows+cygwin,When opening a file for read; make the file length avaliable to client.,0,1,1
489,HDFS-570,HDFS-571,Fixed,When opening a file for read; make the file length avaliable to client.,Hdfs source code has significant number of JavaDocs errors and warnings,0,1,1
490,HDFS-571,HDFS-573,Fixed,Hdfs source code has significant number of JavaDocs errors and warnings,Porting libhdfs to Windows,0,1,1
491,HDFS-574,HDFS-575,Fixed,Hadoop Doc Split: HDFS Docs,DFSClient read performance can be improved by stagerring connection setup to datanode(s),0,0,1
492,HDFS-575,HDFS-576,Unresolved,DFSClient read performance can be improved by stagerring connection setup to datanode(s),Extend Block report to include under-construction replicas,0,1,1
493,HDFS-576,HDFS-577,Fixed,Extend Block report to include under-construction replicas,Name node doesn't always properly recognize health of data node,0,1,1
494,HDFS-577,HDFS-578,Won't Fix,Name node doesn't always properly recognize health of data node,Support for using server default values for blockSize and replication when creating a file,0,1,1
495,HDFS-578,HDFS-579,Fixed,Support for using server default values for blockSize and replication when creating a file,HADOOP-3792 update of DfsTask incomplete,0,1,1
496,HDFS-579,HDFS-580,Fixed,HADOOP-3792 update of DfsTask incomplete,Name node will exit safe mode w/0 blocks even if data nodes are broken,0,1,1
