Shade jackson core,Spark Cannot be used with software that requires jackson-databind 2.6+: RDDOperationScope
Always post TaskEnd event for tasks in cancelled stages,Executors show up active tasks indefinitely after stage is killed
CoarsedExecutorBackend register to driver should wait Executor was ready?,CoarsedExecutorBackend register to driver should wait Executor was ready
Add scalastyle command used in build testing,Upgrade scalastyle to 1.0.0
DAG viz does not work with latest version of chrome,DAG Diagram not shown properly in Chrome
spark.ml Naive Bayes user guide,Missing ml.NaiveBayes in MLlib guide
CoarsedExecutorBackend register to driver should wait Executor was ready,"Driver may send ""LaunchTask"" before executor receive ""RegisteredExecutor"""
CoarsedExecutorBackend register to driver should wait Executor was ready,Executors self-killing after being assigned tasks while still in init
Upgrade Parquet to 1.9 (Fixes parquet sorting),Update Parquet to 1.9.0
Upgrade Parquet to 1.9 (Fixes parquet sorting),Parquet NPE / Update to 1.9
Upgrade Parquet to 1.9 (Fixes parquet sorting),Upgrade parquet to 1.9
Add API and options for csv data sources,Support for loading CSV with a single function call
Migrate away from SynchronizedMap which is deprecated,Replace use of mutable.SynchronizedMap with ConcurrentHashMap
Cleanup build references to Scala 2.10,Update pom.xml to reference Scala 2.11
Cleanup build references to Scala 2.10,Update LICENSE with Scala 2.11 dependencies
Cleanup build references to Scala 2.10,Update Docker tests to use Scala 2.11
Cleanup build references to Scala 2.10,Update release audit tools to use Scala 2.11
Unify DataFrame and Dataset API,Datasets cannot be sorted
Bump up Kafka to 0.9.0.0,Bump up Kafka to 0.9.0.0
Expose more executor stats in stable status API,Improve SparkStatusTracker to also track executor information
Reuse the shuffle for duplicated exchange,Reuse the exchanges in a query
Use Apache Arrow as In-memory columnar store implementation,Implement Apache Arrow serializer for Spark DataFrame for use in DataFrame.toPandas
NPE in LazilyGeneratedOrdering,LazilyGenerateOrdering throws NullPointerException
SQL generation for uncorrelated scalar subqueries,SQL generation for subquery
Expose ml summary function in PySpark for classification and regression models,Expose regression summary classes in Pyspark
Spark need to support reading data from Hive 2.0.0 metastore,Spark2.x does not support read data from Hive 2.x metastore
Spark need to support reading data from Hive 2.0.0 metastore,Upgrade Hive dependence to Hive 2.x
Spark need to support reading data from Hive 2.0.0 metastore,Support Hive 2.x's metastore
Document MLlib behavior changes in Spark 2.0,ML/MLlib breaking changes between 1.6 & 2.0
Some DataFrame joins stopped working with UnsupportedOperationException: No size estimation available for objects,Can't load a json dataset with nested wide schema
Deadlock between MemoryStore and BlockManager,Deadlock when retreiving shuffled cached data
Deadlock between MemoryStore and BlockManager,Spark driver hangs up periodically (cannot receive any reply in 120 seconds)
Deadlock between MemoryStore and BlockManager,Spark executor deadlocks itself in memory management
Deadlock between MemoryStore and BlockManager,DeadLock happens when    StaticMemoryManager    release in-memory block
Support virtualenv in PySpark,virtualenv example does not work in yarn cluster mode
Delete spark.sql.parquet.cacheMetadata,Remove `spark.sql.parquet.cacheMetadata`
Job will always fail in the external shuffle service unavailable situation,Spark AM launching containers on node where External spark shuffle service failed to initialize
Finalize the public API for FileFormat,Simplify and Speedup HadoopFSRelation (follow-up)
Possible unsafe bytesRead increment in StreamInterceptor,SQLContext.range should return Dataset[Long]
"Spark SQL drops the table in ""overwrite"" mode while writing into table",DataFrameWriter's jdbc method drops table in overwrite mode
Spark 1.6.0 stopping working for HiveThriftServer2 and registerTempTable,Spark 1.6.0 stopping working for HiveThriftServer2 and registerTempTable
Set hive conf failed use --hiveconf when beeline connect to thriftserver,"HiveThriftServer2 can not get ""--hiveconf"" or ''--hivevar"" variables since 1.6 version (both multi-session and single session)"
Pyspark ml.tuning support export/import,CrossValidator and TrainValidationSplit Persist Nested Estimators such as OneVsRest
Lock release errors occur frequently in executor logs,mapWithState causes block lock warning
Lock release errors occur frequently in executor logs,Managed Memory Leak Msg Should Only Be a Warning
using a regexp_replace in a group by clause raises a nullpointerexception,Regular expression replace throws NullPointerException when serialized
Upgrade to Scala 2.11.8,Upgrade to Scala 2.11.8
TPC-DS Query 36 fails with Parser error,SPARK-SQL CLI returns NPE
Feature parity for ALS ML with MLLIB,Review spark.ml parity for recommendation
TPCDS query 49 returns wrong results compared to TPC official result set ,TPCDS query 74 returns wrong results compared to TPC official result set 
Failed to bind reference when cume_dist is used,Window functions failed in cluster
Failed to bind reference when cume_dist is used,Physical Window operator uses global SizeBasedWindowFunction.n attribute generated on both driver and executor side
Issue an exception when hitting max iteration limit in testing,Fail the tests if the any catalyst rule reach max number of iteration.
Add support for pluggable cluster manager,[PYSPARK] Make Lambda Serializer Configurable
spark.hadoop.* configurations are not applied for Parquet Data Frame Readers,Propagate data source options to Hadoop configurations
Resolving the Conflicts of ColumnPruning and PushPredicateThroughProject ,ColumnPruning is conflict with PushPredicateThroughProject
Other clients' connection hang up when someone do huge load,"Multi-session can not work when one session is moving files for ""INSERT ... SELECT"" clause"
do not remove sub-queries added by user when generate SQL,SQLBuilder should add subquery to Aggregate child when necessary
"HiveThriftServer2 can not get ""--hiveconf"" or ''--hivevar"" variables since 1.6 version (both multi-session and single session)","SparkThriftServer2 can not get ''--hivevar"" variables in spark 2.1"
"Multi-session can not work when one session is moving files for ""INSERT ... SELECT"" clause",Spark's HiveThriftServer should be able to use multiple sqlContexts
Add parameter check to GradientDescent,Add parameter check to several MLlib implementations
sql time stamps do not respect time zones,Infrastructure for session local timezone support
Parallel training jobs in model selection,Optimizations for ML Pipeline Tuning
The optimization method of convex function,The optimization method of convex function 
SPARK-SQL CLI returns NPE,StackOverflowError in Kryo when executing TPC-DS
[Table related commands] Describe table,Implement TRUNCATE TABLE Command
Generated SpecificColumnarIterator code can exceed JVM size limit for cached DataFrames,Code-Generated SpecificColumnarIterator fails for wide pivot with caching
Imported implicits can't be found in Spark REPL in some cases,Implicit resolution doesn't work in multiple Statements in Spark Repl 
Imported implicits can't be found in Spark REPL in some cases,Can not define class variable in repl
Imported implicits can't be found in Spark REPL in some cases,Cannot use imported class as parameter of case class in spark-shell
My dataset does not provide proper predictions in ALS,RegressionEvaluator returns NaN for ALS in Spark ml
java.lang.IllegalStateException: Did not find registered driver with class oracle.jdbc.OracleDriver,Association with remote system [akka.tcp://sparkDriver@192.168.1.81:34047] has failed; address is now gated for [5000] ms. Reason is: [Association failed$
UDAF aggregates argument object inspector not parsed correctly,RewriteDistinctAggregates UnresolvedException when a UDAF has a foldable TypeCheck
Hive table partition predicate not passed down correctly,Improvement a special case for non-deterministic projects in optimizer
spark csv reader not working properly if CSV content contains CRLF character (newline) in the intermediate cell,multi line support for CSV
Cannot project all columns from a parquet files with ~1;100 columns,Cherry-pick Wide Table Support for Parquet Codegen from Spark 2.0
Output of monotonically_increasing_id lacks stable relation with rows of DataFrame,'monotonicallyIncreasingId()' should be deterministic
Evaluate GaussianMixtureModel with LogLikelihood,Expose log likelihood of EM algorithm in mllib
Add FileFormat.isSplittable to indicate whether a format is splittable,Reading gzipped files results in duplicate rows
Empty ORC table join throws exception,Problem select empty ORC table
Dataframe returns wrong results due to parsing incorrectly,Wrong result can be returned or AnalysisException can be thrown after self-join or similar operations
approxQuantile should support multi columns,Add API to calculate the approximate quantiles for multiple columns
Repartition by column,SparkR - Implement repartitionByColumn on DataFrame
Use FunctionIdentifier in FunctionRegistry/SessionCatalog,UnresolvedFunction should use FunctionIdentifier rather than just a string for function name
Enable Hive-1.x ORC compatibility with spark.sql.hive.convertMetastoreOrc,"Error occurs when using Spark sql ""select"" statement on orc file after hive sql ""insert overwrite tb1 select * from sourcTb"" has been executed on this orc file"
Enable Hive-1.x ORC compatibility with spark.sql.hive.convertMetastoreOrc,"Spark2.0 cannot ""select"" data from a table stored as an orc file which has been created by hive while hive or spark1.6 supports"
User guide doc and examples for GaussianMixture in spark.ml,Add documentaion and examples for GaussianMixture
Python OneVsRest should train multiple models at once,Parallel One vs. Rest Classifier
DataFrameWriter JDBC doesn't Quote/Escape column names,jdbc datasource read fails when  quoted  columns (eg:mixed case; reserved words) in source table are used  in the filter.
Remove mllib-local from mima project exclusion,Move sketch and mllibLocal out from mima exclusion
The alias created in SELECT could be used in GROUP BY and followed expressions,alais cannot use in group by
GLM supports output link prediction,GLM should support predict link
The catalog of SQLContext should not be case-sensitive ,SparkSession should be case insensitive by default
RowMatrix.computeCovariance inaccurate when values are very large,RowMatr  x Covariance
SQL/Hive insertInto has unexpected results,Spark/Hive insert Into has unexpected results
Cooperative Memory Management for Spillables,spark leak memeory and led to OOM
abstract class Receiver should be explicit about the return type of its methods,Code style: public abstract methods should have explicit return types
when executor lost DagScheduer may submit one stage twice even if the first running taskset for this stage is not finished,DAGScheduler should avoid sending conflicting task set.
Expose SparkLauncher's ProcessBuilder for user flexibility,SparkLauncher should allow setting working directory for spark-submit process
Linear algebra: clarify light vs heavy constructors and accessors,Bug in SparseMatrix multiplication with SparseVector
Revert SPARK-12130 to make 2.0 shuffle service compatible with 1.x,"spark-shell unresponsive after ""FetchFailedException: java.lang.UnsupportedOperationException: Unsupported shuffle manager"" with YARN and spark.shuffle.service.enabled"
Improve delegation token handling in secure clusters,Add a new Configurable Token Manager  for Spark Running on YARN
Improve delegation token handling in secure clusters,Introduce a way for users to easily add support for new services that need delegation tokens
LazilyGenerateOrdering throws NullPointerException,Spark-SQL: Get com.esotericsoftware.kryo.KryoException: java.lang.NullPointerException when runing query_1.sql of TPC-DS
LazilyGenerateOrdering throws NullPointerException,java.lang.NullPointerException when run spark 2.0 setting spark.serializer=org.apache.spark.serializer.KryoSerializer
Fail to parse TPCDS Q90,Cannot drop a table which has the name starting with 'or'
Fail to parse TPCDS Q90,HiveContext cannot create a table named sort
Spark SQL documentation should be more precise about which SQL features it supports,Spark SQL DDL/DML docs non-existent
"Codegen ""no constructor found"" errors with Maps inside case classes in Datasets",Datasets - crash (compile exception) when mapping to immutable scala map
Support correlated scalar subquery,TPC-DS query 1 resolved attribute(s) missing
Disable Passing to Hive the queries that can't be parsed,Remove HiveNativeCommand
Graph vertexRDD/EdgeRDD checkpoint results ClassCastException: ,Cannot perform RDD operations on a checkpointed VertexRDD.
"Improve the ""SET"" and ""SET -v"" command",Fix SET command to show a result correctly and in a sorted order
Generated SpecificUnsafeProjection Exceeds JVM Code Size Limits,Generated SpecificColumnarIterator code can exceed JVM size limit for cached DataFrames
Generated SpecificUnsafeProjection Exceeds JVM Code Size Limits,CodeGenerator - failed to compile: org.codehaus.janino.JaninoRuntimeException: Code of method Error
Python GaussianMixture summary,Add model summaries for Python GMM and BisectingKMeans
SparkSession Python API,Python SparkSession API
Tasks that fail due to CommitDeniedException (a side-effect of speculation) can cause job to never complete,Task with commit failed will retry infinite when speculation set to true
Alter Table Drop Partition Using Predicate-based Partition Spec,ALTER TABLE DROP PARTITION should support comparators
JDBCRelation should report an IllegalArgumentException if stride equals 0,JDBC source: Wrong Partition Generation when numPartitions is More than the number of rows between upper and lower bounds
   Problem Reading partitioned ORC or Parquet files,Dataset.partitionBy.csv raise a java.io.FileNotFoundException when launched on an hadoop cluster
YarnShuffleService should use YARN getRecoveryPath() for leveldb location,Shuffle Service fails to start if first yarn.nodemanager.local-dirs is bad
YarnShuffleService should use YARN getRecoveryPath() for leveldb location,YARNShuffleService doesn't get current local-dirs from NodeManager
Document spark.sql.broadcastTimeout configuration,"add ""spark.sql.broadcastTimeout"" into docs/sql-programming-guide.md to help people to how to fix this timeout error when it happenned"
Usage of Temp Table twice in Hive query fails with bad error,Usage of Temp Table twice in Hive query 
Use the value of spark.sql.warehouse.dir as the warehouse location instead of using hive.metastore.warehouse.dir,Use proper metastore warehouse path
Use SparkSession instead of SQLContext in testsuites,Use SparkSession instead of SQLContext in Python tests
History Server would OOM due to unlimited TaskUIData in some stages,spark HistoryServer memory increases until gets killed by OS.
CSV data source recognizes empty quoted strings in the input as null. ,Reading empty string from csv has changed behaviour
Spark Mesos dispatcher becomes unusable when the Mesos master restarts,Mesos dispatcher should handle DRIVER_ABORTED status from mesosDriver.run()
option nullValue for CSV data source not working for several types.,Spark 2.0 CSV does not cast null values to certain data types properly
SparkR spark.naiveBayes throws error when label is numeric type,SparkR NaiveBayes should not require label to have NominalAttribute
String fields in Dataframe behaves weirdly when executor-memory >= 32GB,String fields in Dataframe behaves weirdly when executor-memory >= 32GB
String fields in Dataframe behaves weirdly when executor-memory >= 32GB,String fields in Dataframe behaves weirdly when executor-memory >= 32GB
Deprecate registerTempTable and add dataset.createTempView,Replace the usage of deprecated DataSet API in tests
Adding outputMode to structure Streaming Experimental Api,Add support for complete output mode 
Implement code generation for Generate,"select($""column1""; explode($""column2"")) is extremely slow"
Can not delete jar and list jar in spark Thrift server,Add DELETE FILE command support in spark
CSV file data-line with newline at first line load error,Support multline csv records
Back quoted column with dot in it fails when running distinct on dataframe,Weird behaviour of the DataFrame when a column name contains dots.
UDF executed twice when filter on new column created by withColumn and the final value may be not correct,Add deterministic to ScalaUDF
Generated SpecificSafeProjection.apply method grows beyond 64 KB,GeneratedIterator grows beyond 64 KB
JobProgressListener takes a huge amount of memory with iterative DataFrame program in local; standalone,monotonicallyIncreasingId should use less memory with multiple partitions
OutOfMemory in TimSort ,Spark executor OOM during TimSort
Should print spark-submit usage when no arguments is specified,spark-submit --help throws exception
physical object operator should define `reference` correctly,"Codegen CompileException ""mapelements_isNull"" is not an rvalue"
monotonicallyIncreasingId doesn't work when data is upsampled,Dataset.sample with seed: result seems to depend on downstream usage
"Codegen CompileException ""mapelements_isNull"" is not an rvalue",Codegen failure with a Dataframe program using an array
Remove unnecessary calculation of stage's parents,Improve readability of DAGScheduler stage creation methods
Default value mismatch of param linkPredictionCol for  GeneralizedLinearRegression,Flaky test:pyspark.ml.tests.DefaultValuesTests.test_java_params
Support for creating a dataframe from CSV in Dataset[String],catalyst using BigInteger.longValueExact that not supporting java 7 and compile error
Add support for writing partitioned `csv`; `json`; `text` formats in Structured Streaming,Support all file formats in structured streaming
CSV fails to write and read back empty dataframe,Spark 2.0.2 writes empty file if no record is in the dataset
CSV fails to write and read back empty dataframe,Add tests for writing and reading back empty data for Parquet; Json and Text data sources
only one notebook can define a UDF; java.sql.SQLException: Another instance of Derby may have already booted the database,pyspak hiveContext can not create UDF: Py4JJavaError: An error occurred while calling None.org.apache.spark.sql.hive.HiveContext. 
repartition(0) should raise IllegalArgumentException.,Repartiton call w/ 0 partitions drops data
TopicAndPartition should provide __hash__ method,fromOffsets parameter in Kafka's Direct Streams does not work in python3
Paginate Job Table in Jobs tab,"Completed Jobs and ""Completed Stages"" support pagination"
CatalogRelation should fallback to HDFS size of partitions that are involved in Query if statistics are not available.,Partition pruning for metastore relation size estimates for better join selection.
ALTER TABLE RENAME doesn't work for datasource tables,Not able to access table's data after ALTER TABLE RENAME in Spark 1.6.2
Ensure FileSystem is gotten from path in InMemoryCatalog,spark sql local FS spark.sql.warehouse.dir throws on YARN
Throw exception if columns number of outputs mismatch the inputs,better error message if the number of columns in SELECT clause doesn't match the table schema
Make ListenerBus event queue size configurable,Make the queue capacity of LiveListenerBus configurable.
"Error occurs when using Spark sql ""select"" statement on orc file after hive sql ""insert overwrite tb1 select * from sourcTb"" has been executed on this orc file",OrcConversions should not convert an ORC table represented by MetastoreRelation to HadoopFsRelation if metastore schema does not match schema stored in ORC files
Add DELETE FILE command support in spark,delete jar unable
Make continuous Parquet writes consistent with non-continuous Parquet writes,Consolidate streaming and batch write path
Spark 2.0 thrift server not starting in cluster mode.,Spark 2.0 thrift server not starting in hadoop cluster.
joinWith bytecode generation calling ByteBuffer.wrap with InternalRow,Schema is not checked when converting DataFrame to Dataset using Kryo encoder
update the whole sql programming guide,Update SQL programming guide for Spark 2.0
Hang while enable blacklistExecutor and DynamicExecutorAllocator ,Job should not be aborted when dynamic allocation is enabled or spark.executor.instances larger then current allocated number by yarn
Spark 2.0/master maven snapshots are broken,Maven doc JAR generation fails when JAVA_7_HOME is set
Spark unable to read partitioned table in avro format and column name in upper case,Spark unable to read partitioned table in avro format and column name in upper case
spark.createDataFrame raises an exception in Spark 2.0 tests on Windows,file scheme should be used correctly
file scheme should be used correctly,spark 2.0.1 fails in windows when using file:/// scratchdir in hive-site.xml
Add a deprecation warning for Python 2.6,More officially deprecate support for Python 2.6; Java 7; and Scala 2.10
Remove additional Project to be consistent with SQL when insert into table,use by-position resolution when insert into hive table
unionAll returns wrong result when two dataframes has schema in different order,Union uses column order rather than schema
"Spark Application rest api returns ""no such app: <appId>""",Spark History server Rest Api gives Application not found error for yarn-cluster mode
Eliminate unreachable code at projection for complex types,"Use `ev.isNull = ""false""` if possible for Janino to have a chance to optimize."
GroupedData's member incorrectly named,Fix GroupedData Documentation
GroupedData varargs arguments misnamed,Fix GroupedData Documentation
Disallow Duplicate Columns in `partitionBy`; `bucketBy` and `sortBy`,unify logical plans for CREATE TABLE and CTAS
Eliminate nullcheck code at projection for an array type,Reduce runtime overhead of a program that creates an primitive array in DataFrame
Yarn cluster mode should return consistent result for command line and SparkLauncher,SparkAppHandle.getState() returns wrong state in standalone mode if Spark application terminates unexpectedly
Refactoring CSV data source to be consistent with JSON data source,Share a single Row for CSV data source rather than creating every time
Can't join describe() of DataFrame in Scala 2.10,"unionAll raises ""Task not serializable"""
Incorrect behavior for isNull filter,Full Outer join with literal column results in incorrect result
Expose information schema,basic INFORMATION_SCHEMA support
regexp_extract to return an ArrayType(StringType()),Add match Column expression for regular expression matching in Scala API 
Reduce runtime overhead of a program that writes an primitive array in Dataframe/Dataset,Optimize SerializeFromObject for primitive array
CSV data source does not write date and timestamp correctly,DataFrame DateType is written as an int(Days since epoch) by csv writer
CSV data source does not write date and timestamp correctly,dateFormat should be used when writing dataframes as csv files
CSV data source does not write date and timestamp correctly,dateFormat unexpected kwarg to df.write.csv
Speculative Task may not be able to overwrite file,Failed to saveAsHadoop when speculate is enabled
model loading backward compatibility for ml.feature.PCA,model loading backward compatibility for ml.feature.PCA
Can't use escapeQuotes option in DataFrameWriter.csv(),Cleanup options for DataFrame reader API in Python
Full Outer join with literal column results in incorrect result,Bug in left-outer join
Capture errors from R workers in daemon.R to avoid deletion of R session temporary directory,Capture errors from R workers in daemon.R to avoid deletion of R session temporary directory
LinkageError should not crash Spark executor,LinkageError should not crash Spark executor
Improve testing for DecisionTree variances,Improve testing for DecisionTree variances
SparkR csv source should have the same default na.string as R,SparkR csv source should have the same default na.string as R
Docs for Kafka 0.10 consumer integration,Spark streaming kafka version compatibility. 
Docs for Kafka 0.10 consumer integration,Kafka Direct Stream is not experimental anymore
the history server of spark2.0-preview (may-24 build) consumes more than 1000% cpu,Excessive Spark history event/json data size (5GB each)
Excessive Spark history event/json data size (5GB each),Remove internal.metrics.updatedBlockStatuses accumulator from history files
Excessive Spark history event/json data size (5GB each),Spark event logs are huge compared to 1.5.2
DataFrame allows duplicate column-names,DataFrame Row StructType check duplicate name
FROM_UNIXTIME reports incorrect days,from_unixtime function gives wrong answer
DataFrameWriter's jdbc method drops table in overwrite mode, Support `truncate` option in Overwrite mode for JDBC DataFrameWriter
EnsureRequirements adds extra Sort to already sorted cached table,Planner adds un-necessary Sort even if child ordering is semantically same as required ordering
Build failes for Mesos 0.28.x,Support Mesos Unified Containerizer
Reuse the uncorrelated scalar subqueries with the same logical plan in a query,Reuse subqueries within single query
Spark 2.0 CSV does not cast null values to certain data types properly,nullValue in first field is not respected by CSV source when read
Spark 2.0 CSV does not cast null values to certain data types properly,cannot read null dates from csv file
Spark 2.0 CSV does not cast null values to certain data types properly,Spark CSVInferSchema does not always respect nullValue settings
