Killing tasks in spark - request for comment,Killing tasks in spark
support external sort,Support external sorting for RDD#sortByKey()
Update docs to say that you need to set MESOS_NATIVE_LIBRARY when running standalone apps on Mesos,MESOS_NATIVE_LIBRARY env var needs to be set when running on Mesos
Update examples to pass JARs when building a SparkContext in 0.6 and master,Update examples to pass JAR file to SparkContext in master and 0.6 branches
Default SPARK_MEM on AMI too high,Spark runs out of memory on fork/exec (affects both pipes and python)
Add mechanism to run system management/configuration tasks on all workers,"Add a ""setup hook"" API for running initialization code on each executor"
Add mechanism to run system management/configuration tasks on all workers,Provide a utility for running a function once on each executor
Propagate exceptions from PySpark workers to the driver,PySpark should capture and re-throw Python exceptions
Implement co-partitioning aware joins in PySpark,Pyspark does not support narrow dependencies
"Executor gets stuck in a ""zombie"" state after running out of memory",Exit executors faster if they get into a cycle of heavy GC
Have a DSL or other language support for OLAP expressions,Support for optimizing and executing structured queries
Memoize results of getPreferredLocations,Exponential recursion in getPreferredLocations
Let deploy scripts set alternate conf; work directories,SPARK_CONF_DIR is not effective in spark-submit
RDD should be covariant in T,Make RDDs Covariant
LocalSparkContext should be included in Spark JAR,Move common unit test utilities into their own package / module
Multiple Spark Contexts active in a single Spark Context,Support multiple SparkContexts in the same JVM
Print a nicer error message when incompatible Spark binaries try to talk,Spark returns misleading message when client is incompatible with server
Clean up old work directories in standalone worker,Standalone Worker cleanup should not clean up running executors
add DenseVector and SparseVector to mllib; and replace all Array[Double] with Vectors,Cloudpickle does not work correctly for some methods that use a splat
ResultTask's serialization forget to handle generation,"ResultTask's serialization forget about handling ""generation"" field; while ShuffleMapTask does"
Document fair scheduler,Add docs page for fair scheduler
Killing jobs on standalone cluster,Offer user the ability to kill application in master web UI for standalone mode
Add JSON endpoints to SparkUI,REST API for Spark application info (jobs / stages / tasks / storage info)
spark_ec2 script when ssh/scp-ing should pipe UserknowHostFile to /dev/null,Ignore UserKnownHostsFile in SSH calls
spark_ec2 script when ssh/scp-ing should pipe UserknowHostFile to /dev/null,Ignore UserKnownHostsFile in SSH calls
Please publish jars for Scala 2.10,Upgrade Spark to Scala 2.10
Executors that exit cleanly should not have KILLED status,Executor state shows as KILLED even the application is finished normally
Gaussian Mixture Model,Gaussian Mixture Model clustering
Python version of Gaussian Mixture Model,Gaussian Mixture Model clustering
Latent Dirichlet Association (LDA model),parallel Latent Dirichlet Allocation (LDA) atop of spark in MLlib
When iteration in ALS increases to 10 running in local mode; spark throws out error of StackOverflowError,MLlib ALS gets stack overflow with too many iterations
Persistent web ui,Persisting Web UI through refactoring the SparkListener interface
"Seemingly spurious ""Duplicate worker ID"" error messages",Worker registration failed: Duplicate worker ID error during Master failover
Support external sorting for RDD#sortByKey(),sortByKey requires all data to fit in memory
Don't reuse Writable objects in HadoopRDDs by default,take and collect don't work on HadoopRDD
MLlib ALS gets stack overflow with too many iterations,The simple test error
Update all unit tests to use SparkConf instead of system properties,Clean up uses of System.setProperty in unit tests
Have DEVELOPERS.txt file with documentation for developers,Improve Developer Documentation
MultilogisticRegressionWithSGD,Generalize the binary logistic regression into multinomial logistic regression
take and collect don't work on HadoopRDD,Cached Hadoop RDD always return rows with the same value
SparkListener interfaces should not expose internal types/objects,Persisting Web UI through refactoring the SparkListener interface
ExternalAppendOnlyMap Iterator throw no such element on joining two large rdd,External Spilling Bug - hash collision causes NoSuchElementException
Ability to disable the spark ui server (unit tests),Alleviate port collisions during tests
Ability to disable the spark ui server (unit tests),Allow users to disable Jetty Spark UI in local mode
Default log4j initialization causes errors for those not using log4j,Do not initialize log4j if slf4j log4j backend is not being used
Tidy logging strategy and use of log4j,Send all dependency logging through slf4j
Some corner case during HA master switching?,Support HA in standalone cluster mode
Ensure all public methods return explicit types,"Add to style checker ""public method must have explicit type defined"""
ConcurrentModificationException,ConcurrentModificationException in hadoop_common exposed by Spark
Add saveAsHBase to PairRDDFunctions,Add common solution for sending upsert actions to HBase (put; deletes; and increment)
Parallelize Task Serialization,Investigate using multiple threads for task serialization
Suggestions for exception handling (avoid potential bugs),Suspicious exception handlers
ArrayStoreException on mapping RDD on cluster,Prevent ContextClassLoader of Actor from becoming ClassLoader of Executor
Generalize VertexId in GraphX so that UUIDs can be used as vertex IDs.,Enable String ID's for GraphX
Spark fills up disk with app-* folders,Standalone Worker cleanup should not clean up running executors
Add Shortest-path computations to graphx.lib,Shortest Path between two vertices; using distance and results carries shortest path and distance
Add histogram() to PySpark,Missing API in PySpark
Add histogram() to PySpark,Make python support for histograms
Allow to provide a custom persistence engine,Deploy failover; Make Persistence engine and LeaderAgent Pluggable.
GraphX triplets not working properly,spark graph.triplets does not return correct values
Type mismatch in Spark shell when using case class defined in shell,REPL $outer type mismatch causes lookup() and equals() problems
Type mismatch in Spark shell when using case class defined in shell,Spark shell has weird scala semantics
Do not materialize partitions whenever possible in BlockManager,"Pass ""cached"" blocks directly to disk if memory is not large enough"
Clustering: Index out of bounds error,Check for the number of clusters to avoid ArrayIndexOutOfBoundsException
Add a OneHotEncoder for handling categorical features,Add OneHotEncoder as a Transformer
DEAD worker should recover automaticly,Workers should reconnect to Master if disconnected
Update Jetty to 9,Upgrade Jetty to 8.1.14v20131031
Master web UI and Worker web UI returns a 404 error,Fix 404 not found error in UI introduced in Jetty 9.0 upgrade
Implicit ALS unnecessarily recomputes factor matrices,Persist factors in implicit ALS
[STREAMING] Annotate developer and experimental API's,cogroup and groupby should pass an iterator
"Stage.name return  ""apply at Option.scala:120""","Stage.name return ""apply at Option.scala:120"""
Create spark-contrib repo for 1.0,Create spark-contrib repo for 1.0
yarn alpha and stable Client calculateAMMemory routines are different,yarn stable client doesn't properly handle MEMORY_OVERHEAD for AM
Upgrade HBase dependency to 0.98.0,spark-examples should depend on HBase modules for HBase 0.96+
Clean-up and clarify private vs public fields in MLLib,[streaming] Add deployment subsection to streaming
"Add UI elements to collapse ""Aggregated Metrics by Executor"" pane on stage page",Add quick-links to StagePage to jump to Accumulator/Task tables
httpd doesn't start in spark-ec2 (cc2.8xlarge),EC2: Ganglia-httpd broken on hvm based machines like r3.4xlarge
Job fails with spot instances (due to IllegalStateException: Shutdown in progress),java.io.IOException: Filesystem is thrown when ctrl+c or ctrl+d spark-sql on YARN 
sbt assemble-deps no longer works,"Spark shell fails to start after ""sbt clean assemble-deps package"""
spark on yarn-alpha with mvn on master branch won't build,The maven build error for Spark Tools
Application web UI garbage collects newest stages instead old ones,When using spark.ui.retainedStages=n only the first n stages are kept; not the most recent.
IllegalArgumentException when writing to disk,2GB limit in spark for blocks
Web UI should provide page of showing statistics and stage list for a given job,Create jobs overview and job details pages on the web UI
Add streaming support for Spark SQL module,Structured Streaming (aka Streaming DataFrames)
BlockManager cannot transfer blocks larger than 2G in size,Address various 2G limits
Local spark-shell Runs Out of Memory With Default Settings,"Pass ""cached"" blocks directly to disk if memory is not large enough"
Spark Streaming's received data is not cleaned up from BlockManagers when not needed any more,Old streaming input blocks not removed automatically from the BlockManagers
EventLogging to HDFS doesn't work properly on yarn,FileLogger throws a invocation target exception.
Add scripts for launching Spark on Google Compute Engine,Add scripts for launching Spark on Google Compute Engine (GCE)
Upgrade Mesos dependency to 0.17.0,Upgrade to Mesos 0.18.1 with Shaded Protobuf
Don't assume context class loader is set when creating classes via reflection,Choose classloader consistently inside of Spark codebase
Add Window function support,Spark SQL can't support lead() over() window function
Update branch-0.9's SBT to 0.13.1 so that it works with Java 8,Build failure on JDK8 :: SBT fails to load build configuration file
Multinomial Logistic Regression Support,Generalize the binary logistic regression into multinomial logistic regression
Improve the way Spark on Yarn waits for executors before starting,Submit stage after executors have been registered
Determine which test suites to run based on code changes,Avoid running MLlib and Streaming tests when testing SQL PRs
Examples of ML algorithms are using deprecated APIs,Update MLLib Examples to Use Breeze
Workers continuously produce failing executors,Skip bad workers when re-launching executors
Specialized ColumnType for Timestamp,Specialized ColumnType for Timestamp
Publish nightly snapshots of documentation; maven artifacts; and binary builds,Post nightly releases
Assembly Jar with more than 65536 files won't work when compiled on  JDK7 and run on JDK6,pyspark doesn't work with assembly jar containing over 65536 files/dirs built on redhat 
Assembly Jar with more than 65536 files won't work when compiled on  JDK7 and run on JDK6,PySpark fails due to  zipimport not able to load the assembly jar (/usr/bin/python: No module named pyspark)
provide option for more restrictive firewall rule in ec2/spark_ec2.py,Default spark-ec2 security group permissions are too open
spark-submit for yarn prints warnings even though calling as expected ,Spark submit warning tells the user to use spark-submit
Add ADMM for solving Lasso (and elastic net) problem,Add ADMM for solving Lasso (and elastic net) problem
Add ADMM for solving Lasso (and elastic net) problem,Generic ADMM implementation for SVM; lasso; and L1-regularized logistic regression
Add AdaBoost algorithm to Spark MLlib,AdaBoost.MH; a multi-class multi-label classifier
Add gradient boosting algorithm to MLlib,Gradient boosting in MLLib
Add conf dir to CLASSPATH in compute-classpath.sh dependent on whether SPARK_CONF_DIR is set,SPARK_CONF_DIR should override all present configs
Add JavaScript into Javadoc to turn ::Experimental:: and such into badges,Java API docs do not show annotation.
Mark main methods experimental,Move main methods to examples
Executor fails to start when Command.extraJavaOptions contains multiple Java options,"Executors fail to come up if ""spark.executor.extraJavaOptions"" is set "
Support external aggregation in Spark SQL,Enable external sorting in Spark SQL aggregates
Prevent data loss when Streaming driver goes down,Prevent data loss in Spark Streaming on driver failure using Write Ahead Logs
Fixes and improvements for spark-submit/configs,Issues with `spark-submit`
spark-submit --name doesn't work in yarn-client mode,Spark-submit --name does not resolve to application name on YARN
add a config to replace SPARK_YARN_USER_ENV,Clean up use of setExecutorEnvs in SparkConf 
GLMNET implementation in Spark,Add an OWL-QN optimizer for L1 regularized optimizations.
Driver error org.apache.spark.scheduler.TaskSetManager - Loss was due to java.io.FileNotFoundException,Support multiple SparkContexts in the same JVM
Take advantage of AMRMClient APIs to simplify logic in YarnAllocationHandler,after receving allocated containers;amClient should remove ContainerRequest.
Add missing description to spark-env.sh.template,spark-submit does not set driver memory correctly
Add broadcast information on SparkUI storage tab,Broadcast variable memory usage not reflected in UI
Add recursive directory file search to fileInputStream,Support nested directories in Spark Streaming
Add broadcast hash join operator,Broadcast Join (aka map join)
Add broadcast hash join operator,rename Equals to EqualTo in Spark SQL expressions
Audit dependency graph when Spark is built with -Phive,Created forked version of hive-exec that doesn't bundle other dependencies
Error launching cluster when master and slave machines are of different virtualization types,Specifying the master instance type
Support resizable output buffer for kryo serializer,Allow user to set maximum Kryo buffer size
Support cross-building with Scala 2.11,[MLLIB] Univariate kernel density estimation
Add a utility to SparkConf that makes using Kryo really easy,spark.kryo.registrator shall use comma separated value to support multiple registrator
Windows Spark fails to work with Linux YARN,YARN | Spark job submits from windows machine to a linux YARN cluster fail
Executor UI improvement suggestions,Color GC time red when over a percentage of task time
NoSuchMethodError when invoking JavaPairRDD.reduce() in Java,JavaDoubleRDD doesn't contain max()
sc.textFile does not support non UTF-8 encodings,"add a parameter for  SparkContext(conf).textFile() method ; support for multi-language  hdfs file ;   e.g. ""gbk"""
Provide memory-and-local-disk RDD checkpointing,Provide operator to truncate lineage without persisting RDD's
Allowing user jars to take precedence over Spark jars does not work as expected,spark.files.userClassPathFirst doesn't work correctly
enhance MEMORY_AND_DISK mode by dropping blocks in parallel,Drop old blocks to disk in parallel when memory is not large enough for caching new blocks
Spark JAR compiled with Java 7 leads to PySpark not working in YARN,Add pyspark archives path to PYTHONPATH
Implicits declared in companion objects not found in Spark shell,Strange implicit resolution behavior in Spark REPL
spark on yarn can't start ,spark on yarn can't start 
yarn client mode Application Master memory size is same as driver memory size,generalize the type of categoricalFeaturesInfo to PartialFunction[Int; Int]
Make it easier to get Spark on YARN code to compile in IntelliJ,"Maven ""hadoop*"" Profiles Should Set the expected Hadoop Version."
Race condition in accessing cache locations in DAGScheduler,Race condition in DAGScheduler
Spark UI issues at scale,Improve Spark UI behavior at scale
web ui stage page becomes unresponsive when the number of tasks is large,SparkUI stage page hangs with many tasks
Spark 1.0.0 fails to run in coarse-grained mesos mode,Spark 1.0.0 is failing if mesos.coarse set to true
External hashing in PySpark,External aggregation in Python
spark-ec2 puts Hadoop's log4j ahead of Spark's in classpath,Spark's log4j.properties should always appear ahead of Hadoop's on classpath
spark.yarn.dist.* configs are not supported in yarn-cluster mode,spark.yarn.dist.* configs are not documented
Creating a SchemaRDD via sql() does not correctly resolve nested types,Case insensitivity breaks when unresolved relation contains attributes with uppercase letters in their names
web ui should not remove executors if they are dead,Driver UI should enable viewing of dead executors' logs
Stratified sampling implementation in PairRDDFunctions,Stratified sampling
Clean Multi-user semantics for thrift JDBC/ODBC server.,Thrift server doesn't reset current database for each connection
Clean Multi-user semantics for thrift JDBC/ODBC server.,spark.sql.shuffle.partitions is global; not per connection
Clean Multi-user semantics for thrift JDBC/ODBC server.,ThriftServer use only one SessionState to run sql using hive 
groupByKey and joins on raw data,Add MR-style (merge-sort) SortShuffleReader for sort-based shuffle
groupByKey and joins on raw data,In sort-based shuffle; store map outputs in serialized form
Move aggregation into shuffle implementation,Move aggregation into ShuffleManager implementations
Use application specific folders to dump metrics via CsvSink,Metrics can be accidentally aggregated against our intention
the error of comput rightNodeAgg about  Decision tree algorithm  in Spark MLlib ,error of  Decision tree algorithm  in Spark MLlib 
Null values when using App trait.,"Closure problems when running Scala app that ""extends App"""
Public API for DataTypes and Schema,user should be able to provide schema for table creation
Multi-way join,MultiWayBroadcastInnerHashJoin
Cost-based join reordering,Cost-based Optimizer Framework
Fix remaining Hive Commands,"Support ""dfs"" command"
Spark fails on windows YARN (HortonWorks 2.4),Spark AM not launching on Windows
Building and running tests with maven is extremely slow,Parallelize Scala/Java test execution
HAVING should be able to contain aggregate expressions that don't appear in the aggregation list. ,Support HAVING clause generated by Tableau
onStageSubmitted does not properly called so NoSuchElement will be thrown in onStageCompleted,StorageStatusListener should avoid O(blocks) operations
Running sc.parallelize(..).count() hangs pyspark,pyspark - RDD action hangs (after previously succeeding)
Running sc.parallelize(..).count() hangs pyspark,pyspark - RDD action hangs (after previously succeeding)
Support multiple SparkContexts in the same JVM,Multiple SparkContexts can coexist in one process
Data frame (or Pandas) like API for structured data,Adding data frame APIs to SchemaRDD
Feature scaling which standardizes the range of independent variables or features of data.,Add normalizeByCol method to mllib.util.MLUtils
Do not send SPARK_HOME from driver to executors,Separate driver spark home from executor spark home
Do not send SPARK_HOME from driver to executors,Separate driver spark home from executor spark home
Add KMeans MiniBatch clustering algorithm to MLlib,Implement the Mini-Batch KMeans
StorageStatusListener should avoid O(blocks) operations,JobProgressListener gets permanently out of sync with long running job
Design a proper progress reporting & event listener API,enhance spark listener API to gather more spark job information
Utils.getLocalDir had better check the directory and choose a good one instead of choosing the first one directly,Utils.getLocalDir() may return non-existent spark.local.dir directory
DiskBlockManager could add DiskChecker function for kicking off bad directories,Block Manager should catch exceptions in putValues
k-Nearest Neighbor classification and regression for MLLib,Approximate k-NN Models for MLLib
Add Artificial Neural Network (ANN) to Spark,"In ""local[N]""; free cores of the only executor should be touched by ""spark.task.cpus"" for every finish/start-up of tasks."
"In ""local[N]""; free cores of the only executor should be touched by ""spark.task.cpus"" for every finish/start-up of tasks.",Artificial neural networks for MLlib deep learning
"In ""local[N]""; free cores of the only executor should be touched by ""spark.task.cpus"" for every finish/start-up of tasks.",Add Convolutional Neural network to Spark MLlib
"In ""local[N]""; free cores of the only executor should be touched by ""spark.task.cpus"" for every finish/start-up of tasks.",Integrate convolutional deep belief networks for visual recognition tasks  
ArrayIndexOutOfBoundsException in scheduler,getAllowedLocalityLevel() throws ArrayIndexOutOfBoundsException
Exception: Could not locate executable null\bin\winutils.exe in the Hadoop ,Cannot save data to parquet files when executing from Windows from a Maven Project
Exception: Could not locate executable null\bin\winutils.exe in the Hadoop ,.save() Procedure fails
Exception: Could not locate executable null\bin\winutils.exe in the Hadoop ,NullPointerException while trying to launch local spark job
CSV import to SchemaRDDs,Implement functionality to read csv files
With auto.offset.reset; KafkaReceiver potentially deletes Consumer nodes from Zookeeper,KafkaReceiver minor changes to align with Kafka 0.8 
"globally shared SparkContext / shared Spark ""application""",Support a shared RDD store among different Spark contexts
Trouble running Spark 1.0 on Yarn ,Modify default YARN memory_overhead-- from an additive constant to a multiplier
Spark should treat writable as serializable for keys,Add a Hadoop Writable serializer
ApplicationState.MAX_NUM_RETRY should be configurable,Make ApplicationState.MAX_NUM_RETRY configurable
Hierarchical Implementation of KMeans,Bisecting k-means clustering
Apriori algorithm for frequent itemset mining,Add FP-growth algorithm to Spark MLlib
MesosExecutorBackend crashes in fine grained mode,Spark on Mesos not correctly setting heap overhead
MesosExecutorBackend crashes in fine grained mode,BlockManagerMasterActor: Got two different block manager registrations with Mesos
"Table name is not getting applied to their attributes after ""registerAsTable""","For a registered table in OverrideCatalog; the Analyzer failed to resolve references in the format of ""tableName.fieldName"""
Provide link to YARN executor logs on UI,Add executor log url to Executors page on Yarn
Multi-statement input to spark repl does not work,Compound lines in spark-shell cause compilation errors
Creating then stopping StreamingContext multiple times from shell generates duplicate Streaming tabs in UI,Multiple spark streaming tabs on UI when reuse the same sparkcontext
Use long as user / item ID for ALS,JavaRDDLike.groupBy[K](f: JFunction[T; K]) may fail with typechecking errors
Build should not run hive compatibility tests by default.,Hive should not be enabled by default in the build.
Model SerDe in MLlib,Ability to re-create ML models
Unsupported parquet datatype optional fixed_len_byte_array,Cannot handle Parquet type FIXED_LEN_BYTE_ARRAY
Standalone mode can't access secure HDFS anymore,Support for accessing secured HDFS in Standalone Mode
Add Date datatype support to Spark SQL,Add Date type support
Can't delete local dir on executor automatically when running spark over Mesos.,Should delete temporary local directories
OUTER JOINs cause ClassCastException,scala.collection.mutable.HashSet cannot be cast to scala.collection.mutable.BitSet
Reading from S3 returns an inconsistent number of items with Spark 0.9.1,Distinct is broken
Remove special handling of Hadoop JobConf,Remove all unnecessary broadcasts
Add config property to disable incremental collection used in Thrift server,Add config property to disable incremental collection used in Thrift server
Mesos doesn't handle spark.executor.extraJavaOptions correctly (among other things),Mesos doesn't handle spark.executor.extraJavaOptions correctly (among other things)
VPC Issue while creating an ec2 cluster,EC2 cluster creation on VPC
case class cannot be used as key for reduce,Type mismatch when defining classes in Spark REPL
case class cannot be used as key for reduce,Closure inside RDD doesn't properly close over environment
Stacked Auto Encoder (Deep Learning ),Autoencoder
Input data size of CoalescedRDD is incorrect,Input metrics don't work for coalesce()'d RDD's
BasicBlockFetchIterator#next can wait forever,Spark can hang when fetching shuffle blocks
`Spark-submit` overrides user application options,spark-shell doesn't accept flags
`Spark-submit` overrides user application options,spark-submit processes app cmdline options
Add Length support to Spark SQL and HQL and Strlen support to SQL,Add LENGTH and DATALENGTH functions to Spark SQL
Make unidoc part of our test process,Build docs on doc changes
Improve compatibility with parquet file/table,Add a conf to configure if we always read Binary columns stored in Parquet as String columns
Upgrade Tachyon dependency to 0.5.0,Update build script to Tachyon 0.5.0
Upgrade Tachyon dependency to 0.5.0,Update make-distribution.sh to download Tachyon 0.5.0
Upgrade Tachyon dependency to 0.5.0,Update Tachyon dependency to 0.5.0
Upgrade to Akka 2.3,Update akka to version 2.3.4
Add Mima binary checks to Flume-Sink,Add Mima test for Spark Sink after 1.1.0 is released
Mechanism for escaping spark configs is not consistent,spark.*.extraJavaOptions are evaluated too many times
Document standalone-cluster mode now that it's working,Update documentation to clarify whether standalone-cluster mode is now officially supported
TorrentBroadcast cannot broadcast very large objects,Address various 2G limits
HiveContext does not support dots in column names. ,Special chars in column names is broken
Add location filtering to Twitter streams,Add locations parameter to Twitter Stream
Add location filtering to Twitter streams,streaming-twitter pass twitter4j.FilterQuery argument to TwitterUtils.createStream()
